title|content
인류는 지금 기후변화와의 싸움에서 패배하고 에마뉘엘 마크롱 프랑스 대통령은 지난 년 월 일 파리에서 열린 원 플래닛 서밋  에서 이같이 말했다 파리기후협정 체결 주년을 기념해 프랑스 정부와 유엔 세계은행이 공동 주최했던 행사다 당시 행사에선 기후변화 대응에 관한 협약 사항들이 발표됐다 핵심은 기후행동   이하   의 탄소중립 달성을 촉진하는 글로벌 금융사자산운용사들의 모임이다 금융사들이 온실가스 배출들을 상대로 탄소배출 감축과 기후변화 대응 노력을 압박하는 것이 골자였다 자본을 무기 삼아 온실가스 감축 노력을 이끌어 낸다는 것이다 현재 개 이상의 투자자가 참여하고  참여 기관의 총자산 규모는 조 달러약 경조 원를 넘는다 이  가 출범 약 년 만에 대형 금융사들이 잇따라 탈퇴를 선언하면서 크게 흔들리고 모건  핌코연이은 탈퇴 선언  최근 모건과 스테이트스트리트 글로벌 핌코가   탈퇴를 선언했다 블랙록 은 본사가 아닌 자회사 블랙록 인터내셔널로 회원 자격을 이전하겠다고 밝혔다 핌코는 탈퇴를 선언하며 우린 우리의   참여가 더 이상 지속 가능성에 대한 핌코의 접근 방식과 일치하지 않는다는 결론을 내렸다고 밝혔다 파이낸셜타임스와 뉴욕타임스 등은 글로벌 금융사들의 잇따른   탈퇴 러시를 오는 월부터 시행될 예정인  의 단계 전략 때문이라고 분석했다 지난 년간  는 단계 전략으로 전 세계에서 온실가스를 가장 많이 배출하는 개 이 넷 제로 탄소 순 배출량 제로 목표 달성과 기후 위기 대응 관련 거버넌스를 도입하고 진행 상황을 공개하도록 촉구해왔다 이는 실제로 효과를 내기도 했는데  가 년 낸 보고서에 따르면 개  중 가 넷 제로 정책을 시행 중인 것으로 나타났다 년 그룹이 출범했을 때  미만이었던 것보다 크게 늘어난 수치다 문제는 월부터 시행될 단계 전략이 금융사들에 이보다 더욱 적극적인 행동을 압박하고  점이다 자산 관리 회사들에 엑손모빌 월마트 등 회사들이 화석연료를 더 적게 사용할 수  정책을 채택하도록 압력을 가하라고 요구하는 것이다 가 탈퇴한 계기도 단계 전략 때문이다 는   탈퇴를 발표하며 단계 전략에서 들에 요구하는 사항이 지나치다 자사의 독립적인 접근 방식과 맞지 않다고 밝혔다 가 요구하는 적극적 행동이 금융사들의 수탁 의무와 배치된다는 점도 크게 작용한 것으로 보인다 수탁 의무는 자산 운용을 위임받은 자가 자산을 맡긴 이의 이익을 위해 노력해야 하는 의무를 뜻한다 블랙록은 탈퇴 결정 배경으로 의 탈탄소화를 위한  의 목표와 대다수 고객의 경제적 수익을 우선시하는 수탁 의무 사이의 충돌을 꼽았다 이와 함께 동시에 달성하기 어려운 기후 위기 대응과 경제 발전의 속성이 케이키즘을 드러냈다는 분석도 나온다 케이크를 갖고  동시에 먹을 수 없듯이 성취 불가능한 두 가지를 가리키는 케이키즘처럼 애초에 기후 위기 대응과 경제 발전은 동시에 성취할 수 없다는 것이다  반대해 온  공화당의 승리  전망 흐림  금융사들의   탈퇴 러시는 미국 공화당의 승리이기도 하다고 는 분석했다 환경사회지배구조에 강하게 반대하는 공화당 내 일부 강경 의원들을 중심으로  투자와 이에 동참하는 금융사들에 대한 압박이 거세게 이뤄지고  가운데  는 반 캠페인의 대표적인 표적이 됐다 지난해부터는  에 참여하는 금융사들을 상대로 반독점법 위반 여부 조사도 시작됐다 반독점법 위반 여부 조사를 진행하는 미 하원 법제사법위원회의 위원장은 공화당 내 강경파이자 친트럼프 인사로 꼽히는 짐 조던 하원의원이다  를 기후에 집착하는  카르텔이라고 비난한 바  조던 의원은 모건과  등의 탈퇴 발표가 나온 뒤인 지난달 일 에 올린 글을 통해 그들의   탈퇴 소식은 자유와 미국 경제를 위한 더 큰 승리를 의미한다며 더 많은 금융기관들이 이를 따라 담합적인  조치를 포기하기를 바란다고 밝혔다 환경과 기후에 관한 문제가 정치화되는 데 대한 우려의 목소리도 커지고  블룸버그는 최근 대형 금융사들의 탈퇴로 흔들리는   상황이 전하는 핵심 메시지는 지구온난화가 정치화될 때에는 전문 투자자들도 그들의 일을 적절하게 해내지 못한다는 것이라고 전했다  는 최근 금융사들의 탈퇴 결정에도 물러설 수 없다는 입장이다 이들은 지난달 일 홈페이지를 통해 발표한 입장문에서  를 뒷받침하는 기본 원칙은 기후 위험이 곧 재정적 위험이라는 것이라며 기후 위기가 장기적인 주주 가치와 경제 전반에 재정적 위험을 초래하고  우리는 지금 한 걸음도 물러설 여유가 없다고 밝혔다 하지만 앞으로도  의 전망은 밝지 않다 월에 치러질 미국 대통령 선거를 비롯해 총 개국에서 선거가 치러지는 올해 도널드 트럼프 전 미국 대통령 등 우파 정치인들이 녹색 정책 철회를 공약으로 내세우고  블룸버그에 따르면 유럽에서는 기후행동에 반대하는 우파 정당들이 월 유럽의회 선거 이후 대표성을 높일 가능성이 크다는 여론조사 결과가 나왔다 이에 주요 선거들을 거치며 기후변화와의 싸움에 나설 전력도 명분도 약화될 수  우려가 커지고 '
중진공 제조  곳 혁신바우처 지원모집 경쟁률 대 |파이낸셜뉴스 중소벤처진흥공단이 제조 중소의 경쟁력 강화를 지원하기 위해 년 중소 혁신바우처 차 참여을 최종 선정했다   일 중소벤처진흥공단에 따르면 중소 혁신바우처는 컨설팅 기술지원 마케팅 등 가지 서비스를 정부지원금과 분담금으로 구성된 이용권바우처 제공을 통해 지원하는 사업이다 올해 지원예산은 총 억원 규모로 이중 차 모집을 통해 약 억원 규모를 지원할 계획이다   올해 혁신바우처 차 참여은 일반 바우처 탄소중립 경영혁신 바우처 중대재해예방 바우처 재기컨설팅 바우처 등 개 유형으로 구분해 모집했다 이번 모집은 약 개사 이상의 제조 중소이 신청해 대 의 경쟁률을 기록했다   특히 중진공은 기존 신청요건 중 제품매출액 비율 이상인  기준을 폐지하고 중소 기본법령에 따른 주업종 판단 기준만을 적용해 지원대상을 확대했다 제품매출 억원 상품매출 억원 기타매출 억원인 제조 중소의 경우 과거에는 혁신바우처 지원 제외대상이었으나 올해부터는 신청 가능하다   중진공은 차 신청을 대상으로 사업화 역량 성장 가능성 등을 평가해 지원 개사를 최종 선정했다 선정된 은 월부터 협약을 체결해 오는 년 월까지 바우처 서비스를 이용할 수    강석진 중진공 이사장은 년에도 제조 소의 경쟁력 강화를 위해 중소 혁신바우처 사업을 적극적으로 지원하겠다며 앞으로도 중소을 위한 다양한 맞춤형 지원 서비스를 확대해 나가겠다고 전했다
제조  역량 강화 혁신바우처 차 참여 선정|'차 모집 통해 약 억원 규모 지원계획차 신청 중 지원 개사 선정



서울뉴시스 중소벤처진흥공단 전경 사진뉴시스 서울뉴시스이수정   중소벤처진흥공단중진공이 제조 중소의 경쟁력 강화를 지원한다 중진공은 년 중소 혁신바우처 차 참여을 최종 선정했다고 일 밝혔다중소 혁신바우처는 컨설팅 기술지원 마케팅 등 가지 서비스를 정부지원금과 분담금으로 구성된 이용권 제공을 통해 지원하는 사업이다 올해 지원예산은 총 억원 규모로 이 중 차 모집을 통해 약 억원 규모를 지원할 계획이다올해 혁신바우처 차 참여은 일반 바우처 탄소중립 경영혁신 바우처 중대재해예방 바우처 재기컨설팅 바우처 등 개 유형으로 구분해 모집했다 이번 모집에는 약 개사 이상의 제조 중소이 신청해 대 의 경쟁률을 기록했다중진공은 기존 신청요건 중 제품매출액 비율  이상인  기준을 폐지하고 중소 기본법령에 따른 주업종 판단 기준만을 적용해 지원대상을 확대했다 예를 들어 제품매출 억원 상품매출 억원 기타매출 억원인 제조 중소의 경우 과거에는 혁신바우처 지원 제외대상이었으나 올해부터는 신청 가능하다중진공은 차 신청을 대상으로 사업화 역량 성장 가능성 등을 평가해 지원 개사를 최종 선정했다 선정된 은 이달부터 협약을 체결해 오는 년 월일까지 바우처 서비스를 이용할 수 한편 중진공은 중대재해처벌법중처법 시행에 따른 영세 중소의 대응 지원을 위해 중대재해예방 바우처를 신설했다 중처법 대응이 어려운 제조 소을 대상으로 작업환경 위험성 평가 근로자보건관리 등 안전보건관리체계 구축과 안전장비 구입 등을 지원한다'
충주시 탄소중립 그린도시 조성| 청주충주시의 탄소중립 그린도시 사업 시행 계획이 환경부의 최종 승인을 받았습니다충주시는 년까지 중앙탑면 용전리와 주덕읍 화곡리 일대 만 에 암모니아에서 생산되는 수소 충전소를 구축하고 녹지와 공원을 조성한다고 밝혔습니다
울산시 비산업부문 온실가스 배출량  감축나서|'탄소중립 녹색성장 기본계획 추진 



 파이낸셜뉴스 울산최수상  울산시는 년까지 비산업부문의 온실가스 배출량을 지난 년 대비  감축하겠다고 일 밝혔다   이를 위해 울산시는 년년 년을 계획기간으로 탄소중립 녹색성장 기본계획을 수립했다   주요 내용은 개 부문 개 세부사업건물 수송 농축산 폐기물 흡수원과 폭염 풍수해 등 기후위기 적응대책 공유재산 관리 및 대응방안 교육홍보 등 기후위기 대응기반 강화대책 등을 담고 시 관계자는 온실가스 감축 목표를 달성할 수  탄소중립 녹색성장 기본계획을 내실있게 추진하겠다라며 시민들에게도 자원 재활용 대중교통 이용 등 탄소중립 생활 실천을 당부했다'
성남시자동차 탄소중립 포인트제최대 만원 지급|제공성남시스포츠서울성남좌승훈경기 성남시는 오는 일부터 일까지 자동차 탄소중립 포인트제 참여자를 모집한다고 일 밝혔다이 제도는 온실가스 감축과 미세먼지 저감을 유도하기 위해 차량의 주행거리 감축 실적에 따라 연간 만원에서 최대 만원의 인센티브를 지급한다대상 차량은 인승 이하 비사업용 승용승합차이며 선착순 총 대다전기 하이브리드 수소차 등 친환경 차량은 제외다참여 차량은 제도 가입일 기준 누적된 하루 평균 주행거리와 참여 기간의 하루 평균 주행거리를 비교 산정한 주행거리 감축률에 따라 연말에 포인트를 차등 지급받는다희망자는 자동차 탄소중립 포인트 홈페이지에서 회원가입을 해야 한다 이후 일 이내에 휴대전화로 전송되는 한국환경공단의 문자메시지 링크를 통해 차종과 번호판이 보이는 차량 전면 사진 누적 주행거리가 표시된 계기판 사진을 등록하면 된다 등록 사진은 모집 기간에 촬영한 사진이어야 한다성남시는 지난 년부터 이 제도를 운용해 자동차 주행거리를 감축한 명에게 억만원의 인센티브를 지급했다
