title|content
인천시 오스테드와 해상 풍력 구축 협력|'지역 수용성 제고 인프라 구축 해상 풍력 공급망 등전 세계 위 오스테드 지난해 국내 최대 규모 발전 허가



유정복 인천광역시장이 일현지시각 덴마크 코펜하겐 오스테드 본사에서 열린 인천시오스테드 해상풍력 및 지역산업육성 협력  체결식에서 토마스 투너 앤더슨 오스테드  이사회 의장과 협약을 체결한 뒤 기념촬영을 하고  사진인천시유정복 인천광역시장이 전 세계 해상 풍력 위 인 오스테드와 해상 풍력 공급 망 확충에 힘을 모으기로 했다일 인천시에 따르면 유럽을 출장 중인 유 시장이 일현지 시간 덴마크 코펜하겐에서 국영인 오스테드 와 인천오스테드 해상 풍력 발전 사업 및 인천 지역 해상 풍력 산업 기반 구축 업무 협약을 체결했다오스테드는 지난해 월 인천 해역과 인근 배타적경제수역에서  규모의 해상 풍력 발전 사업 허가호 호를 받았다 총 사업비는 억 달러로 단일 단지로는 국내 최대 규모다이날 협약은 유 시장과 토마스 투너 앤더슨 오스테드  이사회 의장이 체결했다 협약식에는 라스 아가드 덴마크 기후에너지유틸리티부 장관 스벤올링 주한 덴마크 대사가 참석했다협약을 통해 시는 해상 풍력 사업 관련 지역 수용성 제고 정책 수립 기반 시설인프라 구축 등 행정 지원에 나선다 오스테드는 지역 주민과 상생하는 모범 모델을 만들고 지역 내 해상 풍력 공급 망 산업 육성에 적극 노력하기로 했다유 시장은 우리시는  인천시 탄소 중립 비전을 선언하고 석탄 화력 폐지와 신 재생 에너지 확대를 최우선 전략과제로 추진하고 며 해상 풍력은 탈탄소화를 달성할 수  유력한 재생 에너지 수단이자 지속 가능한 글로벌 신 산업 분야라고 설명했다이어 오늘 업무 협약을 통해 지역과 상생하는 해상 풍력 사업이 확대되고 지역 산업이 한층 더 성장하는 좋은 계기가 될 것으로 기대한다고 강조했다토마스 투너 앤더슨 의장은 오스테드는 새로운 에너지 산업 전환을 추진하고  공급 망 부분에서 한국은 놀라운 기술 연구와 제조 생산력을 가지고  협력이 꼭 필요하다며 인천시와 업무 협약으로 관련 산업이 더욱 발전할 것이라고 밝혔다라스아가드 장관은 기후변화는 전 인류의 문제로 한국과 덴마크는 년부터 녹색성장동맹으로 함께 대응하고 며 인천과 오스테드의 프로젝트가 성공적으로 달성 돼 기후 환경 미래에 기여하길 바란다고 말했다한편 인천시는 오는 년까지  규모의 해상풍력발전단지를 조성할 계획이다 오스테드를 포함한 민간 사업과 공공 주도 사업 등 총 조원의 사업비를 투입한다'
충북교육청 학교 환경교육 만만원 지원|'충북교육청이 도내 모든 학교에 환경교육 운영비를 지원한다충북교육청은 년 충북학교환경교육 기본계획에 따라 충북지역 모든 학교를 모두를 위한 탄소중립학교로 지정해 의무적으로 기후변화 환경교육을 하도록 하고 교당 만만원의 환경교육 운영비를 지원한다고 일 밝혔다교원교직원 역량강화 연수 단위 학교 대상 컨설팅을 지원해 내적인 업무 역량을 강화할 방침이다 환경교육 자료를 개발보급할 예정이다



충북교육청 전경 사진아이뉴스 도내 유초중고특수학교를 대상으로 개교를 공모해 탄소중립 실천학교로 선정 교육과정 연계 환경교육 수립학교 공동체 역량강화탄소중립 실천 문화 확산에 나선다지난해 환경교육 비전 선포식에서 지역별로 설정한 환경교육과제를 중심으로 지역 환경교육단체와 협력도 강화한다기후위기 대응과 탄소중립 실현을 위해  탄소중립 추진단과 학교별  탄소중립 실천단을 구성해 일회용품 사용 줄이기 종이 없는 회의 등 탄소중립문화를 실천할 수  유도할 계획이다도교육청은 이날 교육연구정보원 시청각실에서 학교 환경교육 담당자를 대상으로 년 충북학교환경교육 기본계획 설명회를 열기도 했다우관문 창의특수교육과장은 학교 환경교육을 더 확대하고 지역 기반의 실천 중심 환경교육에 힘쓰겠다고 말했다'
유치원 앞 눈부터 치우기 역발상 효과 이 정도라니|'스웨덴 칼스코가 보행자 구역 먼저 제설 안전한 대중교통 만들기 주목해야 하는 이유



 폭설 속 멈출 수 없는 삽질 일 강원 강릉시 홍제동에서 주민들이 폭설이 계속 쏟아지는 가운데 주차한 차를 빼내기 위해 삽질을 하고  연합뉴스 아침에 눈을 떠보니 설국이었다 당연히 여기저기서 눈 치우는 소리가 들린다 제설작업의 순위는 어디일까 고속도로 외곽순환도로 그 다음에 국도 지방도 골목길 차가 많이 다니는 길부터 먼저 치우는 게 우리네 상식이다 그런데 이런 나라가  눈이 많이 오는 날이면 유치원 앞길부터 치운다 그 다음 대규모 직장 출퇴근 보행로를 치우고 다음으로 학교 근처 자전거 도로를 치우고 그 다음으로 큰 자동차 도로를 치운다이 나라는 어디일까 그리고 왜 이런 역발상을 했을까스웨덴의 소도시 칼스코가의 역발상인구 만 명이 조금 넘는 스웨덴의 작은 도시 칼스코가 당국은 년대 들어 눈 내린 뒤 도로 발생 사고를 분석해본 뒤 깜짝 놀랄 결과를 얻었다눈이 내린 뒤 도로에서 발생한 사고를 분석해보니 예상과 달리 자동차 사고보다 보행자와 오토바이 사고가 배 높았다 피해자 대부분은 여성이었다연합뉴스 년 월일보행자와 오토바이 사고가 자동차 사고보다 배 더 많았고 특히 피해자 대부분이 여성이었다 왜 여성인지 당국이 여성들의 교통패턴을 분석해보니 이러했다 여성들은 남성보다 도보자전거대중교통을 이용하는 비율이 높았다 특히 출근 전 아이를 맡기는 유치원과 학교 여성 직원이 많은 대규모 직장 주변에서 여성들의 도보 자전거 대중교통 이용률이 두드러졌다그러나 눈이 오면 외곽도로 등 차가 많이 다니는 길부터 우선 제설작업을 하다보니 눈 길 미끄러짐에 의한 낙상 사고 피해자는 당연히 차를 덜 타고 다니는 여성들이 입고  것이다 이후 칼스코가는 제설작업의 방향을 바꿨다 이름하여 제설작업에 성평등 관점의 도입참고로 스웨덴 정부는 년부터 지방자치단체가 젠더 관점을 통해 모든 정책과 활동을 재평가하도록 요구하는 성평등 계획을 도입했다그렇게 자동차 도로가 아닌 보행자 구역 먼저 제설작업을 하는 것으로 바꾸었고 구체적인 우선 순위는 아래와 같다유치원대규모 직장 출퇴근길학교 근처 및 자전거도로큰 자동차 도로 순이렇게 바꿨더니 결과는 어땠을까결과는 어땠을까 오히려 예산절감 효과를 얻었다 당초 빙판길 보행자 미끄러짐 사고로 인한 의료 비용이나 생산성 손실액이 도로 유지 관리 비용의 약 배였는데 우선순위를 바꿔버리자 미끄러짐 사고가 줄어들었다 실제로 우선순위를 바꾼 스톡홀름시도 약 에 달하는 공동 자전거 도로와 보행자 도로의 눈을 우선적으로 치우기 시작한 이후 빙판길 사고는 절반으로 줄었다고 한다 그래서 스웨덴 당국은 이런 말을 한다더 이상 비용이 들지 않는다 인치 쌓인 눈 속에서 운전하는 게 그만큼 쌓인 눈 속에서 휠체어나 자전거를 밀어내는 것보다 쉽기 때문이다 년 월일당시에는 이게 젠더관점 행정사례로 소개되었다 그러나 지금은 유의미한 기후대응이 된다 이유는 간단하다 여성이 남성보다 대중교통을 많이 이용하는 경향이  때문이다 조금 더 여성의 관점에서 편리하고 특히 안전한 대중교통 체계를 만들어간다면 대중교통 이용률을 높여 탄소배출 절감에 도움이 될 수  이야기다 프랑스에서는 대중교통 사용자의 가 여성이며 미국 필라델피아와 시카고에서는 각각  와 가 여성이다 런던에서는 여성이 남성보다 주중에 약  더 많이 이용하고   년 월일출퇴근 뿐 아니라 아이들 등하교 가사관리 간병 등의 많은 부분을 여성이 담당하고  때문에 여성이 남성보다 더 많이 긴 거리를 걷는다는 분석도 영국 정부의 연구에 따르면 승객 특히 여성이 더 안전하다고 느끼면 대중교통을 이용할 승객이  더 늘어날 것으로 나타났다  년 월일제설작업의 우선순위 안전한 대중교통 만들기 이런 섬세한 정책들이 길 위의 탄소중립 여정에  다시금 주목받아야 할 이유이다참고자료 김계연 스웨덴은 제설작업도 성평등 관점에서 한다는데 연합뉴스 년 월일              년 월일덧붙이는 글   이 내용은 지난 년 월일  라디오 오늘의 기후 방송내용을 정리한 글입니다 오늘의 기후는 지상파 라디오 최초로 기후위기 대응 내용으로 매일 편성되었으며     라디오를 통해 오후 시부터 시분까지 시간 분 분량으로 매일 방송되고  유튜브 라이브 라디오 채널와 팟캐스트도 병행하고  많은 관심 부탁드립니다'
부산 영도벽산비치타운 등 곳 그린아파트 선정|'탄소중립 생활 실천 우수 공동주택 상장상금 최고 만 원 수여



년도 그린아파트 인증제 우수상을 받은 부산 수영구 남천동 삼익비치타운 아파트 부산일보부산시는 탄소중립 생활 실천을 유도하고 이를 확산하기 위해 년도 그린아파트 곳을 선정했다고 일 밝혔다그린아파트 인증제는 비산업 부문 온실가스를 감축하기 위해 세대 이상 공동주택을 대상으로 년부터 시행하고 이 인증제는 전년도와 비교해 전기상수도가스 절감률  재활용품 분리수거율 음식물쓰레기 감량률 승용차 요일제 참여율 탄소포인트제 참여율 온실가스 진단컨설팅 참여율  탄소중립 마을 참여율 등 정량적 지표와 온실가스 감축 노력활동 등 정성적 지표를 합쳐 개 항목에 대한 개선사항을 평가한다시는 가구 이상 아파트 곳을 대상으로 개 자치구군과 평가위원회의 평가를 거쳐 최우수상에 영도구 영도벽산비치타운을 선정했다수영구 삼익비치아파트와 사하구 신평현대아파트는 우수상을 사상구 주례한일유앤아이아파트와 주례반도보라매머드아파트 서구 협성르네상스타운 남구 현대비치아파트가 장려상을 받았다그린아파트에 선정되면 지구의 날 행사 때 상장과 상패가 수여되며 탄소중립 생활 실천 사업비로 최우수 만 원 우수 만 원 장려 만 원을 각각 받는다 이 사업비는 아파트 내  조명 교체와 나무 심기 경비실 미니태양광 설치 등에 쓸 수 그린아파트 인증제를 통한 온실감스 감축량은 지난해에만 총 만 을 기록했다이병석 시 환경물정책실장은 공동주택 입주민들이 그린아파트 인증을 위해 탄소중립 생활을 적극적으로 실천해주시길 당부드린다고 말했다'
삼성물산 업계 첫 탄소감축 콘크리트 방법론 공식 인증|저탄소  설치중인 래미안 트리니원 현장 모습 사진삼성물산 제공삼성물산 건설부문이 대한상공회의소 탄소감축인증센터로부터 저탄소 콘크리트 제조현장적용 과정에서 객관적 탄소감축 효과 측정 기준절차가 담긴 방법론을 개발해 공식 인증 받았다고 일 밝혔다   탄소저감 콘크리트 방법론은 콘크리트 제조과정에서 탄소를 줄일 수  원리를 비롯해 감축량을 산정하는 방식 현장 적용 시 모니터링 절차 등 탄소감축과 관련된 일련의 검증 절차를 규정한 것이다 삼성물산은 자발적 탄소시장을 운영 중인 탄소감축인증센터로부터 국내 건설업계 처음으로 인증을 받게 됐다   시멘트가 주원료인 콘크리트는 건설의 핵심 자재지만 제조과정에서 많은 양의 이산화탄소를 배출하는 온실가스의 주요인으로 인식된다   삼성물산은 일반 콘크리트 대비 탄소배출량을 약  낮춘 저탄소  를 개발해 래미안 현장반포주공단지 주구에 도입 중이며 최근에는 시멘트를 전혀 사용하지 않아 탄소배출량이 약  낮아지는 제로 시멘트 보도블록을 개발하기도 했다   이를 적용해 일반 콘크리트 대비 당 톤의 추가적 탄소감축 효과가 발생할 것으로 전망된다는 게 회사측 설명이다 삼성물산은 탄소중립을 실현하기 위한 탄소배출권을 확보할 수  기반을 마련했다는데 의의를 두고    한양대 탄소중립스마트건축센터장 태성호 교수는 시멘트 대체재료의 정책적 유인 동기가 부족한 상황에서 삼성물산의 탄소감축 방법론 승인은 건축 재료의 탈탄소화 측면에서 의미가 크다고 설명했다   정호진 삼성물산 품질실장부사장은 이번 승인을 통해 일회성이 아닌 지속가능한 탄소감축 방법론에 대해 공식 인증받았다는 데 큰 의미가 면서 이를 통해 회사 기술에 대한 신뢰도 향상은 물론 향후 국내외 다양한 친환경 사업에 긍정적인 효과로 이어지길 기대한다고 말했다
해양에너지 분기 경영현황 설명회 개최경영 다짐|해양에너지는 일 회사 대강당에서 전임직원들을 대상으로 분기 경영현황설명회를 개최했다고객과 함께 미래를 밝히는 필환경 종합에너지 해양에너지대표 정회는 일 회사 대강당에서 전임직원들을 대상으로 분기 경영현황설명회를 개최했다이날 행사는 정회 대표가 지난해 경영실적 및 올해 경영계획과 장기성장계획을 직접 공유하며 직원들과 소통하는 자리를 가졌다 회사는 안전을 최우선으로 안전문화와 보건환경관리 안전시스템 시설안전관리 및 비상대응을 중점 추진 과제로 선정했다글로벌 실물자산 지속가능성 벤치마크 인증과 넷 제로  달성 및 지역사회와 함께 성장하는 을 목표로 환경사회지배구조경영을 다짐해다 회사는 순찰차량을 친환경 하이브리드 차량으로 변경하고 태양광 발전사업을 확대하는 등 친환경 가치를 추구하며 지속적인 사회공헌활동을 통해 지역사회에 기여할 것을 약속했다정회 대표는 일상적인 업무들이 작지만 큰 성과를 가져올 수도  반대로 큰 사고를 일으킬 수도 며 본인의 업무에 큰 책임을 가지고 잘 실행해나가며 값진 한해가 되길 바란다고 당부했다한편 해양에너지는 광주광역시와 전남 개 시군에 안전한 도시가스 보급과 신재생에너지 사업으로 지역 내 그린뉴딜 및 탄소 중립 달성을 위해 노력하고  해양에너지의 투자사인 맥쿼리인프라는 국내투자자들이  이상의 지분을 보유하고  코스피에 상장된 국내 최대 규모의 인프라펀드이며  경영활동을 통해 지역과 함께 성장 발전할 수  최선을 다하고 
풍향계 모바일 시대 노태문성공 비법 조언 서정진|앵커 한 주간  최고 경영자들 동향을 살펴보는  풍향계 시간입니다 이번 주는 노태문 삼성전자 사장과 서정진 셀트리온 회장 이야기를 김종력 김주영 가 전해드립니다삼성전자의 스마트폰 사업을 이끌고  노태문 사장 갤럭시 는 이제 시작이라며 모바일 인공지능 생태계 구축을 시사했습니다노 사장은 최근 모바일  시대를 열다라는 제목의 기고문을 사내에 올렸습니다 우선 노 사장은 인공지능 기술만큼 세기적 판도 변화를 이끌 혁신은 없었다며  기술에 기대감을 보였습니다이어 모바일 기기가 의 가장 중요한 시작점이며 갤럭시가 모바일  시대에 중요한 역할을 해야 한다고 밝혔습니다 그러면서 폭넓은 제품 포트폴리오 열린 협력 철학 등을 바탕으로 모바일  시대를 열고 전 세계로 확산하겠다고 강조했죠또 노 사장은 많은 사용자가 갤럭시  기능을 일상에 활용하고 면서 검색 도구 서클 투 서치와 장벽 없는 소통을 가능케 한 실시간 통역 등을 예로 꼽았습니다끝으로 노 사장은 인공지능을 의미  활용하고 많은 가능성을 열어가는 것은 결국 사용자라며 갤럭시 를 어떻게 활용하고 일상을 바꿔 나갈지 설레는 마음으로 기대하겠다고 밝혔습니다흙수저 신화로 잘 알려진 서정진 셀트리온 회장 성공하는 가 정신을 주제로 청년들과 토론의 시간을 가졌습니다서 회장은 최근 대학생과 청년 창업희망자 자영업자 등 여명이 참석한 청년토론회에 참석했습니다 이 자리에서 서 회장은 나도 흙수저 출신이라며 셀트리온을 창업하기까지의 역경을 언급했습니다그러면서 젊음의 특권은 고생해도 즐거운 추억으로 돌릴 수  것이라며 꿈을 정했다면 포기하지 말고 미친 듯이 끝까지 하면 여러분도 성공할 수 고 말했습니다이어 서 회장은 성공은 혼자 하는 게 아니라 같이 하는 것이라면서 똑똑한 게 성공의 필요조건이라면 충분조건은 좋은 사람이다 주변에 친구가 많아야 한다고 강조했습니다또 서 회장은 세계에서 한국인이 경쟁력이  만큼 여러분도 경쟁력이 며 우리 때보다 여러분들에게 더 많은 길이 열려  그중에 가장 좋아하는 걸 찾아 죽을 때까지 가라고 조언했습니다최정우 포스코그룹 회장 임기 만료가 한 달 앞으로 다가오면서 최초의 연임 완주 가 될 전망입니다최 회장은 지난 년 회장에 올랐고 년 연임에 성공했습니다 그리고 다음 달 임기 만료를 앞두고  포스코그룹 역사에서 연임에 성공한 회장은  임기를 완주하는 건 최 회장이 처음입니다최 회장은 재임 기간 신성장 동력을 적극 발굴해 그룹의 미래 가치를 키웠다는 평가를 받습니다 차전지 소재 사업이 대표적인데요 공급망부터 생산까지 국내 유일 차전지 수직계열화를 구축했죠또 올해 철강 시황 악화로 예산을 삭감하는 과정에서도 안전 예산은 줄이지 않았을 정도로 안전 문화 정착에 노력한 점도 좋은 점수를 받고  세계철강협회장으로 글로벌 철강산업의 탄소중립에 앞장선 것도 높게 평가받고 하지만 재작년 포항제철소가 사상 처음 침수되는 일을 겪었고 최근에는 이사회의 호화 해외 출장 의혹 등으로 시민단체로부터 고발을 당하기도 했습니다박영우 대유위니아그룹 회장 억 원이 넘는 임금을 체불한 혐의로 구속됐습니다박 회장은 최근 구속 전 피의자 심문을 받기 위해 법원에 출석했는데요 영장실질심사 끝에 법원은 증거 인멸 및 도주의 우려가 며 구속 영장을 발부했습니다박 회장은 지난 년 월부터 지난해 월까지 직원 명의 임금과 퇴직금 억원을 지급하지 않은 혐의를 받고  이에 박 회장은 경영에는 관여하지 않았다며 임금 체불 등에 대해 형사적인 책임이 없다고 주장해 왔죠하지만 검찰은 회사 경영 상황을 세세히 보고받는 등 실질적으로 그룹 운영 전반에 관여한 정황을 포착하고 박 회장을 임금 체불 사태의 최고 책임자로 지목했습니다한편 박 회장은 지난해 국회 국정감사에서 골프장 매각 대금으로 문제를 해결하겠다고 밝히기도 했는데요 대금을 마련하고도 체불 임금을 지급하지 않아 위증했다는 혐의도 받고 오픈의 샘 올트먼 최고경영자 소프트뱅크그룹 손정의 회장 등이 천문학적인 자금력을 동원하겠다며  반도체 패권 경쟁에 불을 지폈습니다반도체 분야에 새로운 시장이 열리고  건데요 과 정부의 원팀 대응이 필요해 보입니다 지금까지  풍향계였습니다연합뉴스 기사문의 및 제보  카톡라인 
현대차 브라질 친환경 기술에 조억원 투자룰라 중요한 성장 |정의선오른쪽 현대자동차그룹 회장이 일현지시간 브라질 룰라 대통령가운데과 제랄도 알크민 부통령을 만나 고성능 수소 하이브리드 롤링랩  비전  모형을 들고 기념촬영을 하고  현대차 제공현대자동차그룹이 친환경 미래 기술을 키우는 브라질에 조억원의 투자를 약속했다현대차그룹은 정의선 회장이 브라질을 방문해 루이스 이나시우 룰라 다 시우바 브라질 대통령과 면담했다고 일 밝혔다브라질에는 현대차그룹의 유일한 중남미 생산 거점인 현대차 브라질 법인과 중남미 권역본부가 지난 일현지시간 브라질 브라질리아 대통령 집무실에서 진행된 룰라 대통령과 정의선 회장의 면담에는 제랄도 알크민 부통령 겸 산업통상자원부 장관 호세 무뇨스 현대차 사장 등이 동석했다정의선 회장은 현대차 브라질 법인과 현지 파트너사들이 수소 등 친환경 분야 미래 기술 등에 년까지 억 달러약 조억원를 투자할 계획이라고 밝혔다브라질은 지난해 월 현지 탈탄소 부문에 투자하는 자동차 제조 업체들에게 총 억 헤알약 조억원 규모의 감세 및 보조금 혜택을 부여하는 그린 모빌리티 혁신 프로그램을 발표했다정의선 회장은 현대차그룹은 탄소 배출 제로 달성을 위해 전기차 수소차를 아우르는 빠른 전동화 전략을 추진 중이며 수소 에너지는 기후 변화 대응의 핵심 수단이자 전동화를 보완하는 중요한 자원이라고 말했다브라질 정부는 년까지 온실가스 배출량을 년 대비  감축하고 년까지 탄소 중립을 달성한다는 목표 아래 친환경 정책을 펼치고 현대차그룹은 전동화 선도 브랜드로 자리매김하는 동시에 앞선 수소 기술을 활용한 사업 기회를 모색하는 등 브라질 시장에서 새로운 도약을 위한 성장 방안을 추진한다구체적으로 아이오닉와 코나 일렉트릭 등 글로벌 시장에서 호평을 받은 그룹의 전동화 차량을 투입해 브라질 시장에서 전동화 리더십 강화에 나선다룰라 대통령은 브라질 정부의 세제 개혁과 투자 환경 개선 등을 강조하면서 친환경 수소 분야와 기술 등에 투자할 현대차는 브라질에서 성장하고  중요한 이라고 말했다정길준  
이수태 파나시아 회장 일 부산아테네포럼 강연|'친환경 에너지 혁신 파나시아의 가 정신 주제



이수태 파나시아 회장이수태 파나시아 회장은 일 부산 중구 아네테학당에서 열리는 부산아테네포럼 시민아카데미에서 친환경 에너지 혁신 파나시아의 가 정신을 주제로 강연한다이 회장은 이날 파나시아 성장스토리와 선 경영 철학을 소개한다 년 파나시아 설립 후 세상에 없는 기술에 도전하며 탄소중립 시장 선두주자로 우뚝서기까지 파나시아 경영철학과 가 정신을 역설한다파나시아는 대기 수질환경과 수소에너지 솔루션을 보유한 글로벌 친환경 에너지 설비이다  메탄올 암모니아 등 다양한 수소에너지 연료공급장치를 개발 공급하며 탄소중립 시장을 선도하고 '
새만금 스스로 묶는 오디세우스 전략 필요  잼버리 이후 대안 주목|'새만금잼버리 리포트  내부개발 재수립 과제 점검새만금잼버리 대회가 파행으로 마무리된 지 개월이 지났다 그동안 대회 개최지였던 전북특별자치도와 새만금 현장에서는 수많은 곡절의 소사가 스쳐지나갔다 잼버리 대회 파행 이후 과연 누가 책임을 져야 할 것이냐는 책임론 추궁 논란이 불거지며 여야 대치 국면 속에 공방이 진행되는 등 치열한 논쟁이 벌어졌다 이 과정에서 전북은 예산 빼 먹는 꿍꿍이가  지자체로 폄훼되기도 했다 지금이야 여러 논란과 오해가 불식됐지만 작년 월 이후 만 전북도민들은 국제적인 행사를 망쳐 코리아 디스카운트를 촉발한 죄인처럼 고개를 들지 못했다 



