title|content
서울경제 는 년 제대 총선을 앞두고 국내 기후위기 대응을 위해 가장 시급한 변화가 필요한 과제를 꼽았다 기후 에너지 분야에 한해 기후변화 대응 강화 재생에너지 전환 가속화 그린워싱 방지 확대 지속가능 금융 확대 총 가지의 과제에서 신속한 변화가 필요하다고 봤다 는 이번 총선은 정치적 이해관계를 넘어 기후위기가 우리 모두의 생명과 직결된 문제라는 점이 전면에 드러나야 한다며 이번 매니페스토를 통해 법과 제도를 다루는 의사결정자들이 하나뿐인 지구를 지키고 지속가능한 사회를 만들 것을 촉구한다고 밝혔다 다음은 의 제대 총선 매니페스토 전문  포괄적인 기후위기 대응 노력 필요한국 정부는 년대에 들어  탄소중립을 선언하고  국가온실가스감축목표를 상향하는 등 탄소중립 목표 달성을 위해 노력하고  그러나 년까지 온실가스  감축이라는 목표 달성을 위해서는 더 많은 노력이 필요하다 특히 국내에서는 배출권 거래제 순환경제 자연보전 세 가지 측면에서 포괄적으로 기후변화 문제를 풀어 나가야 한다온실가스 배출 감축을 위한 핵심 수단 배출권 거래제배출권 거래제는 에 경제적 동기를 부여하여 온실가스 배출을 줄이고 기후변화에 대응하게 유도하는 정책이다 그러나 우리나라는 여전히 높은 무상할당 비율과 낮은 배출권 가격 형성으로 배출권 거래제의 효과가 미미하다는 지적이 많다 현재 배출권 거래제는 국가 전체 배출량의 약 를 커버하는 데 반해 배출권 거래제가 실질적으로 온실가스 감축에 기여하는 비중은 그에 못 미치고 년부터 년간 운영될 제차 배출권 거래제 계획은  중간목표 시점년이 포함되어  그 의의가 매우 크다  달성에 기여하기 위해서는 제차 배출권 거래제 계획에서 다배출업종의 유상할당 비율 상향 설정 배출 허용 총량 재조정 및 온실가스 감축률이 높은 건물 및 수송 분야에서의 배출권 거래제 역할 강화 등이 필요하다 현재 제차 계획에서는 온실가스 감축을 잘하고  이 배출권 할당을 더 받을 수  총 할당량의  이상을 배출효율 기준 방식으로 할당하는 방안이 논의되고  앞으로 국제사회 트렌드와 국내시장 변화를 주의 깊게 모니터링하고 세분화된 계획을 바탕으로 대응할 필요가 기후변화 대응을 위한 순환경제 현재 전 세계 온실가스 배출량의 는 자원 추출 및 사용 과정에서 발생하고  따라서 기후변화에 대응하기 위해서는 선형경제에서 자원절약 및 재활용을 통한 지속가능성을 추구하는 순환경제로의 전환은 필수적이다 순환경제를 통해 자원 추출 배출 및 폐기물과 관련된 환경 압력을 줄이고 자원과 에너지 사용을 최소화할 수  그러나 현실은 순환경제를 통한 원자재의 최대 감축 비율과 실제 순환경제로 재활용되는 원자재의 비율의 차이를 나타내는 순환성 격차 는 년 대비 년에 전 세계적으로  증가했다 이는 즉 재활용 가능한 자원 중 많은 양이 재활용되지 못하고 폐기되고  것을 의미한다우리나라는 올해 월 자원순환기본법을 전면 개정한 순환경제사회 전환 촉진법을 본격 시행했다 그러나 은 비용 및 운영 측면에 여전히 부담을 크게 느끼고  상황이다  부담을 완화하고 관련 법의 효과를 높이기 위해서는 양질의 폐자원 인프라 구축 가치사슬 전반에 걸친  지원 규제혁신 등 제도적 지원이 필요하다 또한 국내 산업이 국제 사회의 변화에 대응할 수  국제무역 관점에서 순환경제를 바라보는 방안을 마련해야 한다자연 보전 및 복원육상 및 해양 생태계는 인류가 생성하는  배출량의 대략 절반을 흡수하고  이처럼 자연의 역할은 기후변화로부터 우리를 보호하는데 매우 중요하다 세계경제포럼의  글로벌 리스크보고서에 따르면 생물다양성 손실 및 생태계 붕괴는 향후 년간 번째로 심각한 위험이 될 것으로 나타났다 이에 제차 생물다양성협약 당사국총회에서는 년까지 전 세계 육상해양의 를 보호지역 등으로 보전관리하고 훼손 생태계  복원 등 개의 구체적도전적 목표를 제시한 바 국내에서도 년까지 국토 면적의 를 보호지역 및 자연공존지역      확대하기 위한 목표 및 로드맵을 수립하는 등 자연 보전을 위한 노력을 기울이고  그러나 현재 보호지역 및  면적 비율은 육상  해양 에 불과해 목표 달성을 위해서는 보호지역 및 의 빠른 확대가 필요하며 특히 보호지역 내 지역사회 주민지원 정책 및 생태관광 활성화 등 지역사회 피해를 방지하기 위한 구체적 방안도 마련해야 한다  재생에너지로의 전환 가속화화석 연료를 통한 에너지 생산과 사용은 전 세계 온실가스 배출량의  정도를 차지한다 따라서 효과적으로 기후변화에 대응하기 위해서는 화석연료의 단계적 폐지 및 재생에너지로의 전환은 필수적이다재생에너지 전망치에 따른 공급 부족 문제 해결제차 전력수급기본계획에 따르면 년 기준 신재생에너지 발전량 전망치는 이다 그러나 이는 화석연료 기반의 연료전지와 석탄가스화복합화력발전을 포함한 수치이기에 들이 목표로 하는  및  제도 이행에는 적합하지 않다 이러한 에너지원을 제외한 들이 실제 조달 및 사용 가능한 재생에너지는 태양광과 풍력 발전이며 년 이 둘의 발전량 전망치는  수준이다 그러나 실제 에서 필요한 수요는  수준으로 예상되어 훨씬 더 많은 공급이 필요한 상황이다국내 대다수 들은 해외 고객사로부터 온실가스 감축 및 재생에너지 사용에 대한 구체적인 요구를 받고  들의 대응에 따라 수출 중심의 국내 산업 구조에 매우 직접적인 영향을 미칠 수  만큼 재생에너지 공급 부족 현상을 해소하는 제도적 지원이 필요하다국가 차원의 재생에너지 공급 지원 정책미국은 북미산 생산품에 대한 보조금 및 세제 혜택 등을 다루는 인플레이션 감축법   을 제정해 막대한 민간 투자를 유도하며 재생에너지 확대를 도모하고   집행위원회는 년 그린딜 산업계획   을 발표하며 년 탄소중립 목표 달성을 위한 친환경 산업 육성 정책을 밝혔다 특히 한시적 위기 및 전환 프레임워크    을 통해 재생에너지 확대를 위한 친환경 기술 분야에 대한 보조금 심사 기준을 완화하는 등 청정 탄소중립 산업분야의 자금조달을 원활히 하고자 한다세계적인 흐름에 맞춰 국내에서도 재생에너지 보급 확대를 위한 보조금 지원 및 세제 혜택 등의 제도 개선이 시급하다 자발적 전력구매계약나 신재생에너지공급인증서 활성화 방안은 물론 민간 분야 재생에너지 거래 및 투자 촉진 방안 등을 개발해야 한다 또한 인프라 구축을 지원해 들의 영향력  매칭 수급을 통한 지속가능한 재생에너지 공급 환경을 조성하는 포괄적이고 미래 지향적인 정책을 추진해야 한다 그린워싱 방지를 위한 사회적 관심과 강력한 규제 필요많은 이 지속가능경영 또는 를 필두로 친환경의 중요성을 부각하며 다양하게 활동하고  하지만 일부 에서는 환경에 대한 투명성이 없는 제품이나 서비스를 제공하며 마치 친환경적인 활동으로 인식하도록 홍보를 하기도 한다 그린워싱으로 불리는 이러한 활동은 친환경 활동에 대한 신뢰성을 저해하고 결국 경제적인 손실뿐 아니라 우리 사회에도 막대한 영향을 미칠 수 국내외 그린워싱 관련 인식 개선캐나다의 친환경 컨설팅사인 테라초이스는 총 가지로 그린워싱을 분류하고   미국 등에서는 이를 방지하기 위한 정책 수립 및 규제 강화 등의 움직임을 보이고  이러한 국제사회의 흐름에 맞춰 국내  및 기관 대중의 그린워싱에 인식이 올바로 잡힐 수  지속적으로 노력해야 한다국내 그린워싱 관련 규제 및 처벌 강화 필요년 월 환경부에서 발표한 자원순환기후 분야 업무계획에 환경기술산업법 개정을 통해 환경성 표시 및 광고 위반 시 과태료를 부과하는 내용이 포함됐다 또한 공정거래위원회의 환경 관련 표시광고 심사지침 년 개정안에서도 환경 관련 부당한 표시 및 광고를 판단하는 심사 기준을 세분화하고 구체적인 사례를 제시하는 등 그린워싱 규제가 강화되기도 했다 그러나 그린워싱 규제 위반 시 과태료 부과 기준이 엄격하고 낮은 과태료로 인해 여전히 솜방망이 처벌이 이어질 수  우려가 나온다반면 영국의 경우 년부터 경쟁시장국    의 그린 클레임코드  는 모든 주장이 근거로 입증될 것을 포함해 가지 행동 지침을 친환경 관련 홍보 조건으로 제시하고  의회는 지난해 그린 클레임 지침  을 마련해 마케팅 활동 시 일정 기간 내 사전 허가를 받고 지침 위반 시  매출에 비례해 벌금 부과하는 강력한 페널티를 도입했다지난 년 국내에서 그린워싱으로 지적된 사례는 총 건에 달했다 년 건에 비해 크게 늘어났으나 대부분 행정지도 처분을 받는 등 솜방망이 처벌로 끝났다 이러한 퇴행적 처벌 관행을 개선하고 적합한 규제 및 법적 조치를 통해 이 찐환경 활동을 하도록 유도해야 한다 지속가능 금융의 확대기후대응 목표를 달성하기 위해서는 금융의 역할이 매우 중요하다 지난 기후변화협약 당사국총회에서 전 세계 개발도상국이 저탄소 경제로 전환하고 극단적 기후변화에 대응할 수  하는 데 필요한 투자 규모가 중국을 제외해도 년 조 달러 년에는 조 억 달러 약 조 원이 될 것으로 추산한 바 한국의 높은 제조업 비중  대비 배에 달하는 연간  감축 목표를 감안할 때 산업구조의 빠른 전환을 위해 민간 및 공공 전환 금융의 활성화 정책이 필요하다구체적으로 기후대응기금의 보다 체계적효율적인 운용 계획과 관리 방안의 마련 친환경 부분에 대한 자금 공급 확대를 지원하는 통화정책 강화 기후 공시생물다양성 공시 제도 조기 도입 기후리스크 및 생물다양성 리스크가 반영된 금융 감독당국의 미시건전성 관리 규제 강화 등이 요구된다미국의 나 의 탄소국경조정제도 등 전 세계적으로 환경 보호무역주의 기조가 강화되고  파리협정 목표 달성을 위한 국제 사회의 압박도 심화되고  한국이 국제 사회에 약속한  목표 달성을 위해서는 강도 높은 탄소 배출 저감 활동이 요구되는 만큼 선제적인 금융 정책을 통해 이를 뒷받침해야 한다'
국립산림과학원 탄소중립 교육용 증강현실 애플리케이션 개발|'더하기 숲 빼기 탄소 출시



더하기숲 빼기 탄소 표지 산림청 국립산림과학원 제공뉴스 대전충남뉴스 박찬수   산림청 국립산림과학원원장 배재수은 산림과 탄소중립에 관해 쉽고 재미있게 익힐 수  증강현실 애플리케이션 더하기 숲 빼기 탄소를 개발했다고 일 밝혔다 더하기 숲 빼기 탄소는 산림과 탄소중립에 관한 다섯 가지의 주제를 다루고  숲 가꾸기와 산림경영처럼 직접 경험하기 어려운 내용을 보다 쉽고 재미있게 체험할 수  증강현실을 접목했다 증강현실에 익숙하지 않은 이용자들이 애플리케이션을 쉽게 활용할 수  교육대상자를 위한 활동지와 교육진행자를 위한 교육지도안을 함께 보급한다 증강현실 기술을 쉽게 활용할 수  마커와 탐구활동 및 다양한 읽료를 포함 애플리케이션과 함께 활용 시 교육 효과를 더 높일 수  하시연 국립산림과학원 산림휴먼서비스연구과 박사는 이번 애플리케이션은 숲을 통해 탄소중립을 실현하는 방법에 대해 국민들의 이해를 돕기 위해 기획했다며 탄소중립에서 산림의 역할과 중요성에 대해 알려지는 좋은 계기가 되길 바란다고 전했다'
기후위기 대응을 위한 금융지원 관련 은행장 간담회|서울뉴시스 김주현 금융위원장이 일 오전 서울 상암동 서울에너지드림센터에서 열린 기후위기 대응을 위한 금융지원 관련 은행장 간담회에 참석해 김상협  탄소중립녹색성장 위원회 민간위원장 한화진 환경부 장관 등 참석자들과 기념촬영 하고  사진금융위원회 제공   재판매 및  금지사진 영상 제보받습니다 공감언론 뉴시스가 독자 여러분의 소중한 제보를 기다립니다 뉴스 가치나 화제성이  판단되는 사진 또는 영상을 뉴시스 사진영상부로 보내주시면 적극 반영하겠습니다
인천환경공단 인천환경 미디어 서포터즈 발대식 개최|인천환경미디어서포터즈들이 남항사업소 하수처리시설을 견학하고  인천환경공단 제공데일리안  장현일  인천환경공단은 최근  탄소중립을 함께 실현해 나갈 인천환경미디어서포터즈 발대식을 개최했다고 일 밝혔다인천환경미디어서포터즈이하 서포터즈는 인천환경공단과 인천시청자미디어센터  경인교통방송  경인 하나은행 경인영업본부 등 개사가 공동으로 운영하는 사업이다지난 월부터 시작된 서포터즈 모집에는 모두 명이 접수했으며 최종 심사를 거쳐 그린홍보단 그린제작단영상라디오 그린캠페이너 그린대학생기획단 총 개분야별 명이 선정됐다이번 발대식에는 약 여명의 서포터즈가 참석했으며 서포터즈는 인천의  탄소중립 실현을 위한 시민참여 사례 전파를 비롯해 환경기초시설 운영 시민정보 제공 환경정책 및 환경실천 우수사례 공유 등 다양한 활동을 수행하게 된다특히 올해 처음 모집한 그린대학생기획단은 대학생들이 직접 환경관련 캠페인 및 행사를 주도적으로 기획운영할 수  기회를 제공할 계획이다최계운 인천환경공단 이사장은 개 기관이 공동으로 힘을 모아 서포터즈 사업을 내실  준비했다면서 앞으로 서포터즈와 함께 인천이 명실상부한 탄소중립 세계 초일류 도시로 성공할 수  힘을 보태겠다라고 밝혔다
포토 기후위기 대응 금융지원 간담회|일 마포구 서울에너지드림센터에서 열린 기후위기 대응을 위한 금융지원 간담회에서 김주현 금융위원장앞줄 오른쪽 네번째 김상협 탄소중립녹색성장위원회 민간위원장앞줄 왼쪽 세번째 한화진 환경부 장관앞줄 왼쪽 네번째 등 참석자들이 기념 촬영을 하고  사진조용준  
정부 기후금융에 년까지 조원 금융지원|'정책금융기관 및 대 시중은행 출자



김주현오른쪽 금융위원장이 일 오전 서울 상암동 서울에너지드림센터에서 한화진 환경부 장관과 간담회를 개최하고 금융위원회 제공헤럴드경제홍승희  정부가 우리 들이 기후 위기 대응에 나설 수  년까지 정책금융기관 대 시중은행과 함께 민관합동으로 조 규모의 금융지원에 나선다 수출 중심의 한국 들이 탄소규제에 대처하지 못한다면 국가 경제가 심각한 타격을 받을 수  판단에서다이를 통해 우리 들이 작업공정을 저탄소로 전환하고 풍력과 태양광 등 재생에너지 설비 증설을 통해 신재생에너지 사용을 확대하는 한편 기후 기술을 키울 수  됐다금융위원회는 일 제로에너지건축물인 서울에너지드림센터에서 김주현 금융위원장과 김상협  탄소중립녹색성장위원회 민간위원장 한화진 환경부 장관이 참석한 가운데 대 시중은행장과 정책금융기관장 간담회를 열고 이런 내용의 기후위기 대응을 위한 금융지원 확대방안을 발표했다의 저탄소 공정 전환 위해 조 정책금융 공급김 위원장은 오늘날 우리가 마주한 전례 없는 기후변화는 우리 의 경쟁력뿐만 아니라 미래세대를 위해서라도 꼭 풀어야 할 과제라며 기후위기에 대처하기 위해서는 들이 공정을 전환해 탄소를 적게 배출하거나 탄소배출이 많은 화석연료 발전 전기를 청정에너지 발전 전기로 바꿔야 하고 또 이를 위해 기후기술의 발전도 뒷받침돼야 할 것이라고 말했다



김주현 금융위원장이 일 오전 서울 상암동 서울에너지드림센터에서 김상협  탄소중립녹색성장 위원회이하 탄녹위 민간위원장과 한화진 환경부 장관이 자리한 가운데 은행장 및 정책금융기관장 간담회를 개최해 기후위기 대응을 위한 금융지원 확대방안과 저탄소 체계로의 전환 가속화를 위한 녹색투자 확대방안을 발표했다금융위원회 제공의 저탄소 공정 전환을 위해 산업은행 수출입은행 은행 신용보증기금 기술보증기금 등 정책금융기관들은 년까지 총 조원의 정책금융을 공급한다 연평균 자금공급량은 지난 년 평균인 연 조원 대비 연 조원으로  확대된다 정부는 이를 통해 년 온실가스 배출이 약 만 감축될 수  것으로 추산했다 이는 년까지 국가 감축목표의  수준이다조원 규모의 모험자본도 투입한다 태양광 풍력 해상풍력 등 신재생에너지 발전시설 증설을 위해 정책금융기관들은 조원의 후순위대출을 공급한다 여기에 은행권 출자를 통해 총 조원 규모의 미래에너지펀드를 신규 조성한다 산업은행이 전체 규모의 인 조억원을 출자하고 국민신한하나우리농협은행 등 개 시중은행이 조억원을 출자토록 한다차로 조억원 규모의 펀드를 조성하고 개 출자 은행으로 구성된 협의체를 통해 필요할 시 추가 출자할 계획이다금융위는 은행권의 적극적인 투자를 유도하기 위해 미래에너지펀드 출자할 때 위험가중치를 현행 에서 까지 낮춰 국제결제은행비율 부담을 경감시켜주기로 했다 비율은 은행의 자본을 위험자산으로 나눈 백분율을 의미하는데 펀드의 위험가중치를 분의 수준으로 낮춰 더 많은 투자를 유도하겠다는 것이다이를 통해 년까지 들이 신재생에너지 발전시설 증설을 위해 필요한 것으로 추정되는 자금 조원 중 자체 조달분을 제외한 조원을 조성하기 위한 모험자본의 일부를 공급 연기금이나 보험사 공제회들의 자금이 들어올 수  마중물 역할을 한다는 계획이다정부는 이에 따라 풍력 등 신재생에너지 발전 비중이 현행 에서 정부의 전력수급기본계획대로 년 까지 확대될 수  것으로 기대하고 기후기술 분야에도 조원 투자민간 자발적 여신 원활히 공급토록 지원



김주현 금융위원장이 일 오전 서울 상암동 서울에너지드림센터에서 김상협  탄소중립녹색성장 위원회이하 탄녹위 민간위원장과 한화진 환경부 장관이 자리한 가운데 은행장 및 정책금융기관장 간담회를 개최해 기후위기 대응을 위한 금융지원 확대방안과 저탄소 체계로의 전환 가속화를 위한 녹색투자 확대방안을 발표했다금융위원회 제공아울러 재생에너지 탄소포집 수소에너지 온실가스 고정 친환경패키징 등 미래 먹거리 개발을 위해 기후기술 분야에 약 조원을 투자한다 기후기술은 향후 연평균  성장이 예상되는 유망한 시장이나 그간 초기 경제성이 부족해 개발되지 못하는 경우가 많았다 이에 은행과 개 시중은행이 총 조억원을 출자해 민간자금 조억원을 매칭해 총 조원 규모의 기후기술 펀드를 조성하기로 했다 이와 더불어 조원 규모의 혁신성장펀드 조원의 성장사다리펀드를 통해서도 기후기술을 육성한다환경부는 이날 환경에 대한 원칙과 기준을 제시하는 한국형 녹색분류체계를 고도화하고 탄소중립 관련 녹색투자를 년까지 총 조원까지 확대하는 것을 목표로 하겠다고 밝혔다 또 국가 온실가스 감축목표를 달성하기 위해 배출권거래제 고도화를 추진하고 이와 연계된 금융투자상품을 단계적으로 도입할 계획이다이에 이세훈 금융감독원 수석부원장은 한국형 녹색분류체계의 여신 적용방안을 마련하는 등 관련 제도를 정비하여 민간 금융회사가 자발적으로 친환경 분야에 여신을 원활히 공급할 수  지원할 계획이라고 밝혔다은행권은 국가와 이 탄소중립을 달성하기 위해 필요한 금융지원을 지속해나가겠다는 입장이다 조용병 은행연합회 회장은 이번 금융지원을 통해 지속가능한 미래의 준비에 은행권이 동참하게 되어 뜻깊게 생각한다며 앞으로도 은행권은 녹색산업에 대한 자금 공급을 통해 우리나라의 기후위기 대응과 미래발전에 이바지 할 것이라고 말했다'
모두 발언하는 김상협 탄녹위 민간위원장|서울뉴스 김민지   김상협 탄소중립녹색성장위원회 민간위원장이 일 오전 서울 마포구 서울에너지드림센터에서 열린 기후위기 대응을 위한 금융지원 간담회에서 모두 발언을 하고  왼쪽은 김주현 금융위원장 뉴스
기후위기 대응을 위한 금융지원 간담회|서울연합뉴스 박동주   일 오전 마포구 서울에너지드림센터에서 열린 기후위기 대응을 위한 금융지원 간담회에서 김주현 금융위원장 김상협 탄소중립녹색성장위원회 민간위원장 한화진 환경부 장관 등 참석자들이 기념 촬영을 하고      
기후위기 대응을 위한 금융지원 간담회|서울연합뉴스 박동주   일 오전 마포구 서울에너지드림센터에서 열린 기후위기 대응을 위한 금융지원 간담회에서 김주현 금융위원장 김상협 탄소중립녹색성장위원회 민간위원장 한화진 환경부 장관 등 참석자들이 기념 촬영을 하고      
기후위기 대응을 위한 금융지원 간담회|서울연합뉴스 박동주   일 오전 마포구 서울에너지드림센터에서 열린 기후위기 대응을 위한 금융지원 간담회에서 김주현 금융위원장 김상협 탄소중립녹색성장위원회 민간위원장 한화진 환경부 장관 등 참석자들이 기념 촬영을 하고      
기후위기 대응을 위한 금융지원 간담회|서울연합뉴스 박동주   일 오전 마포구 서울에너지드림센터에서 열린 기후위기 대응을 위한 금융지원 간담회에서 김주현 금융위원장 김상협 탄소중립녹색성장위원회 민간위원장 한화진 환경부 장관 등 참석자들이 기념 촬영을 하고      
기후위기 대응을 위한 금융지원 간담회|서울연합뉴스 박동주   일 오전 마포구 서울에너지드림센터에서 열린 기후위기 대응을 위한 금융지원 간담회에서 김주현 금융위원장 김상협 탄소중립녹색성장위원회 민간위원장 한화진 환경부 장관 등 참석자들이 기념 촬영을 하고      
기후위기 대응을 위한 금융지원 간담회|서울연합뉴스 박동주   일 오전 마포구 서울에너지드림센터에서 열린 기후위기 대응을 위한 금융지원 간담회에서 김주현 금융위원장 김상협 탄소중립녹색성장위원회 민간위원장 한화진 환경부 장관 등 참석자들이 기념 촬영을 하고      
부산시 푸른도시국 직원과 소통공감 타임 개최  시정 현안 논의|'일 오후 시  화명수목원 직원 소통공감 타임 개최시 최초 푸른도시국 출범  공원 속의 도시 부산 목표박형준 시장 명품생태도시 부산 함께 만들어 나가겠다시민 모두가 행복한 공원 도시 부산 직원 소통과 공감에서 답을 찾는다



