title|content
 일 토지주택연구원 연구과제 성과발표회 개최| 제공서울뉴스 황보준엽   한국토지주택공사가 오는 일 경기 성남시  경기남부지역본부에서 지난해 토지주택연구원 연구과제 성과발표 보고회를 개최한다고 일 밝혔다는 토지주택분야 정책 계획 기술을 연구하는 의 부설 연구 전문기관으로 그간 건이 넘는 현장중심 실증연구를 수행해왔다 이번 발표회는 가 지난해 수행한 여 건의 연구과제 중 주요 성과를 선별해 발표하는 자리다발표회는 개회식 및 전문가 좌담회를 시작으로 주요 연구과제를 개 세션으로 분류해 진행한다 세션별 시간 분씩 진행되며 연구결과 발표와 자유토론이 함께 진행된다 아울러 당일 행사장 외부에 주요 연구과제의 이해를 돕기 위한 패널도 전시한다첫 번째 세션은 국가적 아젠다와 사회문제를 해결하는 라는 주제로 진행된다 층간소음 걱정 없는 공동주택 구현 방안 아이돌봄 통합 플랫폼 구축 방안 등 연구성과를 바탕으로 우리 사회 주요 문제 해결 방안에 대해 논의한다두 번째 세션은 국민체감형 주거복지를 실현하는 라는 주제로 진행된다 주거불평등 문제에 대한  역할 국민활용형 주택유지 보수 플랫폼 구축방향 저출생 대응 육아친화 주거지원 방안 등을 발표하며 국민 눈높이에 맞는 주거복지 방향에 대해 논의한다세 번째 세션은 미래지향적 혁신적 공간을 만들어가는 라는 주제다 스마트도시 특화단지 활성화 혁신파크 도입 도심사업의 통합적 추진방안 등을 발표하며 도심 활력 및 경쟁력 제고를 위한 방안에 대해 공유한다네 번째 세션은 고품질 스마트 건설기술을 선도하는 라는 주제로 진행된다  기반  공동주택 공급 방안 탄소중립을 위한 산업부산물 자원화 기술 스마트하우징서비스 개발 등을 발표하며 미래 건설 역량 확보를 통한 국내 건설산업 발전 방향에 대해 논의한다김홍배  토지주택연구원 원장은 는 주거 불평등 층간소음 등 사회적 문제의 해법을 제시하고 국민에게 실질적으로 기여할 수  실용중심 연구를 끊임없이 진행해왔다며 이번 발표회를 통해 의 연구성과와 앞으로 나아가야 할 방향에 대한 고견을 듣고자 하니 많은 관심을 바란다고 말했다
현대로템 탄소중립 글로벌기관  평가 리더십 획득|'  워터 코리아 어워즈 우수상현대로템은 글로벌 지속가능 경영 평가기관 탄소정보공개프로젝트로부터 수자원 관리 부문 리더십 등급을 받았다고 일 밝혔다현대로템은 최근 가 서울 여의도 글래스 호텔에서 주최한   워터 코리아 어워즈에서 수자원 관리 부문 리더십등급을 획득하면서 우수상을 받았다 우수상은 수자원 관리 부문 점수 위 에 수여한다는 세계 금융투자기관 위임을 받아 각국 주요  지속가능경영을 평가하는 비영리 기관이다 다우존스 지속가능경영 지수와 함께 공신력 높은 환경사회지배구조 경영평가 지표로 인정받는다 



이경필 현대로템 경영기획실장가운데 장지인  한국위원회 위원장맨 오른쪽 양춘승  한국위원회 부위원장이   코리아 어워즈에서 기념촬영을 하고 사진제공현대로템수자원 관리 기후변화 대응 두 가지 부문으로 나눠 평가했다 가장 높은 등급인 리더십 부터 리더십 경영 경영 등 개의 등급으로 각각 차등 평가했다현대로템은 사업장 내 상수도 관리부터 폐수 처리까지 전사 물 관리 현황을 외부에 공개한다 지난해 환경부 수질오염 물질 불시 점검에서 한 건도 적발되지 않았다기후변화 대응 부문에서는 경영를 받았다 현대로템 관계자는 앞으로도 탄소중립 달성과 오염물질 감축 관련 목표를 세우고 관련 체계를 고도화하는 등 전사적으로 노력하겠다고 말했다'
현대로템 수자원관리 노력 인정 리더십 등급|'  워터 코리아 어워즈에서 우수상 수상탄소중립 달성과 오염물질 감축을 위해 노력



  코리아 어워즈에서 장지인오른쪽  한국위원회 위원장 양춘승  한국위원회 부위원장 이경필가운데 현대로템 경영기획실장 수상 후 기념촬영을 하고  사진제공현대로템서울경제 현대로템이 지속가능경영을 위한 수자원관리 노력을 인정받았다현대로템은 일 여의도 글래드 호텔에서 열린  탄소정보공개프로젝트   워터 코리아 어워즈에서 수자원관리 부문 리더십등급을 받아 우수상을 수여 받았다고 일 밝혔다는 전세계 금융투자기관의 위임을 받아 각국 주요 의 지속가능경영을 평가하는 비영리 기관으로 매년 의 환경사회지배구조 성과를 평가하는 다우존스 지속가능경영 지수와 함께 가장 공신력  지속가능성 평가 지표로 꼽힌다 최근 글로벌 금융시장에서는 기관투자자들이 투자 지표로 지속가능성에 무게를 두는 등 의 환경 보존 역할과 사회적 책임을 강조하고 이번 평가는 수자원관리 기후변화대응 두 가지 부문으로 나뉘며 가장 높은 등급인 리더십 부터 리더십 경영 경영 등 개의 등급으로 각각 차등 평가된다현대로템은 수자원관리 부문에서 리더십등급을 받아  어워즈에서 우수상을 수상했다 우수상은 수자원관리 부문 점수가 가장 높은 위 에게만 수여된다현대로템은 사업장 내 상수도 관리부터 폐수 처리까지 이르는 전사 물 관리 현황을 외부에 투명하게 공개하고 지난해 환경부에서 실시한 수질오염물질 불시점검에서 적발 사항 건을 기록했다 특히 지난해 국내 에서 수질오염이나 홍수 등 물 관련 재해로 인한 피해액이 년 대비 약 배 증가했다는 의 보고도 나온 만큼 현대로템이 첫 평가를 받은 수자원관리 부문에서 높은 등급을 획득한 것은 의미가 깊다이어 기후변화대응 부문에서 국내  상위 에 해당하는 경영등급을 받았다 온실가스 배출량 및 감축 실적을 외부에 공개하고 년 레일솔루션 매출의 를 정부의 친환경 경제활동 지침인 한국형 녹색분류체계에 맞추는 등 기후변화 관련 노력도 이어가고 한편 현대로템은 지난 월 오는 년까지 탄소중립을 달성하기 위한 이행 전략을 담은  탄소중립 로드맵을 공개하고 원료부터 제조사용폐기에 이르는 전 과정에 기후 대응 체계를 강화하고 현대로템 관계자는 앞으로도 탄소중립 달성과 오염물질 감축 관련 목표를 세우고 관련 체계를 고도화하는 등 전사적인 노력을 쏟겠다고 말했다'
토지주택연구원 연구과제 성과발표회 개최|'현장중심 실증연구로 층간소음 저출생재난재해 등 사회문제 대안 제시이데일리 김아름  한국토지주택공사는 일 경기 성남시 소재  경기남부지역본부에서 지난해 토지주택연구원 연구과제 성과발표 보고회를 개최한다고 일 밝혔다



는 토지주택분야 정책 계획 기술을 종합적으로 연구하는 의 부설 연구 전문기관으로 그간 건이 넘는 현장중심 실증연구를 수행해왔다 이번 발표회는 가 지난해 수행한 여 건의 연구과제 중 주요 성과를 선별해 발표하는 자리로 년 이후 년만 개최라 의미가 크다 발표회에는 김규철 국토교통부 주택토지실장 박진철 대한건축학회장을 비롯해 개 토지주택 분야 학회의 학회장 및 부회장 등 명 이상이 패널로 참여해 뜻깊은 시간을 가질 예정이다 일 개회식 및 전문가 좌담회를 시작으로 주요 연구과제를 개 세션으로 분류해 진행한다 세션별 시간 분씩 진행되며 연구결과 발표와 자유토론이 함께 진행된다 행사장 외부에 주요 연구과제의 이해를 돕기 위한 패널도 전시한다첫 번째 세션은 국가적 아젠다와 사회문제를 해결하는 라는 주제로 진행된다 층간소음 걱정 없는 공동주택 구현 방안 아이돌봄 통합 플랫폼 구축 방안 등 연구성과를 바탕으로 우리 사회 주요 문제 해결 방안에 대해 논의한다두 번째 세션은 국민체감형 주거복지를 실현하는 라는 주제로 진행된다 주거불평등 문제에 대한  역할 국민활용형 주택유지 보수 플랫폼 구축방향 저출생 대응 육아친화 주거지원 방안 등을 발표하며 국민 눈높이에 맞는 주거복지 방향에 대해 논의한다세 번째 세션은 미래지향적 혁신적 공간을 만들어가는  라는 주제로 진행된다 스마트도시 특화단지 활성화 혁신파크 도입 도심사업의 통합적 추진방안 등을 발표하며 도심 활력 및 경쟁력 제고를 위한 방안에 대해 논의한다네 번째 세션은 고품질 스마트 건설기술을 선도하는  라는 주제로 진행된다  기반  공동주택 공급 방안 탄소중립을 위한 산업부산물 자원화 기술 스마트하우징서비스 개발 등을 발표하며 미래 건설 역량 확보를 통한 국내 건설산업 발전 방향에 대해 논의한다김홍배  원장은 는 주거 불평등 층간소음 등 사회적 문제의 해법을 제시하고 국민에게 실질적으로 기여할 수  실용중심 연구를 끊임없이 진행해왔다면서 이번 발표회를 통해 의 연구성과와 앞으로 나아가야 할 방향에 대한 고견을 듣고자 하니 많은 관심을 바란다고 말했다'
펄펄 끓는 지구원전까지 다 동원해야  확산 더 절실한 이유|'리포트지구온도  위한 첫걸음 화석빼고 다 동원해야 탄소중립 위한 마지막 수단 



 안덕근 산업통상자원부 장관이 일 오후 서울 중구 대한상공회의소에서 열린 무탄소에너지 잠재력 제고를 위한 세미나에 참석해 축사를 하고  사진제공산업통상자원부년까지 도전세계가 년 프랑스 파리에 모여 설정한 지구 기온 상승 억제 목표다 그로부터 년여간 지난 년 확정된 유엔 기후변화에 관한 정부간 협의체 차 보고서에 따르면 년 지구 표면 온도가 산업화 이전 대비 도 올랐다 년 안에 도 목표를 넘을 것이란 경고도 담겼다 탄소배출을 줄이고 지구 온도 상승을 억제하기 위해선 현재의 노력만으론 불가능하다는 게 결론이다 지난해 월 아랍에미리트 두바이에서 열린 제차 유엔기후변화협약 당사국 총회에서도 참가국들은 이같은 사실을 인정했다 그러면서 원자력발전과 수소 등 무탄소에너지   를 포함한 에너지 믹스를 탄소 감축을 위한 수단으로 제시했다 일 연합에 따르면 전세계의 석유와 석탄 천연가스 등 화석에너지 의존도는 년 에서 년 로 불과 포인트 감소하는 데 머물렀다 같은 기간 재생에너지 의존도는 에서 로  늘었다 하지만 원전 의존도가 에서 로 줄면서 화석연료에 대한 의존도는 년째 제자리걸음을 했다 우리나라 사정은 조금 낫다 한국의 화석에너지 의존도는 년 에서 년 로  줄었다 재생에너지에 원전과 수소를 포함한 무탄소에너지 비중을 에서 로 끌어올린 결과다 문제는 감축 속도다 년까지 도가 아니라 년 이전에 도를 넘을 만큼 지구 표면 온도 상승이 빠르다 지금까지 노력보다 더 혹독한 탈탄소에 매진해야 시간을 조금이나마 늦출 수  결국 중요한 것은 탈탄소 수단이다 태양광풍력 등 재생에너지 뿐 아니라 원전과 같은 무탄소에너지로 탈탄소 수단의 개념을 확장할 필요가  얘기다 에서 주요 국가들이 인정했듯이 기후 에너지 분야 전문가도 무탄소에너지 필요성을 강조하고  연합이 지난 일 서울 중구 대한상공회의소에서 개최한 무탄소에너지 잠재력제고를 위한 세미나에 참석한 유승훈 서울과학기술대 창의융합대학 학장은 들의 부담 경감을 위해 낮은 전기요금을 유지할 수  하는 의 잠재력 활용이 필요하다고 강조했다 유 교수는 태양광풍력을 늘리면서도 비용효과적인 무탄소저탄소전원의 확대도 병행해야 한다며 탄소 배출량이 비슷하다면 국내 일자리를 더 늘릴 수  전원을 선택하는 것이 합리적이라고 말했다 이어 고용창출 기여도와 전력공급 안정성을 고려해 블루수소 원전 탄소포집저장  전원 개발을 고민해야 한다고 덧붙였다  반도체철강 등 에너지 다소비 산업이 핵심인 우리나라 산업 구조의 특수성도 고려해야 한다 우리나라는 년대에 비해 산업부문 에너지 소비가  늘어났다 제조업의 패러다임 자체를 바꿔야 한다는 제언도 나온다 주현 산업연구원 원장은 우리 경제에서 제조업이 차지하는 비중은  정도라며 산업부문의 온실가스 직간접 배출만 이기 때문에 다른 나라보다 산업부문 노력이 각별히 중요하다고 강조했다 이어 철강석유화학산업 같은 경우 수소환원제철 전기가열분해로 도입 등 공정을 완전히 바꿔야 탄소중립을 달성할 수 며 탄소다배출 업종이 탄소 저감을 위해 전기화되는 과정에서 무탄소에너지 기반 전력의 안정적 공급이 매우 중요하다고 덧붙였다앞으로 전기 더 많이 필요한데 없이 반도체철강 미래 없다



왼쪽 조영준 대한상의 지속가능경영원 원장 오른쪽 안윤기 포스코경영연구원 상무무탄소연합이 출범할 때부터 국내 주요 들이 솔선수범해 도왔을 만큼 산업계에선 무탄소에너지 확산에 대한 기대감이 큽니다 를 추진해야 합리적인 가격으로 균형감  에너지를 공급받을 수  생각하기 때문입니다조영준 대한상의 지속가능경영원 원장조영준 대한상의 지속가능경영원 원장은 머니투데이와 만나 는 결국 정부가 청정에너지를 균형감  확대하겠다는 취지라며 이같이 밝혔다 글로벌 기후위기에 대응하기 위해서는 모든 부문의 총체적 노력이 필요하지만 한국의 경우 특히 산업부문의 대응이 중요하다 국내총생산 대비 제조업 비중이 약  수준으로 높고 온실가스 배출에서 산업부문이 차지하는 비중은 절반 이상이다온실가스 감축과정에선 생산공정 혁신 등 산업구조 변화가 수반될 수밖에 없다 국내 제조업은 수출의존도도 높아 개별 의 의지만으론 탄소배출 저감 목표를 달성하기 어렵다 들이 정부 차원의 지원에 목말라 했던 이유다 정부와 민간이 함께 추진하는 는 이 같은 의 애로를  해결해준다 조 원장은 년까지만 해도 들은 선택지가 재생에너지  사용과 구글이 추진하는  실시간 무탄소에너지  사용 밖에 없었다며 는 현실적인 목표를 내세운 데다 정부의 지원이 밑바탕이기 때문에 들 사이에서 나날이 관심도가 늘고 고 말했다 철강 등 탄소배출량이 많은 업종은  확산이 더 절실하다 철강업계의 경우 기존의 고로에서 탄소배출이 없는 수소환원제철로 전환하기 위해선 투입되는 에너지가 전기화돼야 한다 현재처럼 만톤 규모의 조강생산량을 유지한다면 연간 그린수소는 만만톤 그린전력 기가와트가 추가로 필요하다 안윤기 포스코경영연구원 상무는 철강업계의 경우 생산공정이 완전히 바뀌어야 탄소배출 저감 목표를 달성할 수 며 가장 걱정하는 부분이 에너지의 안정성과 공급 가능성인데 정부가 를 추진하면서 이 부분이 해결될 거라고 본다고 말했다 안 상무는  확산을 위한 정책적 제언으로  전원에 대한 직접전력구매제도 마련 수소특구 조성 및 저가의 청정수소 공급  연구개발 및 투자 자금 지원  투자에 대한 세제 완화 택소노미 기준에 투자 기준 반영 글로벌 공시기준 적극 협상 민간 중심 기후금융 조성 탄소발자국 전과정 목록 데이터베이스 구축을 위한 예산 지원 등을 꼽았다 안 상무는 들 입장에선 가 국제적으로 인정받을 수  인증 체계를 마련하는 것이 제일 중요하고 금융 지원으로 기술을 개발할 수  하는 것이 중요하다며 열심히 탄소 감축 기술을 개발적용하는 들이 인센티브를 받을 수  제도를 개선하는 것도 고려해야 한다고 말했다'
기 신도시 혁신 스마트도시로 간다주거혁신|'잠만 자는 베드타운 더는 안돼자족 가능 도시로인프라 활용 산업 생태계 구축해자원 뻗어나가야



남산에서 바라본 아파트 모습 뉴스   김명섭 서울뉴스 황보준엽   분당평촌산촌중동일산신도시 곳의 기 신도시는 년 정부의 집값 안정과 주택 부족 현상을 해소하기 위해 탄생한 곳이다 이 도시들은 만 가구를 빨아들이며 서울의 인구 과밀과 집값 상승 문제를 해결하는데 기여했다 그러나 입주 년이 지나면서 노후화돼 버렸고 도시의 기능 자체를 주거에 방점을 찍은 탓에 베드타운이라는 평가를 피하지 못했다  이 때문에 이번 기 신도시 등 노후도시의 재정비를 할 땐 단순히 주택 수를 늘리는 것이 아닌 도시재창조를 위한 정비가 이뤄져야 한다는 목소리가 나온다 환경과 사회 경제적으로 지속가능한 도시로 조성해야 한다는 것이다일 부동산 업계에 따르면 노후계획도시의 재건축 규제를 완화하는 노후계획도시 정비 및 지원에 관한 특별법기 신도시 특별법이 오는 월 말부터 시행된다 특별법은 특별정비구역 내 재건축을 통합 심의하고 재건축 사업의 첫 관문으로 꼽히는 안전진단 면제 및 용적률 상향 등 각종 건축규제를 완화하는 내용을 담고  기 신도시 평균 용적률은 로 이미 법상에서 정한 용적률 상한선까지 모두 채웠다는 점을 감안하면 해당 법안은 기 신도시 재정비를 위한 첫걸음이었다정부는 월부터 지역별 선도지구 지정에 대한 절차를 시작해 이번 정부 임기 중에는 첫삽을 뜨도록 하겠다는 계획이다 다만 이제는 단순히 주택 공급에 초점을 맞추는 것이 아니라 자족가능한 스마트 도시 구현으로 개발 방향을 잡아야 한다는 목소리가 높다 조성 당시 주택 수요 흡수에만 초점을 맞췄던 기 신도시는 자족기능이 부족한 베드타운이라는 평가를 받고  이를 위해선 전문가들은 지금과는 다른 새로운 도시정비 전략을 세워야 한다고 조언한다 교통과 에너지 탄소중립 도시인프라상하수도 교량 등 등이 무엇보다 우선 고려돼야 한다는 설명이다특히 인프라를 이용한 산업 생태계 구축의 중요성이 강조된다 지역 특화 산업을 육성시켜 광역을 넘어 각각의 지역에까지 자원이 뻗어나가야 한다는 의미다 이런 가운데 오는 월 일 오후 시 서울 여의도 한국거래소 층 콘퍼런스홀에서는 신도시메가시티 속도 내는 도시혁신이라는 주제로 년도 뉴스 건설부동산부 포럼이 개최된다 이날 행사에서는 조영태 한국토지주택공사 도시연구단장이 기 신도시 재창조를 위한 스마트 도시정비 전략이라는 내용으로 발표에 나선다'
건설미래 원자력 발전은 소형이 대세년 후 세계 첫 생산 목표|'최영 현대건설 뉴에너지 사업부장전무 년 원자력 외길 걸어와  원자력 암흑기에 소형원전에 투자 시작편집자주건설은 건설 업계에서 활약하고  인물을 집중 조명하는 인터뷰 시리즈입니다 건설사의 핵심사업 신성장동력 등 다양한 분야에서 두각을 나타내고  건설인들을 만나 생생한 업계의 이야기를 전달하고자 합니다



현대건설 뉴에너지 사업부장 최영 전무  사진허영한  자동차 모델도 제네시스가  모닝이  원자력 시장도 마찬가지다 지금까지는 오로지 대형 원자력에만 집중했는데 앞으로는 소형과 대형으로 양분될 것이다최영 현대건설 뉴에너지 사업부장전무은 일 아시아경제와 인터뷰에서 소형 원자력 발전 기기인 소형모듈원전을 세계 곳곳에서 볼 수  시대가 곧 올 것이라며 이같이 말했다원자력이라는 한 우물만 파 온 지 올해로 년째인 그는 에너지 안보와 탄소중립의 중요성이 커지면서 유럽 각국이 원자력 발전에 주목하게 된 요즘 은 경제성과 안전성 측면에서 높은 점수를 받고 고 설명했다소형원전이 경제성 안전성 뛰어나 최근 원전을 둘러싼 각국의 시선은 변화하고  에너지 안보의 중요성이 더해지면서 동일본 대지진 이후 이어진 원전 암흑기가 걷히고  유럽을 중심으로 원자력 발전소 발주가 시작됐고 원자력 핵심 원료인 우라늄 가격은 역대 최고가를 기록 중이다 특히 원전 중에서도 도심에도 설치할 수  소형 모듈원전에 대한 관심이 커졌다 국내에서는 현대건설이 미국 홀텍과 함께 세계 최초  상용화를 위해 나섰다은 메가와트 이하의 출력을 내는 소형 원전이다 대형 원전의 분의 수준이다 사업비는 분의  정도밖에 안 된다 대형 원전은 한번 짓는데 조원 넘는 돈이 들어간다 은 조조원으로도 가능하다 경제 규모가 작은 나라들도 자금조달 부담이 없다 상대적으로 적은 전력량을 원하는 나라에도 설치할 수  어디든 지을 수  사회적 비용도 아낄 수  예를 들어 부지만  경기도에 설치하면 되고 그 전력을 서울에서 바로 쓸 수  보통의 대형 원전이 해안가에 자리 잡는 것과 다른 점이다 해안에 원전을 설치할 경우 송전선과 철탑을 구축하는 것부터 보상비까지 다양한 재원이 소모된다 무인으로 위험시 시스템을 자동 제어해 안전하게 작동하는 것도 대형 원전과 다르다



 조감도현대건설이 설계조달시공 다 맡아 최 전무의 목표는  시장 선점이다 세계 최초 을 만드는 것이 가장 중요하다 이를 위해 최 전무는 미국의 홀텍과 손을 잡았다 직접 전 세계 수십 개 원자력 개발 업체의 문을 두드리며 동분서주한 뒤 홀텍을 파트너사로 삼았다 미국이 에너지 패권을 쥐기 위해 원자력 연구에 힘을 싣고  때였던 년이었다 그는  개발을 새 스포츠카 개발에 비유하면 홀텍은 쌈박한 엔진을 만드는 기술을 업체다  안에 들어가는 원자로를 만든다 현대건설은 변속기 조향장치 자동차 강판 조립까지 다른 전 과정을 담당한다고 말했다 이어 두 회사가 힘을 합치면 훨씬 빨리  첫 호기를 선보일 수 며 경쟁사보다 앞서 나갈 방법은 원천기술을 가진 곳과 협력하는 것뿐이라고 말했다양사는 팀 홀텍을 꾸려 영국 원자력청이 이끄는  기술개발 사업에 뛰어들었다 팀 홀텍은 우크라이나에도 진출했다  규모  파일럿 설치에 이어 향후 기를 짓기 위해 준비 중이다 최 전무는 전쟁 때문에 다른 해외 들이 다 빠져나갈 때도 홀텍은 우크라이나를 지켰다며 러시아와 전쟁이 끝나면 본격적으로 배치 작업이 시작될 계획이라고 밝혔다특히 그는 년 미국에서 최초 호기를 선보이는 것이 목표라며 다른 나라 경쟁사들과 비교해 팀 홀텍의 개발 속도가 가장 빠르다고 강조했다 국제원자력기구는 세계  시장이 년 조원 규모까지 커질 것으로 예상했다



현대건설 뉴에너지 사업부장 최영 전무  사진허영한  을 통한 수익성 확대도 기대하고  현대건설은 대형원전을 지을 때 설계조달시공 중 시공만 주로 담당했다 에서는 영역을 더 확장했다 최 전무는 홀텍과 함께하는 부분도  에서는  전 과정을 현대건설이 담당하게 된다며 주택사업에 빗대자면 개발시행건설분양까지 우리가 다 맡는 건데 이로 인해  수익성이 높을 것으로 보인다고 말했다최 전무는 년 현대건설 플랜트 사업본부로 입사한 후 국내에서는 영광월성신고리 원전 해외에서는  바라카 원전 현장을 담당했다 외환위기 직후 에너지 소비가 줄면서 원자력 발전이 주춤하자 잠시 화력발전을 맡았던 년을 빼고는 년 동안 원자력 외길만을 걸었다'
