title|content
그래픽김현국										수열 사업은 물의 열온도을 이용해 냉각이나 보온에 필요한 에너지를 공급하는 것이다 전기 등을 직접 생산하는 것은 아니지만 에너지 절약 효과가 크다 소양강댐의 경우 수심  지점의 수온은 사계절 내내 도로 차게 유지된다 이런 댐 심층수를 끌어다 열이 많이 나는 데이터센터 등을 식히는 데 쓰면 에어컨 가동을 위한 전기를 아낄 수  댐의 차가운 물이 데이터센터 등을 통과하면 도 정도로 따뜻해진다 이 물을 관로를 통해 인근 스마트팜으로 보내면 농작물 재배에도 쓸 수  이런 물 순환을 이용해 냉난방에 들어가는 에너지를 절약하는 것이 수열 사업이다구글은 핀란드 하미나 지역의 데이터센터 냉각에 차가운 물을 이용한다 프랑스와 캐나다는 각각 센강과 온타리오 호수의 물을 끌어다 파리 내 여 곳 및 토론토 내 여 곳의 공공기관과 상업주거용 건물에 냉방용 물을 공급한다 미국 코넬대도 인근 카유가 호수의 물로 냉방을 한다 우리나라도 서울 롯데월드타워와 삼성서울병원은 한강 물을 건물 냉난방에 쓰고  환경부는 년까지 댐과 하천의 물 온도를 이용해 의 에너지를 확보한다는 계획이다소양강댐의 수열 용량은 만냉동톤으로 추산된다 는 평짜리 원룸을 시간 냉난방할 수  양이다 소양강댐에 수열용 관로를 연결하면 최대 원룸 만곳의 냉난방 에너지를 아낄 수  셈이다 수공 관계자는 데이터센터를 식힐 때 에어컨보다 차가운 물을 이용하면 전기를  덜 쓴다는 시뮬레이션 결과도 고 했다 환경부는 년까지 개 다목적댐에서 만를 확보한다는 계획이다수열 사업은 탄소 중립에도 기여할 수  우리나라는 온실가스 감축 목표에 따라 년까지 년 대비 온실가스를  줄여야 한다 원전이나 재생에너지를 이용한 온실가스탄소 감축 외에 수열 사업으로 탄소를 줄이는 것도 인정된다 원전이나 태양광 단지 추가 건설 없이도 댐과 하천 인프라를 이용해 의 탄소를 줄이는 효과를 기대할 수 수열 사업물의 온도를 이용해 냉각이나 보온에 필요한 에너지를 대체하는 사업 댐의 수심 에서 얻는 도의 차가운 물로 열이 많이 발생하는 데이터센터 냉각 등에 사용하면  정도의 전기를 아낄 수 '
세계교회협의회 기후정의위 부위원장에 추대된 배현주 전 교수 기후위기 우리에겐 더 이상 시간이 없다 진영을 넘어 교단노회개교회 연대해야|'기후정의위 향후 개 분과로 나눠기후 정의 실천 좋은 사례 찾으며생물 다양성 문제 해결책 등 모색



배현주 세계교회협의회 기후정의와지속가능발전위원회 부위원장이 지난 일 스위스 제네바에서 폐막한 위원회 회의에서 발언하고  세계교회협의회 제공배현주 전 부산장신대 교수가 최근 세계교회협의회 산하 기후정의와지속가능발전위원회기후정의위 부위원장으로 추대됐다 세계교회협의회는 년 전 독일 카를스루에에서 열린 제차 총회에서 기후정의위를 신설했다 그만큼 전 세계 교회가 기후위기 극복에 대한 책임감을 느끼고  뜻이다회의차 스위스에 머물고  배 교수는 일 국민일보와의 통화에서 기후위기는 진보와 보수를 가리지 않고 모든 교회가 나서야 하는 문제라며 세계교회가 한국에 거는 기대가 크다 한국교회 다음세대의 저력을 세계와 연결하고 확장하는 일에 나서려고 한다고 말했다배 교수에 따르면 그동안 세계교회는 환경오염을 무시한 경제성장은 불가능하다고 판단하고 유엔에서 지속가능성이 논의되는 발판을 마련했다 년에는 서울에서 정의 평화 창조질서의 보전이라는 세계대회를 개최했고 년 브라질 리우데자네이루에서 개최된 유엔 환경개발회의 지구정상회담 이후에는 매년 기후변화협약 당사국 총회에 참가하면서 기독교적 입장을 꾸준히 전달하고 그는 앞으로 기후정의위는 개 분과로 나눠 기후정의를 실천하는 좋은 사례를 찾고 기후난민이나 삶의 터전을 잃은 원주민의 목소리를 전달하려고 한다며 또 멸종되는 생물 다양성 문제를 해결하고 생명 경제에 대한 신학적 자료를 만들어 공유연대할 예정이라고 밝혔다한국교회가 한국교회  탄소 중립 로드맵을 만들거나 몽골 은총의 숲을 조성하는 등 기후위기 극복을 위한 다양한 활동을 펼치고  일부 교회에 국한돼  것은 아쉬운 점이라고 했다 그는 한국교회의 여러 실천 사례를 전 세계에 자랑스럽게 소개하고  오히려 한국교회 대부분은 이런 사례가  사실을 잘 모르고 며 우리에겐 더 이상 시간이 없다 진보와 보수의 진영논리를 넘어서 교단노회개교회 차원의 관심 교육 대화가 필요하다고 강조했다기후위기 극복은 하나님과 이웃을 사랑하는 기독교 기본 계명으로 돌아가라는 뜻입니다 지구의 생명이 달린 일을 맡게 돼 어깨가 무겁지만 헌신적인 형제자매들과 함께 최선을 다하겠습니다배 교수는 기독교환경운동연대 공동대표와 한국전국연맹 이사를 맡고  세계교회협의회 중앙실행위원을 역임했다 부위원장 임기는 년까지다'
차 주행거리 줄이면 최대 만원 드려요|울산시 탄소중립포인트 시행오늘부터 참여자 선착순 모집울산시는 자동차 주행거리를 줄이면 인센티브를 제공하는 탄소중립포인트를 올해도 시행한다고 일 밝혔다 이 제도는 주행거리를 줄인 실적에 따라 만만 원의 인센티브를 지급하는 온실가스 감축 실천 운동이다 대상은 비사업용 승용승합차인승 이하 중 휘발유 경유 액화석유가스 차량이다 전기 하이브리드 수소 차량과 타 시도 등록 차량은 제외된다 올해는 지난해 대보다 대 늘어난 대를 모집해 더 많은 시민이 혜택을 받을 수  했다고 시는 설명했다 시는 일부터 일까지 참여 희망자를 선착순 접수한다 희망자는 탄소중립포인트 홈페이지에서 회원 가입한 뒤 신청하면 된다  이전 참여자는 기존 아이디로 로그인해 재참여 신청할 수  회원 가입 시 자동차 소유주 명의로 해야 하며 인당 대만 참여할 수  감축 실적은 참여자가 참여 시점과 종료 시점의 차량 번호판과 계기판 사진을 올리면 한국환경공단에서 과거 주행거리와 비교해 산정한다 지난해에는 총 대가 참여한 가운데 참여자의 약 인 대가 주행거리를 감축해 대당 평균 약 만 원 총 억만 원의 인센티브가 제공됐다 또 이산화탄소  정도의 온실가스를 감축했다
지자체 수소전지 트램 사업 친환경성 떨어진다기고김동찬|각 지방자치단체가 제안하여 도시철도망 구축계획에 반영된 트램노면전차은 전국적으로 곳 노선에 이르나 실제 공사를 시작한 곳은 위례선 노선 곳에 불과하다고 한다 트램을 가동하는 동력원은 전기로 전기를 공급하는 방법급전 방식에 따라 가선차량에 전기를 공급하는 전선 방식과 무가선 즉 전선 없는 방식으로 구분된다 무가선 급전 방식은 배터리 지면 수소연료전지 급전 방식으로 분류된다 일부 지자체는 수소연료전지 급전 방식 트램에 대해 친환경적이고 탄소 중립에 크게 기여한다고 강조하고   수소연료전지란 수소가 가진 화학에너지를 전기화학 반응을 통해 전기에너지로 직접 변환하는 발전장치로 발전 효율이 높고 유해물질 배출이 없어 친환경 에너지로 평가된다  문제는 수소의 제조 방법이다 수소의 제조 방법은 석유화학 제철공장 배출 부생가스로부터 수소 분리부생수소 석유 원료 천연가스를 개질해 만드는 개질수소 유기성폐기물의 발효가스바이오가스를 개질해 만드는 바이오수소 물의 전기분해에 의한 수전해수소 등이  부생수소 가격이 낮은 편이나 물량에 한계가  가장 많이 사용되는 것은 석유화학 원료나 천연가스 개질수소다  그런데 이 수소를 만들기 위한 수증기 개질 공정에서 온실가스인 이산화탄소가 다량 배출된다 또 직간접 전기에너지를 많이 사용한다 수소 자체는 청정에너지이나 제조 과정에서 배출되는 이산화탄소량은 화석연료 또는 유기성폐기물음식물쓰레기 하수슬러지을 직접 연소하는 경우와 비슷하다 최근 지자체에서는 유기성폐기물을 활용해 생산한 바이오가스를 보일러 열병합발전소 등의 연료로 사용하거나 가스엔진 발전 그리고 수소차 연료전지 공급용으로 사용한다 그런데 사용 방법에 따른 이산화탄소 배출량을 보면 직접 연소하는 경우와 별 차이가 없다 이처럼 수소 자체는 친환경적이나 현재 수소를 제조하는 과정과 거기서 배출되는 이산화탄소량을 감안하면 과연 수소연료전지 트램이 친환경적이고 탄소중립성이  할 수  의문이다 트램 선정을 위한 포퓰리즘은 아닐지 경계해야 할 것이다
