title|content
민관 년까지 조 금융지원온실가스 만톤 감축|'정책금융기관 조 금융지원저탄소 공정 개선시 우대보증산은대 시중은행 조 출자 미래에너지펀드



김주현 금융위원장이 일 오전 서울 상암동 서울에너지드림센터에서 김상협  탄소중립녹색성장 위원회이하 탄녹위 민간위원장과 한화진 환경부 장관이 자리한 가운데 은행장 및 정책금융기관장 간담회를 개최해 기후위기 대응을 위한 금융지원 확대방안과 저탄소 체계로의 전환 가속화를 위한 녹색투자 확대방안을 발표했다 금융위원회 제공년까지 탄소배출을 획기적으로 줄이기 위해 정부와 정책금융기관 대 시중은행이 조원 규모 금융 지원에 나선다 이를 통해 국내들이 작업공정을 저탄소로 전환하고 풍력과 태양광 등 재생에너지 설비 증설을 하도록 유도할 계획이다금융위원회는 일 간담회를 열고 이러한 내용이 담긴  기후위기 대응을 위한 금융지원 확대방안을 발표했다 이날 간담회에는 김주현 금융위원장과 김상협  탄소중립녹색성장위원회 민간위원장 한화진 환경부 장관 그리고 대 시중은행장 및 정책금융기관장이 참석했다이날 발표를 보면 산업은행 수출입은행 은행 신용보증기금 기술보증기금 등 정책금융기관은 년까지 기후위기 대응에 총 조원의 정책금융을 공급한다 년까지 정책금융기관의 연평균 녹색자금 공급량을 직전 년 평균인 연간 조원 대비  확대한 연 조원 수준으로 공급 규모를 늘린 것이다 정책금융기관의 주요 지원분야는 저탄소 공정 개선시 우대보증 에너지전환 프로젝트 보증 초기 녹색기술사업 투자 탄소배출 감축시 금리우대 친환경 선박 등 여신 지원 등이다금융위는 정책금융기관의 지원 규모가 확대됨으로써 년 온실가스 감축량이 약 만에 달할 것으로 보고있다 이는 국가 감축목표인 억만 대비 약  수준이다시중은행도 힘을 보탠다 해상풍력과 같이 대출 회수가 어려워 자금 조달이 까다로웠던 모험자본 조원 중 조원을 정책금융기관과 시중은행이 공동으로 공급하기로 했다산업은행과 대 시중은행국민신한하나우리농협은 년까지 총 조원을 출자해 미래에너지펀드를 신규 조성할 계획이다 조성된 펀드는 국내 태양광 풍력 등 재생에너지 발전설비에 투자된다 정부는 산업은행이 펀드별로 를 출자해 위험흡수역할을 하는 것을 고려해 펀드 출자시 위험가중치를 현행 에서 로 낮췄다은행권은 기후기술 분야에 약 조원가량을 별도 투자한다 연평균  성장이 예상되는 기후기술 분야에 유동성을 투입해 초기 경제성을 확보할 수  만든다는 취지다 은행과 개 시중은행은 총 조억원을 출자하고 민간자금 조억원을 매칭해서  기후기술펀드도 조성한다이와 함께 금융당국은 혁신성장펀드조원 성장사다리펀드조원 등을 통해서도 기후기술을 육성한다금융위는 관계부처와 기후금융 협의체를 구성해 이번 금융지원 방안에 따라 적재적소에 자금이 공급될 수  유도할 계획이다 또 이번 대책이 년까지 필요한 금융지원 방안인 만큼  탄소중립 달성에 필요한 사항은 금융위 부위원장 주재의 미래대응금융 태스크포스를 통해 장기 과제로 검토할 예정이다'
정부 기후위기 대응에 정책금융  공급|'금융위 기후위기 대응 금융지원 확대 방안 발표산은대 시중은행 조 출자 미래에너지펀드 조성



김주현 금융위원장이 일 오전 마포구 서울에너지드림센터에서 열린 기후위기 대응을 위한 금융지원 간담회에서 발언하고 연합뉴스         정부가 기후위기 대응을 위해 년까지 총 조원의 정책 금융을 공급한다 은행권은 조원을 출자해 미래에너지펀드를 조성하기로 했다 이 펀드는 재생에너지 설비 증설에 조원을 공급하는 것을 목표로 한다금융위원회는 일 김주현 금융위원장 주재로 간담회를 개최해 기후위기 대응을 위한 금융지원 확대 방안을 발표했다 간담회에는 김상협  탄소중립녹색성장 위원회 민간위원장과 한화진 환경부 장관 대 시중은행장 정책 금융 기관장 등이 참석했다김 위원장은 오늘날 우리가 마주한 전례 없는 기후변화는 우리 의 경쟁력뿐만 아니라 우리 미래 세대를 위해서도 꼭 풀어야 할 과제라며 년까지 총 조원의 정책 금융을 공급하겠다고 했다정부는 의 저탄소 공정 전환을 위해 산업은행 수출입은행 은행 신용보증기금 기술보증기금 등을 통해 정책금융을 공급한다는 계획이다 연평균 자금 공급량은 지난 년 평균인 연 조원 대비 연 조원으로  확대된다 정부는 이를 통해 년 온실가스 배출이 약 만 감축될 수  것으로 추산했다 이는 년까지 국가 감축 목표의  수준이다또 국민 신한 우리 하나 농협 등 대 시중은행과 산업은행은 태양광 풍력 해상 풍력 등 신재생에너지 발전 시설 증설을 위해 조원을 출자해 미래에너지펀드를 조성하고 정책금융기관들은 조원의 후순위대출을 공급한다 이를 통해 년까지 들이 신재생에너지 발전시설 증설을 위해 필요한 것으로 추정되는 자금 조원 중 조원을 조성하기 위한 모험 자본의 일부를 공급 연기금이나 보험사 공제회들의 자금이 들어올 수  마중물 역할을 한다는 계획이다정부는 이에 따라 풍력 등 신재생에너지 발전 비중이 현행 에서 정부의 전력수급기본계획대로 년 까지 확대될 수  것으로 기대하고 정부는 또 민관 합동으로 년까지 재생에너지 탄소포집 수소에너지 온실가스 고정 친환경패키징 등 기후기술 분야에 조원을 투자한다 기후기술 분야는 향후 연평균 의 시장 성장이 예상되는 유망한 분야지만 초기 경제성이 부족해 개발이 더딘 것을 개선하기 위해서다 우리나라는 기후기술 산업분야에서 선진국과 기술 격차가 최대 년 벌어져  상황이다이를 위해 은행과 대 시중은행이 출자해 년까지 조원 규모의 기후기술펀드를 조성하고 혁신성장펀드에서 조원을 성장사다리펀드에서 조원을 각각 끌어온다는 계획이다정부는 기후금융 지원을 위한 제도 정비에도 나선다 은행이 여신에도 한국형 녹색분류체계를 적용할 수  연내 금융권과 공동으로 녹색여신 관리지침을 만들고 국내 금융권의 기후 리스크 관리 강화도 지원한다'
머니픽 김주현 기후위기 대응 미래세대 위해 꼭 풀어야 할 과제|'김주현 금융위원장이 일 서울  마포구 증산로 서울에너지드림센터에서 진행된 민관 기후위기 대응을 위한 금융지원 확대방안 간담회에 참석 발언을 하고 



 



 이날 김주현 금융위원장은 정부정책금융기관은행이 협업을 통해 기후위기에 대응하는 의미있는 첫 걸음마를 내딛게 됐다 최근 기후변화는우리 의 경쟁력뿐만 아니라 우리 미래세대를 위해서라도 꼭 풀어야 할 과제라 전하며



 



 이어서 그는 기후위기 해소를 위해 기후기술의 발전도 뒷받침돼야 할 것으로 정책금융의 기후위기 대응 지원 역할 강화 재생에너지 설비 증설 적극 투자 조원 규모 투자를 통한 국내 기후기술  적극 육성 등 가지 지원 방안을 제시했다



 



 끝으로 김 위원장은 은행권을 향해 이번에 새로 조성한 펀드들은 단기적 성과가 나타나지 않을 수  관련 실무진의 성과 평가 시 이런 점을 잘 감안해 주시길 바란다 이번 기후위기 대응을 위한 금융지원 방안을 계기로 우리 은행 산업이 가계대출을 넘어 우리 경제 미래를 위한 혁신금융 지원 산업으로 발전해가길 기대한다고 당부했다



 



 이번 현장간담회는 민관합동 기후위기 대응을 위한 금융지원 확대방안을 금융위원회에서 마련 주요 시중은행장과 정책금융기관장에게 설명하기 위해 개최된 자리로 현장에는 김주현 금융위원장 한화진 환경부 장관 김상협 탄소중립 녹색성장 민간위원장 이세훈 금감원 수석부원장 등 정부 및 유관부처 장을 비롯해 강석훈 산업은행 회장 윤희성 수출입은행장 김성태 은행장 최원목 신용보증기금 이사장 김종호 기술보증기금 이사장 등 관계기관장 조용병 은행연합회장 정상혁 신한은행장 이승열 하나은행장 이재근 국민은행장 조병규 우리은행장 이석용 농협은행장 허성무 한국성장금융투자운용 대표 등 금융권 인사들이 참석했다'
한국수목원정원관리원 산림탄소상쇄사업 온실가스 감축 기여|'국립세종수목원 만 그루 연 톤 탄소흡수 효과개 수목원 중형차 만대 년 배출 온실가스 감축



국립세종수목원 내 수목 탄소흡수량을 측정하고  대전충남뉴스 박찬수   산림청 산하 한국수목원정원관리원이하 한수정이 추진하는 산림탄소상쇄사업이 온실가스 감축에 크게 기여하고  것으로 나타났다일 한국수목원정원관리원에 따르면 기후위기 대응을 위해 지난해부터 사회공헌형 산림탄소상쇄사업을 펼치고  이 사업은 이나 공공기관이 탄소흡수원 유지 또는 증진 활동을 통해 온실가스를 감축하는 것을 목적으로 하고  한수정은 지난해 국립세종수목원 전시원  구역에 식재한 주요 수목 여그루를 탄소흡수원으로 등록하고 지속적으로 관리 및 측정하고 한수정에서 운영하는 개의 수목원국립백두대간수목원 국립세종수목원 국립한국자생식물원 탄소흡수원 효과는 중형차량 만대가 년간 배출하는 온실가스를 감축하고  것으로 조사됐다특히 국립세종수목원의 경우 주요 전시원에 식재된 만여 그루를 포함한 종 만 그루를 대상으로 탄소흡수량 효과 측정사업을 벌인 결과 연간 톤의 탄소흡수 효과가 발생하고  것으로 분석됐다한수정은 탄소흡수원 확장을 위해 국립세종수목원에 식재된 식물이 년까지 성장하면서 연간 최대 톤의 온실가스를 흡수할 것으로 기대하고  이밖에 한수정은 산림청의 지원으로 전국의 여개 공사립수목원을 대상으로 산림탄소상쇄사업을 지원할 예정이다 신창호 국립세종수목원장은 산림탄소상쇄사업을 통해 수목원에 식재된 수목의 탄소흡수 효과량을 예측하고 확인하는 좋은 계기가 됐다며 신규 탄소흡수원을 통해 탄소중립에 기여할 수  최선의 노력을 다하겠다고 말했다'
김주현 은행업 미래 위한 혁신금융 지원산업으로 발전 기대|'금융위 민관합동 기후위기 대응 위한 금융지원 확대방안 마련정책금융 기후위기 대응 지원 역할 강화개 정책금융기관 년까지 총 조원 지원재생에너지 설비 증설 적극 투자은행권 총 조원 미래에너지펀드 출자기후기술  적극 육성조원 규모 투자 



김주현 금융위원장이 일 오전 서울 상암동 서울에너지드림센터에서 김상협  탄소중립녹색성장 위원회이하 탄녹위 민간위원장과 한화진 환경부 장관이 자리한 가운데 은행장 및 정책금융기관장 간담회를 개최해 기후위기 대응을 위한 금융지원 확대방안과 저탄소 체계로의 전환 가속화를 위한 녹색투자 확대방안을 발표했다 사진금융위원회 제공김주현 금융위원장은 기후위기 대응을 위한 금융지원 방안을 계기로 우리 은행산업이 가계대출을 넘어 우리 경제의 미래를 위한 혁신금융 지원산업으로 발전해나가길 기대한다고 말했다   일 금융위원회는 김주현 금융위원장 주재로 김상협  탄소중립녹색성장 위원회이하 탄녹위 민간위원장과 한화진 환경부 장관이 자리한 가운데 은행장 및 정책금융기관장 간담회를 개최해 기후위기 대응을 위한 금융지원 확대방안금융위과 저탄소 체계로의 전환 가속화를 위한 녹색투자 확대방안환경부을 발표했다   김주현 금융위원장은 모두말씀에서 오늘날 우리가 마주한 전례 없는 기후변화는 우리 의 경쟁력뿐만 아니라 우리 미래세대를 위해서라도 꼭 풀어야 할 과제라며 기후위기에 대처하기 위해서는 들이 공정을 전환하여 탄소를 적게 배출하거나 탄소배출이 많은 화석연료 발전 전기를 청정에너지 발전 전기로 바꾸어야 한다고 지적했다   김 위원장은 이를 위해서는 기후기술의 발전도 뒷받침되어야 할 것이라면서 이러한 인식 하에 이번에 크게 가지 지원방안을 마련했다고 설명했다   그는 우선 이 저탄소 전환을 할 수  정책금융의 기후위기 대응 지원 역할을 강화하겠다며 개 정책금융기관이 년까지 연평균 녹색자금 공급량을 과거 개년 평균 대비  확대해 총 조원을 지원함으로써 들이 신속하게 저탄소 시설로 전환하고 녹색프로젝트를 적극 수행하도록 유도하겠다고 강조했다   김 위원장은 다음으로 재생에너지 설비 증설에 적극 투자하겠다며 은행권 공동으로 총 조원을 미래에너지펀드에 출자해 년까지 모험자본을 충분히 공급함으로써 필요한 증설자금 조원이 시장에서 원활하게 조달될 수  하겠다고 밝혔다   그러면서 마지막으로 약 조원 규모의 투자를 통해 우리나라를 이끌어갈 기후기술 도 적극적으로 육성해 나가겠다고 부연했다   이어 정부도 은행의 적극적인 투자를 유도하기 위해 기존에 없던 새로운 방식의 지원체계를 마련했다면서 정부는 은행이 적극적으로 참여할 수  정책금융기관이 일부 위험을 부담함으로써 은행이 미래에너지펀드에 출자할 때 위험가중치를 현행 에서 까지 낮췄다고 강조했다   김주현 금융위원장은 이번 기후위기 대응을 위한 금융지원 방안을 계기로 우리 은행산업이 가계대출을 넘어 우리 경제의 미래를 위한 혁신금융 지원산업으로 발전해나가길 기대한다고 마무리했다'
국내 연구진 세계 최고 수준의 리튬 금속배터리 용매 개발|'연구 모식도 제공뉴스대전뉴스 김태진   국내 연구진이 세계 최고 수준의 리튬 금속배터리 용매를 개발했다이는 리튬 이차전지의 에너지밀도를 높이고 고전압 구동 시 안정성을 높여줄 용매로 주목된다한국과학기술원은 생명화학공학과 최남순 교수팀이 울산과학기술원 화학과 홍성유 교수팀 서울대 화학생물공학부 이규태 교수팀 고려대 화공생명공학과 곽상규 교수팀 경상국립대 나노신소재공학부 고분자공학전공 이태경 교수와 이 같은 개발에 성공했다고 일 밝혔다연구팀은 의 높은 충전 전압에서 리튬 금속전지의 효율과 에너지를 유지하는 세계 최고 수준의 전해액 조성 기술을 개발했다연구팀은 기존에 보고되지 않은 용매를 새롭게 디자인하고 합성해 전해액 주 용매로 사용 전극전해액 계면을 안정화하는 첨가제 기술과의 조합을 통해 리튬 금속전지의 고전압 수명 성능 및 고속 충전 특성을 획기적으로 높였다이 기술은 가역 효율상온 회 을 현저하게 향상했고 리튬 대비  높은 충전 전압 조건에서 다른 전해액보다 약  정도 높은 의 높은 방전용량 유지율을 보였다가역 효율은 매 사이클마다 전지의 방전용량을 충전용량으로 나눠 백분율로 나타낸 값으로 배터리의 가역성을 의미한다리튬 금속전지를 오랜 시간 사용하기 위해서는 전해액의 이온 전달 성능뿐만 아니라 전극 표면을 보호하는 것이 필수적이다 이에 따라 전자를 주는 성질이 강한 리튬금속 음극과 전자를 빼앗으려는 고전압 양극에 접촉하고  전해액이 분해되지 않도록 전극과 전해액 사이에 보호층을 형성시켜야 한다연구팀이 이번 연구에서 세계 최초로 합성 및 보고한 환형 설폰아마이드 계열 용매인 는 기존에 사용되는 용매보다 우수한 고전압 안정성을 가져 전지 내부 가스 발생을 억제할 수  확인했다새로운 구조의 고전압 용매는 전극을 보호하는 첨가제와 함께 시너지 효과를 이끌어 고전압 리튬 금속전지 성능을 극대화했다는 점에서 그 의미가 크다



최남순  교수최남순 교수는 새로운 구조로 디자인된  용매는 기존 용매에 비해 열적 및 고전압 안정성이 매우 우수하고 전지 구동 중 전해액 분해를 최소화해 전지 내압 상승요인인 가스 발생을 억제하는 전해액 용매라며 연구팀 고유기술인 다중층 전극전해액 보호층 형성을 통해 안정화함으로써 고전압 리튬 금속전지 실용화를 위한 전해액 설계에  새로운 이정표를 제시했다고 말했다한국연구재단의 단계도약형 탄소중립 기술개발사업과 한국산업기술평가관리원의 산업기술 혁신사업의 지원을 받아 수행된 이번 연구의 성과는 국제 학술지 어드밴스드 머티리얼즈 온라인에 지난 일 게재됐다'
 기후대응 강화재생에너지 전환 가속 등 시급 총선 매니페스토 공개|'그린워싱 방지지속가능 금융 확대 등 가지 과제 제시



