title|content
산청뉴시스 산청군청 재판매 및  금지 재판매 및  금지군민 건강증진 도모를 위해 실시한 이번 캠페인에서는 비만 예방의 필요성과 일상에서 실천할 수  비만 예방법 등을 소개했다특히 가볍게 일상에서 걷고 물을 마시고 나트륨지방당을 줄이자를 구호로 건강증진 컵홀더를 제작배포하며 비만 예방에 대한 관심을 높였다산청군은 이번 캠페인과 함께 오는 일까지 모바일 걷기 앱 워크온에서 점심시간 졸면 뭐하니 걷기 챌린지를 운영한다한편 참여자가 일간 만보를 달성하면 추첨을 통해 명에게 모바일 상품권을 지급한다'
애플  칩 탑재 맥북 에어 공개칩 모델 대비 속도 최대 |'배터리 최대 시간 지속첨단  기능 제공애플이 강력해진  칩을 탐재해 전력 효율성과 휴대성을 높인 새로운 맥북 에어 를 일현지시간 공개했다



칩을 탑재한 신형 맥북 에어  사진애플 칩을 탑재한 맥북 에어는  칩 탑재 모델 대비 최대  인텔 기반 맥북 에어 대비 속도가 최대 배 향상됐다 맥북에어는  칩의 더 빠르고 효율적인 신경 엔진 을 바탕으로  기능도 강화했다맥북 에어 는 얇고 가벼운 디자인과 최대 시간 지속되는 배터리 사용 시간 리퀴드 레티나  디스플레이 최대 대의 외장 디스플레이 지원 이전 세대 대비 최대 배 향상된 와이파이 속도 등 새로운 기능까지 갖추고 내구성이 뛰어난 유니바디 디자인의 견고한 알루미늄 외장을 갖춘 새로운 맥북 에어는 스타라이트 스페이스 그레이 실버는 물론 혁신적인 양극 산화 봉공 처리술로 지문 자국을 방지하는 미드나이트의 가지 색상으로 출시된다 맥북 에어는 세계적인 수준의 카메라 마이크 스피커 성능 맥세이프 충전 기능 조용한 팬리스 디자인 맥를 한 데 결합했다그렉 조스위악  애플 월드와이드 마케팅 담당 수석 부사장은 맥북 에어는 가장 인기  사랑받는  제품이라며  칩 탑재와 새로운 기능의 추가로 한층 더 강력해졌다고 설명했다 이어 학위 과정을 밟는 대학생부터 강력한 생산성을 요구하는 비즈니스 사용자는 물론 성능과 휴대성 업계를 선도하는 배터리 사용 시간이라는 타의 추종을 불허하는 조합을 팬리스 디자인에서 만나보고 싶은 사용자에게 모두 더할 나위 없이 적합한 제품이라며 새로운 맥북 에어는 이를 바탕으로 세계 최고의 얇고 가벼운 노트북이라는 명성을 계속해서 이어나갈 것이라고 말했다 칩은 업계 최고 수준의 나노미터 기술을 사용해 설계됐다 이를 바탕으로 맥북 에어는 강력한 코어 중앙처리장치 최대 코어  최대 기가바이트 통합 메모리 지원 기능을 갖췄다 사용자는 일상적인 생산성 작업은 물론 사진과 영상 편집 소프트웨어 개발 등 고성능 작업에 이르기까지 작업 강도에 관계 없이  칩의 향상된 속도를 경험할 수 아울러 새로운 맥북 에어는  칩의 차세대 를 토대로 하드웨어 가속형 메시 셰이딩과 레이 트레이싱을 지원한다 이를 바탕으로 빛 반사 및 그림자를 한층 정밀하게 구현하고 극도로 실감 나는 게이밍 경험을 선사한다 또한  디코딩을 지원하는 최신 미디어 엔진을 바탕으로 스트리밍 서비스에서 더욱 효율적이고 퀄리티 높은 동영상 시청 경험을 제공한다애플 실리콘 으로의 전환 덕에 모든 종류의 맥은 인공지능 기능을 위한 훌륭한 플랫폼으로 거듭나고  속도와 효율성이 향상된 코어 신경 엔진은 물론 온디바이스 머신 러닝에 박차를 가하는  및  가속기를 갖춘  칩을 탑재해  기능을 지원한다 맥는  성능을 활용해 생산성과 창의성을 향상시켜주는 스마트한 기능들을 제공한다 이로써 사용자가 강력한 카메라 기능 실시간 받아쓰기 번역 자동 완성 텍스트 시각 이해 손쉬운 사용 등 다양한 기능들을 활용할 수  된다첨단  기능을 제공하는 방대한 앱 생태계를 통해 사용자는  수학 도우미로 숙제를 검토하는 작업부터 자동으로 사진을 보정하는 작업 동영상 배경 잡음을 제거하는 작업까지 어떤 작업이든 손쉽게 수행할 수  또 애플 실리콘의 통합 메모리 아키텍처와 결합한 맥북 에어는 우수한 성능으로 자체 이미지를 생성하기 위한 확산 모델과 대규모 언어 모델 등 최적화된  모델들을 실행할 수  맥북 에어는 온디바이스 성능에 더해 클라우드 기반 솔루션들을 제공한다새로운 맥북 에어는 애플 제품 최초로 재활용 소재 사용 비율 를 달성한 제품이다 외장에  재활용 알루미늄을 모든 자석에  재활용 희토류 원소를 사용하며 애플 사상 최초로 메인 로직 보드에  재활용 구리를 사용한다맥북 에어는 애플의 높은 에너지 효율 기준을 충족하며 수은 브롬화 난연제 가 포함돼  않다 포장재는  섬유 기반 소재로 이로써 은 년까지 모든 포장재에서 플라스틱을 제거하겠다는 목표에 더 가까워졌다현재 애플은 글로벌  활동에 대해 탄소 중립화를 달성했다 년까지 제조 공급망과 모든 제품 수명 주기를 포함하는  활동 전반에서 탄소 중립을 실천할 계획이다'
대창솔루션 계열사 크리오스 억 밸류로 억원 펀딩 성공|'주강분야 글로벌 강소 대창솔루션은 계열사인 액화수소 탱크 전문 크리오스가 억원 밸류로 기관투자자 자금 조달에 성공했다고 일 밝혔다



 대창솔루션은 계열사인 액화수소 탱크 전문 크리오스가 억원 밸류로 기관투자자 자금 조달에 성공했다고 일 밝혔다  사진대창솔루션이번 펀딩을 다수 기관투자자들의 적극적인 참여로 펀딩규모가 당초 예상규모보다 큰 억원으로 확대됐다김대성 크리오스 대표는 케이앤티교보 신기술투자조합을 통해 조달한 억원의 펀딩자금은 수소경제의 한 축인 운송저장탱크의 수요확대에 대응하기 위해 액화수소 탱크 전용 신규공장 건설 등에 적극 활용할 것이라고 말했다크리오스가 국산화에 성공한 액화수소 탱크는 현재 주력기술인 압축수소에 비해 배 이상의 운송효율과 초저온 냉각기술을 앞세워 향후 전개될 수소경제의 핵심적인 운송수단으로 자리매김할 것으로 기대되고 세계 여러 국가들은 온실가스 감축과 탄소중립을 위한 방안 중에서 수소가 큰 축을 담당할 것으로 예상하고 수소산업이 차세대 경제 패러다임 자리잡을 것이란 확신 하에 투자에 적극적인 상황이다 글로벌 컨설팅기관인 딜로이트는 년 글로벌 수소시장 규모를 조 달러 규모로 전망하기도 했다대창솔루션이 지난 년 인수한 크리오스는 국내  저장탱크 시장 점유율 위를 차지하고  초저온 분야 저장탱크수송탱크 선도으로  반도체 차전지 분야의 특수가스 탱크 등을 주력 사업으로 영위하고  회사이다회사 관계자는 오랜 기간 암모니아 등 특수가스 분야에서 쌓은 초저온 기술과 최적의 열전달 차폐 기술을 기반으로 액화수소탱크의 국산화에 성공하며 본격적인 확대를 앞두고 며 특히 올해 월 일 하이창원이 국내 첫번째로 액화수소생산 시설을 준공함에 따라 액화수소를 실어 나르기 위한 액화수소 탱크 트레일러 호기를 하이창원에 납품하기도 했다고 말했다이어 년 하반기에 증권을 주관사로 선정하는 등 상장 준비에 박차를 가하고 며 이번 기관 투자자금 유치를 통해 국가전략기술수소운송분야과 벤처금융 억원 이상 투자유치조건을 모두 충족하게 돼 년 변경된 기술특례 상장요건의 수혜단수평가를 적용 받을 수  빠른 시일내에 코스닥 상장을 추진할 것이라고 강조했다'
출자금 억억 확대충남도 벤처 투자 배 늘린다|'산업은행 등과 벤처 투자 활성화 업무협약김태흠 지사 한국판 실리콘밸리 조성할 것



김태흠 충남도지사가운데 등이 지난 일 충남창업마루나비에서 열린 산업은행 넥스트라운드 인 충남에서 기념촬영을 하고  충남도 제공충남도가 지역 벤처 투자 생태계를 활성화하기 위해 올해 투자 규모를 배 늘리기로 했다도는 산업은행한국벤처캐피탈협회 등과 지난 일 충남 천안시 충남창업마루나비 대강당에서 지역 벤처의 활성화와 투자 확대를 위한 업무협약을 체결했다고 일 밝혔다협약에 따라 도는 벤처 투자 출자금을 확대하고 유망  발굴과 전문가 투자 네트워크를 구성운영하는 역할을 맡는다 도는 올해 벤처투자조합에 억원을 출자하기로 했다 이는 지난해 억원과 비교해 배 많은 규모다도는 이번 출자를 통해 혁신산업펀드와 탄소중립모빌리티초기창업 펀드 등 억원 규모의 개 펀드를 정책금융 출자와 연계해 조성한다또 이달 도내 창업과 관련된 공공기관과 민간이 함께하는 컴퍼스 포럼을 출범하고 도내  투자 유치 설명회와 투자창업 강의 등을 정기적으로 개최하기로 했다산업은행은 충남 지역 내 유망 에 대한 투자 유치 지원과 도내 전통을 위한 오픈이노베이션펀드 조성을 위해 협력하기로 했다충남지방중소청을 비롯한 나머지 기관협회 등은 유망 창업벤처 발굴지원과 중앙정부 규제 개선 건의 지역 벤처캐피탈 인력 양성 전문교육 기획 등의 업무에 협력하는 역할을 수행한다김태흠 충남도지사는 충남은 대 중소과 벤처이 공존하는 생태계를 만들 것이라며 벤처이 투자를 받기 위해 수도권으로 떠나는 일이 없도록 충남은 한국판 실리콘밸리인 베이밸리를 제대로 만들어 벤처이 활동할 수  무대를 만들 것이라고 말했다'
대창솔루션 계열사 크리오스 억  밸류로 펀딩 성공|'액화수소 탱크 전문당초 예상보다 억원 추가 조달코스닥 상장 추진주강분야 글로벌 강소 대창솔루션은 계열사인 액화수소 탱크 전문 크리오스가 억 밸류로 기관투자자 자금 조달에 성공했다고 일 밝혔다 특히 회사 측은 다수 기관투자자들의 적극적인 참여로 펀딩규모가 당초 예상규모보다 큰 억으로 확대됐다고 강조했다



하이창원에 공급된 크리오스의 액화수소 탱크트레일러제공코스닥협회크리오스 김대성대표는 케이앤티교보 신기술투자조합을 통해조달한 억원의펀딩자금은수소경제의 한축인 운송 및 저장탱크의 수요확대에 대응하기 위해 액화수소 탱크 전용 신규공장건설등에 적극 활용해 본격적 외형 성장에 나설 것이라고 밝혔다크리오스가 국산화에성공한 액화수소 탱크는현재 주력기술인 압축수소에 비해 배이상의 운송효율과 초저온 냉각기술을 앞세워 향후 전개될 수소경제의 핵심적인 운송수단으로 자리매김할 것으로 기대되고 세계 여러 국가들은 온실가스 감축과 탄소중립을 위해 수소가 큰 축을 담당할 것으로 예상하고 수소산업이 차세대 경제 패러다임 자리잡을 것이라고 예상한다 실제 글로벌 컨설팅기관인 딜로이트는 년 글로벌 수소시장 규모를 조 달러 규모로 전망했다 대창솔루션이 년 인수한 크리오스는 국내 저장탱크 시장 점유율 위를 차지하고  초저온분야 저장탱크 및 수송탱크선도이다   및 반도체 차전지 분야의 특수가스 탱크 등을 주력 사업으로 하고  회사는 오랜기간  및 암모니아 등 특수가스 분야에서 쌓은 초저온 기술과 최적의 열전달 차폐기술을 기반으로 액화수소탱크의 국산화에 성공했다 올해 월일 하이창원이 국내에서 처음으로 액화수소생산 시설을 준공했고 액화수소를 실어 나르기 위한 액화수소 탱크트레일러 호기를 하이창원에 납품하기도 했다회사 관계자는 지난해 하반기에 증권을 주관사로 선정하는 등 상장준비에 박차를 가하고 며 이번 기관 투자자금 유치를 통해 국가전략기술수소운송분야과 벤처금융억원 이상 투자유치 조건을 모두 충족해 올해 변경된 기술특례 상장요건의 수혜단수평가를 적용 받을 수  돼 코스닥 상장을 추진할 것이라고 밝혔다 한편 지배회사인 대창솔루션 또한 세계위의 주강기술력을 기반으로 주력인 초대형 선박 부품에서 원자력폐기물 컨테이너 해상풍력발전기 고정부품 등으로 사업다각화 성공하며 실적이 개선되고  계열사인 크리오스 상장과 함께 동반 레벨업이 기대된다'
충남도한국남동발전 양수발전소 성공 추진 협력|충청남도가 탄소중립 실현을 위한 핵심 사업 가운데 하나인 금산양수발전소 사업을 성공적으로 추진하기 위해 금산군 한국남동발전과 상호협력 거버넌스 구축 협약을 체결했습니다  각 기관은 발전소 조기 건설과 지역 발전 정책을 공동 개발하고 발전소를 활용한 관광 자원 개발에 나서기로 했습니다  금산군은 지난해 월 신규 양수발전 공모사업 예비타당성 사업지로 선정됐으며 예타를 통과하면 충청남도는 년 말까지 한국남동발전과 함께 만 천 제곱미터 부지에 양수발전소를 건설합니다
영상 국민의힘 원전은 탈탄소 전력원 민주당 풍력태양광이 대안|'기후 위기 막을  대책은 정혜림  박지혜영상 여 야 기후 대표 기후 정쟁화는 막아야



기후 파국을 막기 위한 시간이 얼마 남지 않았다 앞으로 년 안팎이 기후 파탄을 막을 마지막 기회다여야도 기후 문제 심각성을 통감하고  월 일 국회의원 총선거를 앞두고 각각 기후 전문가를 영입했다 더불어민주당은 지난해 월 일 영입인재 호로 기후환경 전문가 박지혜 변호사를 선택했다 국민의힘도 같은 달 일 에너지환경 전문가 정혜림 전 경영경제연구소 리서치 펠로우를 영입했다박 변호사는 녹색법률센터 상근 변호사 기후 문제 해결 비영리 법인 기후솔루션 이사 기후싱크탱크 플랜  공동대표를 역임했다 년에는 강원 삼척시 석탄화력발전소 건설 취소 행정소송 변호를 담당했다정 전 펠로우는 울산과학기술원에서 환경공학 및 생물공학을 전공했고 한국과학기술원에서 녹색경영정책 경영학석사 과정을 마쳤다 한국에너지기술연구원에서 국가 기술  산업 전환 연구를 수행한 이력도 국민의힘과 민주당이 영입한 두 전문가는 기후 문제 해결을 위한 어떤 혜안을 갖고 



더불어민주당 영입인재 호 박지혜 변호사오른쪽와 국민의힘 기후 문제 전문가 정혜림 전  경영경제연구소 리서치 펠로우 홍태식 객원온실가스 감축 목표 달성 못 해도 그만기후 문제에서 가장 큰 화두는 탄소 배출량 감축이다 탄소 배출량을 줄이기 위해 정치권이 가장 먼저 할 일은박지혜 탄소 배출량을 직접적으로 줄일 수  법과 제도를 확립해야 한다 한국은 년부터 온실가스 감축 목표를 세워왔으나 이를 지키지 못했다 년 당시 정부가 정한 년 탄소 배출량 목표치는 억만이산화탄소 환산 톤 하지만 년 집계한 탄소 배출량은 억만로 목표 달성에 실패했다 목표를 세우는 것도 중요하지만 이를 이행하기 위한 구체적 조치가 필요하다정혜림 탄소 배출량 감축은 더는 미룰 수 없는 당면 과제이지만 발전 등 관련 산업 인프라 전환에는 시간이 필요하다 정부가 추진하는 무탄소 이니셔티브를 활용하는 것도 하나의 방안이다 재생에너지는 물론 원자력 청정 수소로 에너지를 생산해 탄소 배출을 줄이는 방식이다 이처럼 다양한 전력원을 동원하면 탄소 배출을 줄일 수  것이라 본다박지혜 전력 공급 안정성이나 경제성도 중요하지만 에너지 정책의 밑그림을 짤 때 기후 정책이 반영되지 못하는 측면도  최근 문제가 되고  강원 삼척시 석탄화력발전소도 기후 정책이 반영되지 못한 사례다 년 탄소 감축 목표를 정했음에도 이를 고려하지 않고 정부가 전국에 석탄화력발전소 건설을 허가했다 선진국은 탈석탄을 외치며 석탄화력발전소를 줄이는 상황인데 한국에선 아직도 새 석탄화력발전소가 들어서고 



지난해 월 일 기후환경단체가 강원 삼척시 삼척블루파워 공사장 진입로에서 석탄화력발전소 건설 반대 시위를 벌이고  뉴스정혜림 석탄화력발전소를 줄여야 한다는 것에는 여야를 막론하고 이견이 없지만 지역 일자리 등을 생각하면 발전소를 일거에 없애기도 어려운 실정이다 현실을 고려해 점진적으로 석탄화력발전소를 줄여나가는 것이 최선이다석탄화력발전소를 없앤다면 그 대신 전력 공급을 할 대안이 박지혜 풍력발전 태양광발전 등 재생에너지 발전원이 대표적이다 국제에너지기구의 년 재생에너지 보고서에 따르면 지난해 새롭게 추가된 재생에너지 발전량이 전년 대비  늘었다정혜림 대안이 꼭 하나만은 아니다 재생에너지만 늘리기엔 경제성 등 우려되는 사항이 많다 원자력발전 액화천연가스 등 다양한 대안을 통해 석탄화력발전의 빈자리를 채울 수 환경 관세 피하기 위해서도 녹색성장 이뤄야석탄화력발전소 건립을 둘러싼 갈등은 기후 정책이 일관성을 유지하지 못해 생긴 사례로 보인다 기후 정책의 일관성을 담보할 방안이 박지혜 기후 정책을 쉽게 바꿀 수 없도록 제도를 정비하는 일이 급선무다 조직 측면에서는 기후 정책 전문기구가 필요하다 정치와는 동떨어져 기후 정책을 수립할 수  일관적 기후 정책 실행이 가능하다정혜림 기후 문제를 해결해야 한다는 문제의식은 모든 정당이 공유하고  당연히 기후 정책 수립에도 대부분 긍정적이다 합의만 제대로 거친다면 기후 정책을 둘러싸고 정쟁이 일어날 가능성은 낮다한국은 탄소중립과 경제성장 두 마리 토끼를 동시에 잡는 이른바 녹색성장을 추진하고  최근 영국 프랑스 등 유럽 국가들도 탄소 배출량 감축에 어려움을 겪는다는 분석이 나온다 녹색성장은 이룰 수  목표라고 생각하나박지혜 경제협력개발기구 국가들의 탄소 배출량과 국내총생산 집계를 보면 년 는 배 상승한 반면 탄소 등 온실가스 배출량은 거의 늘지 않았다 한국도 가능하다 얼마나 빨리 경제 체질을 친환경적으로 개선하고 온실가스 배출량을 줄여나가는지가 관건이다정혜림 탄소중립은 피할 수 없는 세계적 추세다 당장 년부터 유럽은 탄소 배출량 초과 에 관세를 부과할 계획이다 관세 부담을 피하기 위해서라도 친환경 과 관련 시장을 육성할 수밖에 없다 정부와 여당은 다양한 지원책을 통해 산업계의 친환경 체질 변화를 도모할 계획이다박지혜 윤석열 대통령이 대통령 후보 시절 년 내 내연기관차 신규 등록 금지를 공약한 것처럼 의 체질 변화를 독려하는 일도 중요하다 동시에 목표를 구체적으로 설정해야 한다 내연기관차로 예를 들자면 신규 등록 금지 시점을 법제화하는 등 확실한 실천 방안이 필요하다'
기후행동 손 떼는 글로벌 금융사들 경제 살리기에 밀린 지구 살리기 |'게티이미지뱅크 모건핌코 등 기후행동  탈퇴 러시자산 규모 조달러 달하는글로벌 금융사운용사 모임온실가스 배출  상대로기후변화 대응 노력 등 압박단계 저감 목표 공개엔 효과단계 실행 촉구엔 부담 느껴고객수익 우선 의무와 배치공화 압박도 작용



