title|content
윈클 아보리파이와 국내 자발적 탄소시장 활성화 위한 파트너십 체결|윈클은 아보리파이와 국내 자발적 탄소시장 활성화를 위한 를 체결했다고 밝혔다 사진원클탄소크레딧 솔루션  윈클은 글로벌 탄소저감 프로젝트 개발사 아보리파이와 국내 자발적 탄소시장 활성화를 위한 를 체결했다고 밝혔다이번 협약은 아보리파이가 자연기반해법으로 확보한 자발적 탄소배출권을 윈클 마켓플레이스를 통해 국내 에 제공함으로써 국내 자발적 탄소시장을 활성화하고 의 탄소중립 달성 지원을 목표로 한다자연기반해법은 자연 생태계를 보호 및 지속가능하게 이용하고 관리함으로써 인간에게 더 나은 삶과 생물 다양성 등의 혜택을 제공하는 동시에 사회 경제 환경적 문제를 해결하는 솔루션으로 주로 온실가스 흡수원인 산림을 복원확대하는 사업을 말한다 지난 년 월 제차 유엔기후변화협약 당사국 총회 결의문에 언급된 이후 기후 위기와 생태계 파괴의 주요 대응책으로 주목 받고 아보리파이는 산림 조림 및 복원 블루카본 개선된 쿡스토브 등 탄소저감 프로젝트를 개발한 바  아보리파이의 대표적 프로젝트인 콜롬비아 비차다 산림 재조림 사업은 년부터 글로벌 탄소배출권 인증업체인 골드 스탠다드를 통해 자발적 탄소배출권을 발급해왔다 쉐브론 네스프레소 등이 이를 이용해 배출량을 상쇄했으며 일부 은 해당 자발적 탄소배출권을  목표 달성에 사용한 것으로 나타났다윈클은 탄소정책 기술 플랫폼 분야의 전문가들이 모여 년 월에 설립한 기후행동 으로 과 개인이 모두 자발적 탄소시장에 참여할 수  마켓플레이스 서비스를 제공하고  자발적 탄소시장의 진입장벽을 낮추기 위해 자발적 탄소배출권을 톤이 아닌 킬로그램 단위로 거래할 수  기능을 구현하고 구매 이력 등 주요 정보를 블록체인에 기록하는 플랫폼을 구축해 자발적 탄소배출권 거래의 투명성과 신뢰성을 확보했다 또한  캠페인 및 제자 화이트 라벨 서비스로 일부 대의 직업 참여 탄소 상쇄 캠페인을 지원한다윈클은 아보리파이와의 이번 파트너십을 통해 양질의  탄소배출권을 국내 자발적 탄소배출권 시장에 안정적으로 수급할 수  것으로 기대한다 아보리파이는 현재 콜롬비아 토고 인도네시아 등지에서 개의  탄소 저감 프로젝트를 진행 중이며 상응조정 반영 생물다양성 보전 지역사회 구성원 건강 개선 고유종 보호를 통한 자연복원 등 다방면의 지속가능성을 충족하는 탄소배출권을 공급해 의 수요에 탄력적인 옵션을 제공할 수  것으로 보인다 윈클은 아보리파이와의 협력을 통해 에 선도 탄소배출권 및 프로젝트 직접 투자 기회를 제공할 계획이다스테파노 보르기  아보리파이 회장은 윈클과의 파트너십을 통해 한국 내 들에게 기후변화완화 생물다양성 보호 지역사회의 환경 개선 등에 동참할 수  기회를 제공하게 되어 기쁘다고 밝혔다박성훈 윈클 대표는 이번 협약을 통해 탄소배출권을 제공함으로써 고객 참여의 폭을 넓힐 수  것이라며 아보리파이와 장기적인 파트너십을 구축해 국내외 자발적 탄소시장 활성화를 위해 함께 노력할 수  기대한다고 덧붙였다
강남구 들 교통유발부담금 최대  감면 방법 뭐지|'구 올해 교통수요관리 제도 적극 추진연면적  이상 체 교통량 감축 프로그램 참여 촉진 승용차 부제 자전거 이용환경 구축 등 개 프로그램 참여 가능프로그램별로 감면 혜택 제공



강남구구청장 조성명가 교통혼잡 완화와 저탄소 녹색교통 생활화를 위해 올해 지역 내 들을 대상으로 교통수요관리 제도를 적극적으로 추진할 계획이다대도시 교통 혼잡을 완화하기 위해 연면적  이상 시설물 소유자에게는 교통유발부담금이 부과된다 체 교통수요관리 제도는 이들이 자발적으로 교통량 감축 프로그램에 참여하면 참여 정도와 이행 결과에 따라 교통유발부담금을 프로그램별 최대 까지 감면해준다 지난해 개 시설에서 억만원의 경감 혜택을 받았다올해 개소가 참여하는 가운데 구는 더 많은 체가 이 제도를 활용할 수  적극적인 홍보에 나선다 경감 혜택을 담은 안내 책자를 체에 보내 맞춤형 홍보를 강화  홍보 거리 캠페인 등 다각적인 홍보를 벌여 참여율을 끌어올리겠다는 계획이다교통량 감축 프로그램에는 승용차 부제 주차장 유료화 주차장 축소 주차정보제공시스템 자전거 이용환경 구축 미세먼지 저감 주차수요관리 통근버스 운영 셔틀버스 운영 업무택시제 유연근무제 운용 부설주차장 야간개방 등 총 개의 프로그램이  참가를 원하는 은 교통유발부담금 경감관리시스템에서 프로그램별 경감률 운영 방법 등에 관한 자세한 사항을 확인하고 신청하면 된다조성명 강남구청장은 체들이 교통수요관리 제도를 활용해 교통유발부담금 경감 혜택을 받고 교통량 감축을 통한 탄소중립 실천에도 동참하길 바란다며 앞으로 교통체증대기오염과 같은 도심 문제를 해결하는 저탄소 친환경 교통정책을 확대 추진하겠다고 밝혔다'
윤석열 년 심판은 시대정신 조국혁신당이 기폭제 역할|'인터뷰 서왕진 조국혁신당 정책위의장 힘있는 당이 목표 검찰기재부 개혁 추진 



  서왕진 조국혁신당 정책위의장은 일 오마이뉴스와 인터뷰에서 윤석열 정부 년에 대해 너무 무능하고 퇴행적이라며 경제 외교 평화 모든 문제에서 그냥 못하는 정도가 아니라 심각한 위기를 만들고 고 평가했다  권우성그야말로 파죽지세다 일 한국갤럽이 공개한 월 주차 조사 결과에 따르면 비례대표 투표에서 조국혁신당을 뽑겠다고 응답한 이들은 전체 로 더불어민주연합과 격차에 불과했다 두 정당을 합하면 국민의미래를 충분히 앞설 뿐 아니라 이번 총선의 성격을 정권심판론으로 규정한 민심에도 가까워지고  창당한지 주 정도에 불과한 신생정당임에도 무시할 수 없는 존재감이다 게다가 이날 조국혁신당은 일 선관위 등록 후 일 만에 당원 숫자가 만 명을 돌파했다고 알렸다 조국혁신당의 상승세는 당 대표 조국이 이끌고  그런데 조 대표는 자녀 입시비리와 유재수 전 부산광역시 부시장 감찰 무마 혐의 등으로 재판 중인 피고인 조국이기도 하다 대법원의 최종 판단이 남아있긴 하지만 항소심까지 유죄 판결이 나온 터라 마냥 낙관하기도 어렵다 사람들이 조국이라는 구심점이 사라진다면 조국혁신당이 존속가능할까 조국혁신당은 유의미한 정치세력이 될 수 라고 묻는 이유다조국혁신당은 무엇보다 검찰개혁을 선명하게 추구하는 정당이다 당 강령은 우리는 모두가 함께 번영하는 대한민국의 미래를 위해 검찰독재를 종식하고로 시작한다 박은정이규원 전 검사 차규근 전 법무부 출입국외국인정책본부장 등 윤석열 검찰과 대립했던 인물들도 줄줄이 입당했다 그러나 수권을 꿈꾸려면 어떤 나라를 그리는지 말할 수  한다 조국혁신당은 이 질문들에 어떤 답을 내놓을까 일 서울시 종로구 오마이뉴스 사무실에서 서왕진 정책위의장을 만나 그 궁금증을 풀어봤다 그는 환경운동 경험을 토대로 미국 델라웨어대학교에서 환경에너지정책학을 공부하고 서울시장 정책특보와 비서실장 서울시 산하 서울연구원 원장 등을 지낸 정책전문가다 서 의장은 조국혁신당 영입인재 호이며 이날 조국혁신당이 발표한   총선 비례대표 출마 후보자 명남녀 각각 명에 이름을 올렸다 이건 새로운 흐름 조국혁신당은 물꼬 튼 것 



  서왕진 조국혁신당 정책위의장은 일 광주에서 시민들의 열정과 마음을 확인했다 새로운 흐름이 형성되고 고 의미를 부여했다  권우성  조국혁신당의 지지세가 최근 가파른 속도로 상승하고  하지만 조국 대표의 대법원 판결이 아직 남아있기 때문에 지속가능하겠냐는 의구심이  조 대표 스스로 기폭제가 되고 국민들이 그의 결단을 수용한 데서 조국혁신당의 가장 근본적인 힘이 나온다고 생각한다 이 또한 시간이 지날수록 진화할 거다 어제일 광주에 가서 우리 예상을 훨씬 뛰어넘는 시민들의 열정과 마음을 확인했다 반짝 관심사가 아니라 새로운 흐름이 형성되고  조국 개인의 팬덤이 아니라는 말인가물론 조 대표에 대한 안타까움 격려 같은 마음이 한 축에  그보다 더 큰 흐름이 밑바닥에  조 대표가 출범시켰지만 당에 참여하는 만 당원과 여러 동지들이 당의 실체로서 새로운 주인 역할을 할 거다 조 대표도 그 부분은 걱정하지 않고   당 강령 첫머리에서 검찰독재 종식 검찰개혁 행동을 말하고  하지만 젊은 세대들에게 검찰독재가 와닿을지 의문이다 한국갤럽 발표에서도 전체 비례투표의향은 였지만 대는  대는 로 대 이상과 큰 차이가 났다의 관심과 지지가 약하다는 것은 너무 잘 알고  우리의 어려움 중 하나다 다만 본격적으로 총선 과정에 관심을 갖는다면 그들도 판단할 거다 그때 어떻게 우리의 노선과 대안을 소구력  잘 제시할까가 관건이다 조국혁신당이 말하는 검찰독재에서 독재는 좁은 의미로만 국한시킬 수  이야기가 아니다 검찰이 나라를 장악하고 민주주의의 기본 질서를 허물어뜨리는 것도 문제지만 국정을 운영할 역량을 갖추지 못한 집단이 과도하게 권력을 쥐고 국정을 운영하면서 모든 영역에서 무능과 퇴행이 지속되고  당의 제 슬로건이 년은 너무 길다인데 저는 년만 이대로 둬도 나라가 회복하기 힘든 위기로 들어갈 것이라고 생각한다 그러면 누가 제일 힘들까 국민 그 중에서도 젊은 사람들은 진짜 미래를 잃어버리게 된다 세대야 쌓아둔 역량과 경제적 능력으로 살아갈 수  검찰독재와 싸우는 것과 동시에 검찰독재 이후의 대안과 비전을 만드는 것도 중요하다 저희의 사명이라고 생각한다  하지만 박은정 전 검사 등 영입인재들을 봐도 검찰개혁이 중심이고 한편으론 소위 친문재인계 인사가 다수다 확장성을 갖기 힘들다는 평가가 나온다 박은정 검사 말에 따르면 진짜 친문검사는 윤석열 대통령 아닌가 문재인 정부에서 벼락출세를 했으니까웃음 또 영입 호 신장식 호 이혜민 호 서왕진 다 친문이 아니다 신장식 수석대변인은 정의당과 민주노동당에서 활동했고 이혜민씨는 조 대표와 일면식도 없던 과학기술계 전문가다 저도 서울시 활동을 주로 했고 영입   호가 친문이 아닌데 어떻게 당이 친문인가 더 본질적으로 광주에서 느꼈던 시민들의 마음은 친문이냐 친명이재명이냐 이런 차원이 아니었다 그들이 가슴 속 깊이 품은 분노와 열망의 핵심은 윤석열 정부를 더 이상 참을 수 없다는 거였다 그 마음을 표출할 기회의 물꼬를 조국혁신당이 트면서 쏟아져 나오고  일종의 시대정신이라는 뜻인가그렇다 솔직히 시민들의 마음이 그 정도일 줄 몰랐다 지금은 특정 인물이나 공천 과정이 주로 얘기되지만 이번 총선은 윤석열 정부 년 동안 더 이상 참을 수 없는 지경에 이른 것이 마침내 사회적으로 표출되는 출발점이 될 거다윤 정부 모든 분야서 심각한 위기 초래 현대판 매국노 



  서왕진 조국혁신당 정책위의장 권우성  윤석열 정부 년을 총평한다면너무 무능하고 퇴행적이다 경제 외교 평화 모든 문제에서 그냥 못하는 정도가 아니라 심각한 위기를 만들고  특히 경제 퍼주기를 하고  미국 인플레이션 감축법은 탄소중립을 규제하면서도 어마어마한 인센티브를 준다 한국 들은 국내에선 재생에너지 공급이 안 돼 규제를 감축할 방법이 없다 하지만 미국에 가면 재생에너지를 쉽게 얻을 수  뿐만 아니라 인센티브까지 받으니 안 나갈 이유가 없다 영국 파이낸셜 타임즈가 지난해 월  시행 년 후 외국의 미국 투자억 달러 이상 계획을 분석한 결과를 보도했는데 한국이 건으로 제일 많았다 이러다 우리나라 산업은 공동화하고 경제가 무너진다 현대판 매국노다 또 윤석열 정부 대표적인 정책 기조가 부자감세 민생감액이다 법인세 종부세 증여세 등을 대폭 깎아서 무려 조 원에 가까운 세수 감소를 만들어냈다 그 결과가 민생예산 감액이다 공공주택 예산 수조 원뿐만 아니라 노인빈곤 문제로 노인 자살률이 어마어마한데 그나마 좋은 정책인 어르신 일자리사업도 큰 규모로 줄였다 나라의 미래를 좌우할 수  예산도 깎았다 도대체 왜 그런 선택을 하는지 이해하기 힘들다 당 강령은 기획재정부 개혁도 강조하고  그런데 윤석열 정부 인사를 두고 검찰 아니면 기재부란 평가가 나온다 심지어 보건복지부 장관 저출산고령사회위원회 부위원장 교육부 차관보까지 기재부 출신이다무능 행정과 무책임 행정을 부추기는 인사다 전문성과 경험이 없는 검찰 출신들을 요직에 배치한 게 국정운영의 무능을 상징한다면 각 부처에 기재부 출신을 배치하는 것은 무책임을 의미한다 꼭 이 정부만의 문제는 아니지만 기재부가 너무 비대화 권력화되면서 민감하고 중요한 정책을 사실상 좌지우지하고  그 결과 책임소재가 불분명한 문제가 발생했다  가령 부동산 정책은 국토교통부가 주체 같지만 핵심은 세제 정책일 뿐 아니라 최종 의사결정 단위가 기재부다 하지만 문제가 생기면 맨날 국토부 장관이 나와서 사과하지 않나 기재부 관료들에 집중된 권한은 책임의 공백을 낳는다 예산처와 재무부를 분할해 선출된 권력들이 예산처를 통제하고 운영하면서 그 결과를 국민들에게 심판받는 것이 민주공화국의 원리를 제대로 구현하는 것이라고 생각한다 미국은 백악관에 예산편성권이  최종 의사결정은 의회가 한다 기후정책연구자이자 시민운동가 출신이다 윤 대통령은 재생에너지  사용보다 무탄소  원자력발전 포함을 강조하며 원전이 곧 민생이라는 말까지 했다 조국혁신당은 재생에너지와 원전 문제와 관련해 기본 입장이 무엇인가 같은 접근은 무능한 정부의 전형이자 우물 안 개구리 정책이다 은 이미 글로벌 스탠더드다 윤 대통령이 몇 개의 산유국하고  꼭 해야 돼 원전으로 대체하면 되지 이런다고 해서 그 기준을 바꿀 수 없다 들은 다 알고  눈치보느라 이야기 못하고 대신 해외로 나갈 뿐이다 기본적으로 탄소중립 실현은 장기적인 과정이고 과제다 전세계 목표가 년이다 갑자기 모든 게 다 바뀌는 게 아니라 단계적으로 바뀌는데 특히 화석연료를 전기로 바꿔야 한다 또 온실가스를 배출하지 않는 전기를 써야 한다 두 가지다 재생에너지와 원자력 그런데 우리는 원자력 에너지는 충분한데 재생에너지 발전 비중이 너무 낮다 하지만 윤석열 정부는 막 올라오기 시작한 재생에너지 생태계를 무너뜨렸다 위기는 이미 시작됐다 탈원전은 아니라는 뜻인가 감원전이라고 표현하겠다 지금  원전은 안정적으로 잘 관리해서 써야 한다 특히 수명이 다한 원전을 어떻게 처리하고 관리할 것인가는 한국뿐 아니라 전 세계의 숙제다 하지만 원전을 더 많이 짓겠다는 방향은 실현가능하지도 않고 기후변화 대응 추세에도 안 맞고 재생에너지 비중이 계속 늘어나는 전력이용체계와도 충돌한다 저출생과 지방소멸 문제를 두고는 어떤 고민을 하고  선택과 집중이 필요한 분야 순위가 육아친화사회를 어떻게 만들 것인가다 아이를 낳기만 하면 국가가 책임진다는 것을 체감할 수  한다 그와 연동해 주거 교육 문제 등 여러 핵심분야에서 집중적인 정책 집행과 성과관리를 해야 한다 저출생에 지금까지 조 원을 썼다는데 문제가 더 심각해지지 않았나지방소멸과 관련해선 김경수 전 경남도지사의 메가시티정책을 부활시켜야 한다 수도권과 경쟁할 수  메가시티를 부울경 외에도 광주전남권 대구경북권 중부권에도 만들어야 한다 또 예산 자체를 실질화해야 한다 강령에 성평등은 안 보인다선관위에 제출한 대 정책 안에는 담대한 저출생 대책과 성평등돌봄정책 추진 강령이든 정책이든 새롭게 정리하고 확정하는 과정 중이라 불가피하게 비어있는 부분도  저희 숙제다양당체제 틈 만들 것 힘있는 당 역할하겠다 



  서왕진 조국혁신당 정책위의장 권우성  조국혁신당은 힘있는 제당을 목표로 삼고  그런 당이  정말 국회가 달라질까저는 정책전문가다 지난 년 동안 전문가 명이 참여하는 대전환포럼에서 활동해왔는데 년 대선 전까지 과거 정부의 성공과 실패를 잘 분석해서 다음 정부에선 정말 제대로 된 정책을 기획실행할 준비를 하자는 목표를 세우고  그런데 과거 실패의 핵심이 정치영역에서의 진영갈등이더라 아무리 좋은 정책 논쟁의 여지가 없는 정책이어도 거대 양당이 서로 발목잡는 일이 너무 많았다그 극복방안으로는 국민 인식이나 정치문화의 변화도  그냥 바란다고 될 일이 아니다 힘있는 제당 제당이 만들어져서 국회의 양당 독점 구조에 균열을 만들어야 한다 더 진보적이거나 중도적인  당이 당이 싸울 때 조정하거나 중재하는 역할을 해야 한다 독일이 그렇다 양당 적대적 공생체제에 틈을 만들어내겠다 그런데 힘이 없으면 안 된다 몇 석이나 확보해야 힘이 생길까 석을 얘기하고  쉽지 않은 숫자다 목표를 달성하더라도 교섭단체석가 안 된다는 한계가  이후 교섭단체 요건을 완화하고 대통령 결선투표제도를 도입해야 한다 민주당과 합당은 전혀 생각하지 않고  우리가 힘있는 당 역할을 하는 게 윤석열 정부 조기 종식과 전체 진영에 더 효과적이고 제대로 일하는 국가가 되는 데에도 굉장히 의미있는 기여를 할 수 덧붙이는 글  이 기사에 인용한 여론조사 개요는 다음과 같다 자세한 내용은 한국갤럽 또는 중앙선거여론조사심의위원회 홈페이지에서 확인할 수   조사기간  년 월 일 조사방법  전국 만 세 이상 명 대상 무선  전화면접 오차범위  신뢰수준 '
글로벌 식품 허브한국식품산업클러스터진흥원 로그인|'푸드 미래 책임지는 진흥원익산에 여의도 규모 클러스터동북아 최초 세계 시장서 활약세종데일리안 맹찬호  최근 세계는 급변하는 물결 속에 다양한 생존법을 제시하고  기후변화 등 자연재해에 대응하기 위한 탄소 중립 디지털 첨단 기술을 접목한 차 산업혁명 등 저마다 시장 선점을 위해 발 빠르게 움직이고  우리나라 공공기관 역시 이러한 변화에 적응하기 위한 중장기 계획을 수립 중입니다데일리안이 기획한 로그인은 공공기관의 신사업을 조명하고 이를 통한 한국경제 선순환을 끌어내고자 마련했습니다 네트워크에 접속하기 위해 거치는 로그인처럼 공공기관이 다시 한국경제에서 활약하는 모습을 조명할 수  기대합니다 편집자 주식품 미래를 여는 핵심 기관



한국식품클러스터진흥원 데일리안 기술의 발달과 혁신에 힘입어 식품 분야도 많은 발전과 생산력을 보유하게 됐다 쌀을 비롯한 식품산업에서도 식량 문제와 영양적 측면에서 단계적 성장을 이뤄내는 등 먹거리 산업은 시대를 막론하고 중요한 과제다 최근에는 급속한 기후변화 위기에 대응하기 위해 탄소중립 목표가 구체화 되는 등 대변화 시대에 농업 농촌도 스마트탄소중립 기술개발 등이 관건이 되고 식품산업통계정보에 따르면 세계식품시장은 년 조억 달러 규모로 성장할 것으로 보인다 특히 우리나라는 억 인구를 가진 동북아 시장 중심에 위치해 선제적으로 대응할 수  지리적 강점이  비행거리 시간 내에 인구 만 도시가 여개 존재하는 것도 강점으로 꼽힌다한국식품산업클러스터진흥원은 농식품 분야 기술 혁신과 해외 수출시장 개척을 위해 지난 년 전라북도 익산시에 설립됐다 클러스터는 관련 과 기관이 한곳에 모여 시너지 효과를 도모하는 집적단지를 뜻한다식품클러스터 사업을 총괄하는 곳이 식품진흥원으로 식품산업진흥법에 근거해 출범한 공공기관이다 지난 년 한미 자유무역협정 체결에 따른 보완대책 일환으로 전북이 사업대상지로 선정됐고 익산시가 사업지로 뽑혔다동북아 최초 식품클러스터



한국식품클러스터진흥원 배치도 데일리안 동북아 최초로 조성된 식품클러스터는 산업단지 내 약 만 부지를 보유하고  사업단지는 준공 년 만에 식품벤처 창업부터 중견까지 개사와 분양 계약을 체결해 분양률 년 월 기준를 보인다 이 원하면 즉시 착공할 수  상하수도와 가스 등 인프라를 가줘 이 추세라면 년 내 분양을 완료할 것으로 관측된다식품산업 발전을 위해 지원도 확대하고  창업 연구소와 식품벤처센터를 운영하는 등 창업에서부터 벤처 분양까지 식품산업의 선순환체계도 마련해 성과를 창출하고 식품진흥원은 클러스터 활성화를 위해 식품의 제품 개발개선 등에 필요한 연구와 생산시설 장비를  지원시설에 갖추고  구축된 여러 시설장비를 기반으로 년부터 식품안전관리인증기준 우수건강관리식품제조기준 한국인정기구 등 국내외 공인인증을 취득하고 국가클러스터 입주 중 대은 하림이  중견은 풀무원 삼보판지 리테일 순수본 등이 들어와  해외은 코아바이오가 유일하다수출매출고용 박자 갖췄다식품클러스터 입주 주요 업종은 식육 가공품 포장육이 가장 많고 건강기능식품 가정대체식 등이다 입주  곳당 연평균 매출액은 억원으로 국내 식품산업 평균인 억원보다 배 이상 많고 년 평균 매출 증가율 역시 로 국내 식품산업 평균보다 배가량 높다입주 수출실적도 매년 올랐다 식품진흥원에 따르면 년 기준 개 입주 수출실적은 총 억원으로 당 평균 억만원에 달했다 수출 규모도 늘었다 지난 년간년 개사억원에서 개사억원로 확대했다실적도 오르며 고용도 상승했다 클러스터 준공 개사 평균 고용인원은 명으로 당 연평균 고용인원년은  늘었다지역과도 상생 협력을 이어갔다 지역 로컬푸드를 활용한  생산 연계로 식품클러스트에 활기를 불어넣었다 신제품개발이나 제품생산을 협업해 입주깁업인 프롬네이처와 강된장과 두부전골을 개발했고 모아푸드와 간장 및 고추장닭구이를 만들어 내놨다식품진흥원도 소스 시장 성장세에 힘입어 지원사업에 뛰어들었다 지난해 불닭고추장불고기소스 등 소스류 수출액이 억원을 넘어서며 역대 최대 실적을 달성했다 관세청이 발표한 지난해 수출입 현황에 따르면 작년 양념소스전통장류 등의 수출액은 억만 달러약 억원로 년 전보다  증가했다이는 연간 기준 역대 가장 많은 금액이다 수출 물량도 만으로 년만에 이어 두 번째로 높았다 년 전인 년만과 비교하면 약 배 늘어났다 식품진흥원은 글루텐프리 비건 볶음고추장을 개발해 시제품을 생산하는 등 소스류 활성화에 나섰다해당 고추장은 아마존 브랜드관에 입점 예정이며 마켓컬리와 쿠팡 등 국내 판매 판로도 개척했다 이 밖에도 장류 비건 제품 개발과 상품화를 통한 식품산업 환경사회지배구조 활동을 실천했다민관 비즈니스 창출혁신 플랫폼 구축



