title|content
한국농수산식품유통공사동신대 농수산식품산업 발전 협력|김춘진  사장오른쪽과 이주희 동신대학교 총장이 협약 체결 후 기념촬영을 하고   한국농수산식품유통공사한국농수산식품유통공사와 동신대학교는 지역 경제 발전 및 저탄소 식생활 확산 등 농수산식품산업 발전을 위한 업무협약을 체결했다고 일 밝혔다양 기관은 지난 일 전남 나주 동신대에서 협약식을 갖고 저탄소 식생활 캠페인 동참으로 먹거리 분야 탄소중립 등  실천 확산 농수산식품 미래 인재 양성과 청년 취창업 역량 강화 지역 경제 발전 협력 농수산식품산업 발전을 위한 인력기술정보 교류 안전한 공공 급식으로 학생건강 제고와 제반 산업 활성화 등에 적극 협력하기로 했다이번 협약으로 농수산식품산업 발전과 글로벌 탄소중립 지역사회 인재 양성에도 상승효과를 낼 것으로 기대된다김춘진  사장은 양 기관이 지역 경제 발전과 지역 인재 양성에 뜻을 모아 기쁘다며 동신대가 강조하는 실천의 가치를 덕목 삼아 저탄소 식생활 전파에도 동참해 주시기를 바란다고 말했다가 추진하는 저탄소 식생활 실천 운동은 먹거리의 생산유통가공소비 전 과정에서 발생하는 온실가스 배출을 줄이는 생활 실천 캠페인이다는 지난 년부터 전국 개 행정교육 광역자치단체를 비롯한 협회단체해외업체 등 국내외 개국 여 기관과 협약을 맺고 저탄소 식생활 세계화에 앞장서고 발로 뛰는 더팩트는 시간 여러분의 제보를 기다립니다카카오톡 더팩트제보 검색이메일 뉴스 홈페이지 
의성군 탄소중립포인트 참여자 명 선착순 모집|'주행거리 감축 실적 따라 연 회 최대 만원 지급경북 의성군은 군민들을 대상으로 탄소중립포인트자동차 참여자 명을 선착순으로 모집한다 일 의성군에 따르면 탄소중립포인트는 과거 누적 일평균 주행거리에 따른 기준 주행거리와 참여기간의 주행거리를 비교해 감축 실적에 따라 연 회 최대 만원을 지급한다 대상 차량은 의성군에 등록된 인승 이하 비사업용 승용자동차 승합자동차로 친환경자동차전기하이브리드수소 등는 제외된다  다음 달 일일까지 자동차 탄소중립포인트 누리집 회원가입 후 한국환경공단에서 휴대폰으로 발송하는 문자를 통해 자동차 전면사진 주행거리 계기판 사진 등을 증빙자료로 제출하면 된다  김주수 의성군수는 쾌적한 대기환경 조성을 위한 생활 속 탄소중립을 실천하고 온실가스 감축실적에 따른 인센티브도 제공받을 수  적극적으로 참여해주길 바란다고 당부했다 



경북 의성군은 군민들을 대상으로 탄소중립포인트자동차 참여자 명을 선착순으로 모집한다의성군'
순천시 전동차 민간보급사업 시행|순천시청 청사전경스포츠서울조광태 전남 순천시시장 노관규는 기후변화에 대응하고 년 탄소중립 실현을 위해 년 전동차 보급사업을 일부터 실시한다고 밝혔다올해 사업비는 억 만원으로 전동차 대승용  화물  버스  이륜차  굴착기 를 상반기와 하반기 회에 걸쳐 보급한다상반기 보급물량은 대승용  화물  버스  이륜차  굴착기 이며 전기버스와 이륜차 굴착기는 추후 보조금 확정 시 보급할 예정이다보조금은 차종별 차등 지원으로 전기승용차는 최대 만원 전기화물차는 최대 만원의 보조금을 지원한다지원 대상은 신청일 기준 개월 이상 계속 순천시에 주소를 둔 만 세 이상 개인 또는 관내 개인사업자 법인 기관 등이다신청서 제출은 대리점에서 무공해차 구매보조금 시스템을 통해 절차를 대행하며 자세한 사항은 시 홈페이지의 고시공고에서 확인할 수 시 관계자는 지금까지 총 대의 전동차를 보급했으며 기후변화 위기에 대응하기 위해 매년 친환경 자동차 보급을 지속적으로 확대해 나갈 계획이다고 말했다
전선 미래 성장동력 확보 제회 기술공모|전선은 미래 성장동력 확보를 위한 제회 기술공모를 진행한다고 일 밝혔다 기술공모 는 국내 유수의 대학 연구기관과 협력 관계를 구축해 핵심 사업에 바로 적용할 수  원천기술을 단기간에 확보하는 방법이다 전선은 공모를 통해 탄소중립 이행을 위한 케이블 소재 재활용 기술을 비롯 제품 개발과 생산 과정에 접목할 디지털전환 기술 등을 개발할 계획이다 전선 관계자는 글로벌   으로서 를 통해 미래 시장을 선점할 원천기술을 확보하는 것이 목표이다며 탄소중립 디지털전환 등 산업환경 변화에 한발 앞서 대응함으로써 신성장동력을 창출해 나가겠다고 전했다 주요 공모 분야는 가공 송전선용 알루미늄 리사이클링 빅데이터 및 를 활용한 고장진단 가상제품개발 차세대 스마트그리드 성능평가 등이다 해저케이블 사업을 고도화하기 위한 기술도 발굴한다 차세대 제품인 부유식 해상풍력용 다이내믹 케이블 성능진단 케이블 해양 매설 자동화 등이다  전선이 관계사들과 신사업으로 추진 중인 희토류 영구자석 밸류체인 사업을 뒷받침하기 위한 고성능 네오디뮴 영구자석 제조 기술도 확보한다 접수 기간은 월 일까지다 전선 홈페이지를 통해 지원하면 된다원성열 스포츠동아  
시흥시  시화호 년 시화호 세계화 본격 추진|'생태환경 복원의 성공 모델환경교육 해양레저 생태관광 초석 마련브랜딩 학술포럼 축제 공모 유치 등 여 개 기념사업 연중 진행데일리안  김명승   



시흥시가  시화호의 해를 맞아 기념사업을 본격적으로 추진한다 시흥시 제공경기 시흥시가  시화호의 해를 맞아 시화호 가치 제고를 위한 기념사업을 본격적으로 추진한다시흥시 이덕환 환경국장은 일 언론브리핑에서 시화호는 대한민국 산업화의 역사적 산물이자 국내 생태환경 복원의 성공적인 모델이라며 시화호의 생태환경역사적 자산을 기반으로 지역의 새로운 성장동력을 창출하고 탄소중립과 친환경 패러다임을 선도하겠다고 밝혔다시화호는 년 월 시화방조제 완공으로 조성된 이후 극심한 수질오염을 겪었지만 정부의 해수 유통 결정과 시민 환경운동가 등의 꾸준한 자정 노력 덕분에 현재는 생태계를 완전히 회복한 상태다멸종위기종 서식 등 환경적 가치와 더불어 시화호 주변으로 여 인구가 거주 중이고 오이도박물관 시흥 거북섬 안산 반달섬 화성 송산그린시티 세계 최대 시화조력발전소 등 풍부한 지역 자산이 분포해  대표적인 환경 자산으로 주목받고 올해는 시화호가 조성된 지 주년이 되는 해로 시흥시는 안산시 화성시 한국수자원공사와 함께 시화호 세계화를 위해 힘을 모은다는 방침이다 그 첫걸음으로 지난 일 시화호의 해를 선포했고 주년 기념사업을 통해 시화호 가치 확산과 지역의 성장 동력을 확보해 나갈 계획이다기념사업은 시화호 브랜딩 학술포럼 기록화교육 해양레저 시민참여 개 분야로 구성되며 환경교육 해양레저 생태문화관광을 활성화하는 등 지역과 상생하는 방향으로 추진한다 연중 펼쳐지는 다양한 사업을 통해 해양신산업 및 고부가 마이스  산업 육성을 견인할 것으로 기대된다



일 화성시 송산글로벌교육연구센터에서 열린 시화호 주년 선포식에 참석한 박세훈 한국수자원공사 도시본부장 이민근 안산시장 손임성 화성 부시장 임병택 시흥시장왼쪽부터시흥시 제공시화호의 역사적 교훈으로부터 미래를 모색하는 심포지엄 환경 콘퍼런스를 비롯해 기후 변화에 대응하는 정책 교류를 활발히 추진하고 시화호 역사 자료 아카이빙 환경 교육 콘텐츠 개발로 미래세대를 위한 자원 전수와 교육에 주력한다또 시화나래길 걷기 환경 캠프 시화호 연구모임 기후테크 경진대회 시화호 페스티벌 등 시민이 참여하고 즐길 수  다양한 행사를 통해 공동체를 강화하고 지역 경제를 활성화할 계획이다시화호 선상 관광과 요트 서핑 등 해양레저 프로그램 마라톤 철인 종 대회 등 시화호 생태를 직접적으로 체험하고 즐길 수  다채로운 행사도 연계해 추진한다특히 시흥시는 관내 자원을 활용한 새로운 가치 창출에 주력하고  시화호 거북섬에 조성 중인 마리나 시설 클럽하우스 경관브릿지 등의 해양레저관광 인프라를 시화호 랜드마크로 육성하고 의료바이오 기반을 활용한 해양치유단지 조성 등 신사업 발굴을 고민 중이다더불어 문화체육관광부 추천웰니스관광지 선정 해양수산부 국가해양생태공원 지정 유네스코 환경 자산 연계 등 각종 공모사업을 유치함으로써 시화호 가치 증진 사업을 확장해 나간다는 방침이다이덕환 환경국장은 시화호의 가치를 높이는 일은 환경을 생각하고 지역의 성장을 도모하며 시민의 삶의 질을 높이는 일이라고 강조했다 이어 시화호가 세계적인 시화호로 도약할 수  끝까지 최선을 다하겠다라고 밝혔다'
산림청 대구 수성구 등 목재친화도시 개소 조성|'콘크리트플라스틱 시설물 등도심 건축주거문화에 목재 적용친환경지역경제 활성화 도모산림청이 전국 개소에 목재친화도시를 조성한다 산림청은 년까지 대구 수성구동구 대전 서구유성구 충북 제천청주 강원 춘천 전북 무주 전남 강진 경북 봉화에 목재친화도시를 조성한다고 일 밝혔다



목재친화도시 조성 사업지 조감도 산림청 제공콘크리트플라스틱 중심의 도시환경을 국산 목재로 대체하는 것이 목재친화도시 조성의 주요 포인트다 건축주거문화 등 도시환경 전체를 재편하는 신재생 도시 유형이라는 점에서 일부 건축물과 시설물을 목재로 조성하는 부분 목조화 사업과는 구별된다주요 사업은 가로경관 개선 목재문화 증진 주거환경 개선 지역경제 활성화 등이다가로경관 개선은 벤치가로등방음벽버스정류장가드레일어린이 놀이시설 등을 구성한 소재를 지역에서 생산한 목재로 바꿔 목재특화거리를 마련하고 도시 숲과 정원 내 목재경관을 조성하는 것으로 추진한다목재문화 증진은 공공형 시민목공체험센터 등 목재교육 기반시설 조성과 생애주기별 목재교육문화 프로그램 개발 및 보급을 주거환경 개선은 지역 목재를 활용한 목조건축물 조성과 목재 기반 생활 사회간접자본을 조성하는 것으로 진행한다지역경제 활성화는 목재친화도시 조성을 위한 지역 목재 이용제품 생산기반을 강화하는 데 사업 방향이 맞춰졌다



도심 건축물 벽면을 콘크리트에서 목재로 대체하기 전왼쪽과 후오른쪽 산림청 제공산림청은 목재친환경도시 사업을 통해 국산 목재 활용도를 늘려간다는 복안이다 또 목재를 테마로 한 교육시설 체험시설 목재특화거리 등을 조성해 생활 속에서 목재가 친숙한 소재로 다가설 수  한다궁극적으로 산림청은 목재친환경도시 사업이 국산 목재 수요를 안정적으로 확보하고 목재산업 활성화를 통한 지역 경제 활성화로 이어질 수  할 계획이다목재친화도시 조성사업은 국비지방비를 매칭해 시행된다 올해는 시공을 본격적으로 시작할 예정이다 산림청은 사업이 원활하게 추진될 수  목재친화도시 조성 자문단을 운영하면서 국산 목재 이용 방안과 대상지 콘셉트 설계 및 조성 등 조언도 지원한다남성현 산림청장은 목재친화도시는 앞으로 탄소중립을 위한 지속가능한 도시 모델로 자리매김하게 될 것이라며 산림청은 목재친화도시 사업을 통해 국민에게 목재 이용탄소중립이라는 인식을 심고 목재 이용 활성화로 생활 속 탄소중립을 실천할 수  하겠다고 말했다'
전북교육청 디지털 환경교육 자료 우리 함께 초록 더하기 제작|'사진영상 등 다양한 형태 자료 담아



전주뉴시스윤난슬   전북교육청은 우리 지역을 중심으로 재구성한 환경교육 자료인 우리 함께 초록 더하기를 개발 각급 학교에 제공한다고 일 밝혔다사진전북교육청 제공전주뉴시스 윤난슬   전북특별자치도교육청이 기후환경 변화에 맞춰 체계적인 탄소중립 환경교육 수업 지원에 앞장선다 전북교육청은 우리 지역을 중심으로 재구성한 환경교육 자료인 우리 함께 초록 더하기를 개발 각급 학교에 제공한다고 일 밝혔다 전북 교사들이 직접 참여해 개발한 이 자료는 온라인 학습 및 간접 체험의 기회를 제공해 자기 주도적 학습활동이 쉽도록 제작했다 웹 기반 디지털 교수학습 자료 형태로 개발해 기존 서책형 자료의 한계를 보완하고 더욱 풍부한 사진영상 등의 콘텐츠를 포함해 학교의 디지털 기반 교육 환경에서 다양하게 활용할 수  구성한 것이다단원 구성은 문제와 개념을 인식하고 생각을 넓히는 알아보기와 놀아보기 우리 지역의 자원과 연계한 체험하기 관련 진로 탐색을 위한 진로탐험으로 이뤄져 학생들이 흥미를 느끼며 학습할 수  했다구체적으로는 제장 우리 손으로 쓰레기 문제를 해결할 수  제장 어떻게 기후 위기를 극복할 수  제장 환경을 지키는 착한 에너지가 존재할까 제장 동식물이 함께 잘 살아가려면 어떻게 해야 할까 등을 주제로 하고 정성환 민주시민교육과장은 환경교육 지원 자료에 담은 다양한 형태의 자료들은 학교학생의 상황을 고려해 교육과정 재구성 및 다양한 체험활동에 활용할 수  했다면서 탄소중립 실천 환경교육이 활성화될 수  기반을 마련해 미래세대인 학생들의 환경 감수성을 높일 수  노력하겠다고 말했다'
슈퍼선거의 해 경제 불확실성 커져과감한 변화 필요|'중소벤처연구원 심포지엄 개최  글로벌 환경 변화와 중소



서울뉴시스 중소벤처연구원 년 글로벌 환경 변화와 중소 심포지엄 개최 사진중소벤처연구원 제공   재판매 및  금지서울뉴시스이수정   전세계 인구의 절반 이상인 약 억명이 투표하게 되는 슈퍼 선거의 해를 맞아 국제 경제의 불확실성이 확대될 수  지적이 나왔다 업계는 이에 맞춰 국내 들의 해외시장 진출을 돕기 위한 지원이 이뤄져야 한다고 강조했다 중소벤처연구원중기연 원장은 일 페어몬트 앰배서더 호텔에서 이같은 내용의 심포지엄을 개최했다 이날 심포지엄은  글로벌 환경 변화와 중소을 주제로 열렸다 주제발표를 맡은 이형석 현대경제연구원 연구위원은 지난해 글로벌 금융시장을 고강도 통화긴축 사이클에도 불구하고 우려에 비해 선방했다고 평가했다 그러면서 올해 글로벌 트렌드로 우로 정렬하는 세계 군비경쟁의 재림 중간에 닻 내린 물가 도시 파멸의 고리 그린래시의 역습 등으로 꼽았다이 연구위원은 올해는 역사상 가장 많은 선거와 투표가 일어나는 슈퍼 선거의 해라며 선거 결과에 따라 정치 환경 국가 간의 관계성이 변할 수  때문에 불확실성이 확대될 우려가  물가 상승에 대한 우려가 고 평가했다 그러면서 금융시장이 상대적으로 선방했지만 산업용 부동산 리스크 등이 존재한다며 고금리 인상 여파로 인한 경제적 고통이 심해지자 탈탄소 정책에 역향해고자 하는 흐름들이 주요국을 중심으로 나타날 수도 고 덧붙였다 이러한 글로벌 트렌드에 근거해 수입규제 전문가 심화 컨설팅 확대 환변동 보험 지원 중소에 대한 정부  지원 강화 좀비 에 대한 질서  구조조정 무역보험 및 수출물류비 지원 확대 일관된 탄소중립 정책 견지 중소의 탄소중립 수용성 제고 노력 등의 정책과제를 제시했다발표 이후 이어진 종합토론에서는 오동윤 중기연 원장이 좌장을 맡고 양주영 산업연구원 연구위원 유철규 성공회대 교수 한창용 중기연 센터장 이형석 현대경제연구원 연구위원 등이 참여해 올해 글로벌 경제 이슈에 대해 논의했다 양주영 산업연구원 연구위원은 무역 의존도가 높은 한국 들에게는 지정학적 위기로 인한 무역 갈등 자국 산업경쟁력 강화 정책 보호무역주의 등이 해외시장 진출과 안정적 수입에 부정적 영향을 미칠 것이라며 수입규제 전문가 컨설팅이나 국가별 수입규제 현황 정보 제공 등의 지원이 필요하다고 짚었다오동윤 중기연 원장은 세계 위권의 초일류 대한민국으로 도약하려면 산업정책에서 정책으로 과감한 변화가 필요하다며 정책이 성공하기 위해서 중소의 보호와 육성이라는 낡은 패러다임에서 벗어나야 하며 이 원하는 정책을 자꾸 만들지 말고 시장에서 경쟁할 수  정책을 제시함으로써 을 시장으로 유인해야 한다고 말했다한국경제는 경기침체가 아닌 저성장이라며 시혜성 지원보다는 정책 패러다임 전환이 필요하다고도 강조했다 오 원장은 경기침체 시각에서 인풋을 가하는 방식이 완벽한 저성장으로 들어선 한국경제에 맞는 전략인가라며 경기침체에 대한 일시적 지원이 아니라 저성장 하에서 제의 삼성이 될 을 어떻게 이끌어낼 것이냐 로 중소 정책을 전환해야 한다고 말했다'
순천시 올해 전기 승용차 대 구매 보조금 대당 최대 만원 지원|'전기 화물차 대는 최대 만원 보조 



전남 순천시사진가 기후 변화에 대응하고 년 탄소중립 실현을 위해 올해 총사업비 억만원을 들여 승용차 대 화물차 대 버스 대 이륜차 대 굴착기 대 등 총 대를 상반기와 하반기 회에 걸쳐 보급한다 순천시 제공 파이낸셜뉴스 순천황태종 전남 순천시가 올해 전기 승용차 대 구매 보조금으로 대당 최대 만원을 지원한다   일 순천시에 따르면 기후 변화에 대응하고 년 탄소중립 실현을 위해 올해 총사업비 억만원을 들여 승용차 대 화물차 대 버스 대 이륜차 대 굴착기 대 등 총 대를 상반기와 하반기 회에 걸쳐 보급한다   상반기 보급 물량은 대승용  화물  버스  이륜차  굴착기 이며 전기버스와 이륜차 굴착기는 추후 보조금 확정 시 보급할 예정이다   보조금은 차종별 차등 지원으로 전기 승용차는 최대 만원 전기 화물차는 최대 만원의 보조금을 지원한다   지원 대상은 신청일 기준 개월 이상 계속 순천시에 주소를 둔 만 세 이상 개인 또는 관내 개인사업자 법인 기관 등이다   신청서 제출은 대리점에서 무공해차 구매 보조금 시스템을 통해 절차를 대행하며 자세한 사항은 시 홈페이지의 고시공고에서 확인할 수    순천시 관계자는 지금까지 총 대의 전기 자동차를 보급했으며 기후 변화 위기에 대응하기 위해 매년 친환경 자동차 보급을 지속적으로 확대해 나갈 계획이라고 말했다'
한동훈 마지막 택배는 기후 문제 모르면 어떠냐|' 기후 위기 대응 패키지 공약 발표민주당  이상 들어본 적 없어



한동훈 국민의힘 비상대책위원장은 일 마지막 총선 공약 택배로 기후 미래를 배송하며 더불어민주당의 기후 위기 대응 문제는 에 머물러  비판했다 배정한 한동훈 국민의힘 비상대책위원장은 일 마지막 총선 공약 택배로 기후 미래를 배송하며 재생에너지  사용을 알면 어떻고 모르면 어떠냐 그 문제가 모든 것을 해결해 주는 것은 아니다라고 밝혔다 지난 대선 당시 윤석열 국민의힘 후보가 을 알고 는 이재명 더불어민주당 후보의 물음에 답하지 못하자 이를 비판했던 민주당을 지적한 셈이다한 위원장은 이날 오전 서울 성동구 성수동의 한 북카페에서 열린 기후 미래 택배 현장 공약발표에 참석해 민주당은 기후 위기를 이야기할 때 너  알아 이렇게만 이야기한다 그 이상을 들어본 적 없다 그렇게 완전하게 재생에너지 만 가지고 과연 우리 사회가 단기적 중기적으로 운영이 가능한가라며 이같이 말했다한 위원장은 정치인으로 두 달 정도 해봤는데 정치하는 사람들이 기후에 대해 단기적으로 표가 되지 않는다고 생각한다며 장기적으로는 다 알겠고 북극곰이 어려운 것도 알겠지만 당장 우리가 표를 얻는 데 무슨 도움이 되겠느냐는 식의 접근이라고 설명했다이어 겉햝기식으로 건드리고 넘어가고 정작 논의가 필요한 부분에 대해서는 자신이 없기도 하고 잘못 건드렸다가는 마이너스가 되기 쉽기에 웃으면서 넘어간다는 게 지금까지의 정치 공식이자 소위 말하는 여의도 문법이었던 것 같다고 지적했다그러면서 한 위원장은 이번 국민의힘 총선 공약의 기준 중 하나인 미래세대를 위한 지속가능한 사회로의 전환을 강조하며 기후 위기 대응에 적극적으로 나서겠다고 강조했다 동시에 민주당의 기후 위기 접근은 에 머물러  정책으로서 실현 가능한 접근을 해야 한다고 비판했다한 위원장은 기후 위기는 인류의 지속가능성을 위협하는 정말 심각한 큰 문제라며 위임받은 정치권력은 당장의 먹거리를 위해서만 쓰여야 하는 게 아니라 미래를 준비하기 위한 결단을 책임지고 할 수  점을 말씀드린다고 강조했다이어 민주당은 기후 위기를 이야기할 때 너  알아 이렇게만 이야기하는데 알면 어떻고 모르면 또 어떠냐라며 모를 수도  민주당은 그게 너와 나의 차이로 접근하는데 그럴 문제가 아니다라고 비판했다한 위원장은 그 문제가 모든 걸 해결해 주는 정답으로 공인된 것도 아니다라며 오히려 저희가 생각하는 관점처럼 탄소를 중립으로 생각해야 한다는 것이 더 많은 호응을 받고  생각한다고 설명했다



한 위원장은 하고 다른 개념 온실가스 개념으로 책임  목표 이행이 필요하다고 강조했다 배정한 국민의힘은 이날 기후 위기 대응 패키지 공약을 발표하 관련 재원을 확충하고 컨트롤 타워를 강화하겠다고 밝혔다 또한 국회에 기후위기특별위원회를 상설화해 정부의 위기 대응 상황을 지속해서 점검하는 한편 정부의 기후 대응 관련 업무를 조정하고 조직 개편 추진에 힘을 싣겠다고 강조했다국민의힘은 기후 위기 대응 기금 규모를 올해 조억원에서 년까지 조원으로 높일 전망이다 이를 위해 교통환경에너지세 전입 비율을 조정해 일반회계 전입금을 확대하고 제차 배출권거래제 할당계획년상 유상할당도 늘릴 예정이다 추가 재원은 전력산업기반기금 복권기금 등을 비롯해 정부 출연 등으로 확보한다는 계획이다국민의힘은 또 기후대응 컨트롤 타워 강화 차원에서 탄소중립녹색성장위원회의 기능을 강화해 탄소중립 예산편성 과정에서 위원회의 협의 절차를 신설하고 이행점검을 꼼꼼히 챙기겠다고 밝혔다 이어 제대 국회에서는 기후위기특위를 상설화해 정부의 기후 대응 관련 업무를 조정하고 조직개편도 추진하겠다는 입장이다국민의힘은 기후 위기 대응 차원에서 무탄소 에너지를 확대하는 방향으로 의 글로벌 산업경쟁력을 확보할 예정이다 세부적으로 차세대원전인 소형모듈원자로 기술을 개발하고 수소 생태계를 구축하면서 동시에 수열 조력 등 미활용에너지 적극 활용하겠다는 방침이다 이를 위해 해상풍력 계획입지 및 인허가를 간소화하고 무탄소 에너지 관련 사업투자연구에는 세제재정금융지원으로 뒷받침할 계획이다한 위원장은 년까지 온실가스 배출량을 년 대비  줄여야 하는 상황이라며 지금 온실가스는 다행히도 줄어드는 추세이지만 그 정도가 약해서 목표에 턱 없이 부족하다고 말했다 이어 하고 다른 개념 온실가스 개념으로 책임  목표 이행이 필요하다고 덧붙였다발로 뛰는 더팩트는 시간 여러분의 제보를 기다립니다카카오톡 더팩트제보 검색이메일 뉴스 홈페이지 '
