title|content
식품산업 비즈니스 혁신 플랫폼 데일리안 식품진흥원은 과학기술정보통신부 공모사업인 공공혁신 플랫폼에 이어 농림축산식품부의 디지털 식품정보 플랫폼 사업을 확보해 식품산업분야 디지털 선도기관임을 입증했다디지털 식품정보 플랫폼은 민관협력으로 데이터와 서비스 자원 업무 등을 이달부터 개방제공해 비즈니스 생태계를 조성한다인공지능 기반 개인 맞춤형 건강 재료 추천서비스나 유기능 콩 기반 대체육 제조가공 식품 원래 중개 및 통합물류센터풀필먼트 서비스 식품 전문 컨설팅 서비스  숨고가 식품 민간 비즈니스 예시다식품에 필요로 하는 원료소재를 구매할 수  농가 및 원료소재 전문 정보를 제공추천해 거래가 이뤄질 수  연계하는 서비스도 마련한다시설장비를 개방하는 등 공유서비스도 진행한다 시 제품 제작 전문 제조 위탁생산이 필요한 과 생산 설계와 제도 대행이 가능한 기관과 식품 전문제조업체를 연계한다의뢰되는 시험분석 등도 민간수행기관으로 개방한다 식품개발 및 제조과정에서 발생하는 인증 시험분석에 관한 정보를 제공하고 전담 기관과 연계를 지원한다이 밖에도 우수 인프라에 기반한 식품실무교육과 현장실습을 운영해 매년 여명의 식품 전문인력을 양성하고  디지털 환경 식품 교육으로 그 영역을 넓혀가고 식품산업 디지털 전환글로벌 식품 허브로



김영재 한국식품산업클러스터진흥원 이사장 데일리안 김영재 한국식품산업클러스터진흥원 이사장은 지난해 식품진흥원은 그간 임직원이 함께 일군 노력을 인정받을 수 며 농식품부 기타공공기관 경영평가 년 연속 위 년 연속 고객만족도 우수등급을 달성하는 쾌거를 이뤄냈다고 밝혔다김 이사장은 올해 식품진흥원이 나아가야 할 방향으로 식품산업 인재양성 디지털 전환 선도 가지를 올해의 화두로 강조했다그러면서 목표 달성을 위해 식품진흥원의 강점인 인프라 사업을 기반으로 식품산업의 디지털 전환을 적극적으로 추진하고 고 밝혔다식품진흥원은 이달 말 식품산업 분야 공공데이터를 개방하고 식품의 비즈니스 혁신을 지원하기 위한 공공혁신플랫폼인 푸드음의 정식운영을 앞두고  향후 하반기에는 대국민을 대상으로 영양정보 지원사업 정보 등 제공하며 지원 영역을 확대할 예정이다김 이사장은 앞으로 전 산업이  영향을 받게 될 것이고 식품산업도 예외는 아닐 것이라며 정보의 집적화가 곧 힘이 되는 세상으로 빅데이터와  산업을 잘 이해하고 활용할 수  한다고 설명했다마지막으로 그는 식품산업의 메카로 성장하겠다는 기존의 목표를 넘어 국가식품클러스터가 글로벌 식품 허브로 거듭날 수  하겠다고 덧붙였다'
비즈 선택 아닌 필수 반도체 친환경 전략 가속페달|'글로벌 환경규제 강화 선제대응 박차



삼성전자 평택캠퍼스 생산라인 전경  사진삼성전자  기후위기 대응을 위한 글로벌 주요국들의 환경규제가 강화되면서 국내 반도체 업계도 친환경 전략에 공을 들이고  특히 외국 들이 넷제로 달성을 위해 고객사에까지 재생에너지  이행을 요구함에 따라 새로운 규범에 대응하기 위한 전략에 더욱 속도가 붙을 것으로 보인다 업계에 따르면 최근 네덜란드 반도체 장비업체인 은 연례 보고서를 통해 년까지 고객사를 포함해 모든 생산과 유통 과정에서 넷제로를 달성하겠다고 밝혔다 원래 년까지 였던 목표 시점을 년 앞당긴 것이다 은 반도체  초미세 공정에 필수적인 극자외선 노광 장비를 독점하고  업계의 대표적인 슈퍼을로 꼽히는 이다 이 고객사 공장에서 발생하는 온실가스까지 넷제로 범위에 포함하면서 삼성전자와 하이닉스도 이를 피할 수 없게됐다특히 은 원자력 발전을 제외한 순서 재생에너지로 넷제로를 달성한다는 목표여서 양사의 친환경 전략 이행 계획에도 영향을 미칠 것으로 보인다 외에도 애플 마이크로소프트 구글 아마존 등 주요 들도 고객사에 넷제로 달성을 요구하고 삼성전자와 하이닉스는 이미 자체적으로 계획을 친환경 전략을 추진하고  삼성전자는 년 신환경 경영전략을 발표하고 년 넷제로를 달성하겠다고 선언했다 그 일환으로 년까지 공정가스 저감 폐전자제품 수거 및 재활용 수자원 보존 오염물질 최소화 등 환경경영 과제에 총 조원 이상을 투자 디바이스경험부문부터 탄소중립을 우선 달성하고 디바이스솔루션부문을 포함한 전사는 년 넷제로를 달성한다는 목표다 모든 해외사업장에서 재생에너지 목표 달성을 추진한다 서남아시아와 베트남은 년 중남미 년 동남아아프리카는 년까지 재생에너지 목표 달성을 완료하기로 했다하이닉스도 년을 넷제로 달성 시점으로 잡았다 최근에는 제품 생산 과정에 재활용재생가능 소재를 제품 생산에 적극 활용하는 계획을 공개했다 반도체 제조 공정에서 발생하는 폐기물에서 소재를 추출회수한 뒤 재가공하는 비율을 늘리겠다는 것이다 생산품에서 재활용 소재를 사용하는 비율을 년까지  년까지  이상으로 높이겠다는 목표다 다만 두 회사의 자체적인 노력만으로는 한계가  지적이다 글로벌 이 요구하는 넷제로 기준은 소비 전력의 를 재생에너지로 조달하는 것도 포함한다 삼성전자오 하이닉스도 이미 자발적으로 에 가입한 상태이지만 정부의 재생에너지 확대 정책이 없이는 달성이 어려울 것이란 관측이다 도 최근 연례 보고서에서 신뢰할 수  재생에너지 전력이 거의 없는 한국에서 계속해서 어려움에 직면하고 고 지적했다삼성전자와 하이닉스의 지속가능경영보고서에 따르면 년 기준 재생 에너지 전환율은 삼성전자  부문은  하이닉스는  수준이다 업계 관계자는 재생에너지 보급은 정부 정책의 영향이 가량을 차지하기 때문에 의 노력만으로 절대 달성할 수 없다며 미국이  시행으로 태양광 보급에 속도를 높이는 것처럼 한국도 정부차원에서 재생에너지를 중심으로 한 에너지 정책의 대전환을 이뤄야 한다고 말했다'
인터뷰 이동욱 디스플레이 부회장 패널 산업 위기론 오히려 황금기|'기술력으로 세계 위 제패한 산업 한국에 몇개나 되겠나이제 시장은 로 오고  마이크로는 원팀 코리아로 나가야경쟁자 중국 뿌리칠 요인으로는 상위 레벨 기술 친환경 강조디스플레이가 에만 들어간다는건 편견정말 무궁무진해



일 서울 강남구 역삼동에 위치한 한국디스플레이산업협회 사옥에서 이동욱 협회 부회장이 인터뷰에 응하고  이 부회장 뒤로 투명 유기발광다이오드 패널이 보인다임채현 데일리안  임채현  를 중국에 뺏겼을 때 분위기가 심각했죠 최근 첨단 산업으로 지정되고 시장도 이제 로 점차 넘어오고  시기에요 기술력으로 세계 위를 제패한 산업이 우리나라에 과연 몇개나 될까요 이제는 디스플레이가 에만 들어간다는 고정관념을 버려야 합니다한국 디스플레이 산업이 제막을 열어젖힐 채비에 분주하다 지난 년 일본을 제치고 글로벌 위를 꿰찬 후 년 간 왕좌를 수성하다 년 액정표시장치를 중심으로 한 중국의 맹추격에 위로 내려와야했지만 유기발광다이오드 기술 개발에 박차를 가하며 다시 한번 세계 시장을 주무를 준비를 하고 최근 디스플레이 시장점유율 기준에서 중국이 한국을 추월하면서 연일 언론을 중심으로 위기론이 쏟아지지만 물량이 아닌 기술력 척도로 구분하자면 아직 한국이 중국보다 수년 이상 앞선 상태 다만 정부 지원으로 저가 물량 무차별 난사를 가하는 중국 업계의 추월을 막기 위해선  뿐 아니라 정부를 중심으로 한 산업 청사진을 다시 그려야한다는 것이 업계의 목소리다일 역삼동에 위치한 사옥에서 이동욱 한국디스플레이협회 부회장을 만났다 그는 에서 로의 전환은 기술 발전과 혁신제품폴더블 모빌리티 등 출시에 따른 흐름이며 우리 이 경쟁국보다 먼저 고부가가치를 창출 할 수  상위 레벨 기술로 전환했다는 점에서 향후 경쟁력에 긍정적이라 본다며 전체 디스플레이 시장에서 차지하는  비중은 지난 년 에서 지난해 기준 까지 올라섰다고 강조했다이날 이동욱 부회장은 디스플레이 산업 중요성에 대해 긍정적인 시각은 물론 안타까움을 드러냈다 사무실 내부 투명  패널을 가리키던 이 부회장은 반도체 차 전지 등과 다르게 이제까지 디스플레이는 다소 소외된 측면이  근데 재밌는 사실은 이건 한국이 기술력으로 꽉 잡고  시장이라는거다 이런 산업이 우리가 몇개나 되느냐 거기다 아파트 가벽 차량 스피커 등 모든 곳에 들어갈 수  이제 디스플레이용이란 인식부터 버려야 한다고 말했다모바일 이어 용 기기도 로와는 달라현재 국내 패널사들이 주도하고  글로벌  시장은 모바일 산업이 중심이다 이동욱 부회장은 는 삼성디스플레이가 년 모바일 에 처음 투자했고 년 뒤부터 양산을 시작했다 현재는 모바일 시장의 가  패널을 사용 중이라며   모빌리티 분야는 모바일보다 늦게 투자돼 이제 시장이 개화하는 상황이라고 설명했다협회 측 설명에 따르면   자동차 시장에서  패널이 차지하는 비중은 각각    수준이다 최근 삼성디스플레이와 중국  등은 용  생산 비중을 늘리기 위해 세대 에 투자를 이어가고  상황이다 글로벌  기기 시장을 주도하는 애플이 모바일에 이어 노트북 기기 등에  채택을 선언하면서다이동욱 부회장은 애플이 아이폰에  패널을 쓰면서 모바일  시장이 년 억불에서 년 억불로 크게 성장했다 이것이 우리가 용  시장에도 기대를 거는 이유라고 강조했다 이어 애플이  시장에도 본격 참여할 경우  수요 증가가 이어지며  첨단 기술력을 보유하고 신뢰성이 인정된 국내 패널사가 유리한 자리에 위치할 것으로 예상된다고 덧붙였다다만 일각에서 제기하는 중국 패널사의 모바일 및 용  추격과 관련해선 이 부회장은  때와는 다르다고 선을 그었다 유기발광물질을 사용하는 는 산소수분으로부터의 보호 기술과 설계 및 제조공정이 복잡해 쉽게 추월하기 어려운 기술이라는 것이 그 이유다 기술 평준화가 된  시장에서는 중국의 가격 경쟁력으로 인해 국내 패널사가 물러설 수 밖에 없었지만 기술 신뢰성이 중요한 의 경우 사정이 다르다는 관측이다애플 특성상 그들이 요구하는 품질 수준을 맞춰줄 수  기술력을 가진 곳은 현재까지 한국 이 유일해요 중국  등이 삼성 등 국내 패널사를 추월할 것이란 전망은 실제 생산량이 아닌 보유 중인 생산 라인의 가동률  수율 를 가정했을 때 기준입니다 실제 생산량 및 기술 수율 수익 측면에서 한국을 추월한다는 의미와는 차이가  또  고도화를 위해 정부도 폼프리 기반의 고휘도 장수명 구현이 가능한 확장형 를 지원하고  초격차 실현에 힘을 보탤 겁니다  가격 경쟁력 확보 추세마이크로는 원팀 코리아로 나가야최근 디스플레이 위기설은 주로 모바일과 용 패널 부문에서 쏟아지고  앞서 언급한대로 모바일의 경우 중국산 가 의 경우 저렴한 중국산  패널이 장악하고  탓이다 이 부회장은 용  인치 패널가가 지난해 불에서 내년엔 불까지 떨어질 것이라며  대비 가격경쟁력을 점차 확보하면서 중국 도 서서히  경기장에 참가하고  수순이라고 설명했다 이에   시장은 내년 까지 확대될 것이란 전망이다이동욱 부회장이 이날 인터뷰에서  확장성 외에 강조한 것은 바로 무기발광 즉 마이크로 시장이다 실제로 최근 디스플레이 산업 화두는 무기발광 디스플레이로 옮겨가고  무기발광 디스플레이는 무기물인 를 광원으로 사용해 고휘도 장수명 장신뢰성의 특성이  무한확장이 가능하다는 이점이 보다 높은 투명도를 자랑해 최근 애플이 스마트워치용에 이를 탑재하겠다는 방침을 밝힌 바  하다이 부회장은 의 경우와 다르게 무기발광는  제조 등 공정주체가 다양하고 공정별 의 역할과 표준공정이 부재한 상황이라 소부장과 수요의 협력이 동반돼야 한다며 그러나 현실은 중국과 대만이 먼저 시장선점을 위해 발 빠르게 움직이고  실정이라고 지적했다 그러면서 다만 이런 상황에서 정부가 무기발광 예타사업에 매우 적극적으로 지원하고  점은 고무적인 일이라고 했다이어 와 무기발광 디스플레이는 경쟁이 아니라 상호 보완적인 관계로 무한 확장성을 가진 마이크로 영역은 새롭게 탄생할 것이고 는 현재 대부분의  시장을 조금씩 대체해나갈 것으로 본다며 다만 마이크로의 경우 세트업체인 삼성전자에서만 하고  시장 전체가 살려면 전반적인 국내 공급망 생태계 생성이 매우 중요하다 무기발광은 국내 패널사들도 이제 시작 단계인만큼 소부장들과의 원팀 플레이가 중요하다고 본다고 했다



일 서울 강남구 역삼동에 위치한 한국디스플레이산업협회 사옥에서 이동욱 협회 부회장이 인터뷰에 응하고  임채현 디스플레이 위기설 시장은 개척하는 것이 부회장은 인터뷰 도중 여러차례 업계를 바라보는 안팎 시선에 대한 답답함을 토로하기도 했다 산업 전반에 팽배한 처럼 도 중국에 잠식되는 것 아니냐는 우려 섞인 부정적 여론 탓이다 이 부회장은 우리에게 충분히 승산이  시각을 내비쳤다 그는 를 정리하는 과정에서 어느 정도의 피해는 당연히 입을 수 밖에 없다 지금 삼성이나 현대가 패널을 구매하고  굴지의 들이 교차구매를 한다는 건 디스플레이 황금기가 왔다는 이야기라며 시장은 주어지는 게 아니라 개척하는 것이라고 힘줘 말했다다만 그 과정에서 산업 구조적인 문제점에 대해 아쉬움을 드러내기도 했다 세트업체와 패널사의 관계라는 구조를 지적한 것이다 그는 예를 들어 디스플레이에서 투명  패널을 만든다해도 조립해서 마케팅으로 시장을 개척하는 것은 또 세트업체의 역할 아니겠느냐 패널사들은 구조적으로자체적인 시장개척이 어려운만큼 세트업체와의 협력이 중요하다고 본다고 했다 앞서 무기발광 원팀을 강조한 이유기도 하다그렇다면 디스플레이 황금기를 맞이하기 위한 협회 차원의 역할은 뭘까 그에 대해 이동욱 부회장은 철강 화학 뿐만 아니라 디스플레이 역시 에너지 다소비 업종의 하나다 탄소중립 등 글로벌 이슈에 대응하고자 협회는 기후변화협약 회의에 참석 하며 산업계 의견을 대변하고  그 결과 지난해 그린피스 기후위기 대응평가에서 국내 패널사 모두 등급이 상향됐다고 했다 협회에 따르면 그린피스 평가에서 중국 는 최하위 등급인데 반해 국내 패널사들은 년 로 올라섰다이동욱 부회장은 디스플레이 산업이 한국과 중국이라는 두 플레이어가 이끄는 만큼 우리가 중국을 견제할 수  분야 중 하나가 바로 친환경이라며 특히 유럽 쪽은 이 분야에서 굉장히 민감하다 쉽게 말해 어디에나 들어가는 디스플레이인만큼 재활용도 돼야되는 거다 협회 차원에서 환경부랑 밀접하게 탄소기후협약 등 동향을 파악하는데 주력하고   경영을 내걸지 않을 수 없는데 이 부분에선 우리가 중국보다 확실하게 경쟁력을 가진다고 본다고 설명했다끝으로 이동욱 부회장은 디스플레이 시장이 가진 오해를 없애고 싶다고 했다중장기적으론 이를 피부에 부착하는 등의 혁신적인 신시장이 나올 거라고 봐요 모빌리티  등 타산업과의 융합 홀로그램 등 산업 영역을 무한 확장할 수  가능성을 가진 업종이 디스플레이에요 현 정부 들어 드디어 국가첨단전략기술로 인정된 것도 이같은 이유겠죠 또한 기술 유출 방지도 중요하지만 기술개발을 통해 경쟁국과 격차를 확대하며 무한으로 산업 경쟁력을 넓혀갈 수  경쟁력을 한국 디스플레이 산업이 가지고  저는 봅니다 여기저기서 중국에게 뺏긴 혹은 위기라고 일컫는 이 산업을 다시 한번 확실히 반석 위에 올리는 것이 제 목표입니다'
기고조선 한국형 화물창 기술로 승부 걸어라|'최성안 한국조선해양플랜트협회 회장친환경 선박 점유율 에 밀리고 화물창 기술은 회사 독점기술종속 탈피  개발 시급재해 근절인력 양성도 노력해야



서울경제 국내 조선 업계는 현재 년 이상의 일감을 확보하며 조선소를 안정적으로 운영하고 경영 실적을 개선할 수  기반을 마련했다 정부의 지원에 더해 협력 업체 근로자들이 노력한 결과다 그러나 글로벌 경쟁 심화 미래 선박으로의 전환 인력 수급의 불균형 등은 우리가 당면하고  과제들이다글로벌 경쟁 심화 측면에서는 중국의 친환경 선박 분야 약진이 매섭다 년 친환경 선박의 세계 발주 비중은 전체 선박 발주의 절반에 육박한다 다만 친환경 선박 점유율은 년 한국  중국 에서 지난해 한국  중국 로 역전됐다 또 최근 국제해사기구는 년까지 선박에서 배출되는 탄소 배출량을 제로로 만드는 데 합의했다 선박의 탄소 중립을 달성하기 위해 각국의 치열한 논의와 기술적 혁신이 진행되고 국내 조선 업계는 앞으로 친환경자율운항 선박 기술 개발과 디지털 전환에 적극 대응해 미래 글로벌 시장을 선도해야 한다 그렇지 않으면 미래는 불투명하다 액화천연가스 수소 암모니아 등 핵심 친환경 연료 관련 기술 개발 및 이를 실증할 수  인프라 구축과 더불어 재 개발을 위해 정부와 힘을 합쳐야 한다 특히 각 연료의 특성을 고려한 친환경 연료를 담을 수  화물창 기술 등이 중요한 과제로 부상하고 그간 국내 조선 업계가 축적해온  화물창 기술은 앞으로 무탄소 에너지원인 암모니아수소를 안전하게 운반하기 위한 소중한 경험의 자산이다 그러나 현실을 보면 정작  화물창의 원천 기술은 프랑스 회사인 가 독점하고  현재 전 세계적으로 건조 중인  선박은   기술을 적용하고  현재 국내 조선소들이 확보하고  선 일감이 척임을 감안할 때 사에 지불해야 할 로열티 규모는 약 조 원에 달해 그 경제적 손실이 매우 크다 국내 조선사들은 이러한 기술 종속 문제를 해결하기 위해 년부터 국책 과제로 선 화물창 기술을 개발해 선 척을 건조했지만 기술적인 문제로 운송이 중단됐다현재 중국은 글로벌 선 발주 급증으로 낙수 효과를 누리고  와 라이선스 계약을 맺은 조선소들 역시 개사로 우리나라개보다 많다 올해부터는 본격적으로 선 공사를 시작한 데다 화물창 자국 생산 체계를 구축하고  만큼 선 시장을 중국에 잃을 수  위기감이 높아지고  따라서 우리는 그간 개발 축적된 기술을 활용  화물창 개발을 시도해 한국형 화물창 기술을 확보해야 한다이 외에도 조선 업계는 산업의 지속 가능한 발전을 위해 인력 수급과 양성을 공동으로 노력해야 한다 조선사 협력 업체 재 및 블록 업체와의 공동 성장과 중대재해 근절을 위한 방안을 강구하고 전 생태계 차원에서의 조선업 상생 발전을 심각히 고민하고 손을 맞잡아야 할 시기다정부는 이달 일 열린 조선 차세대 이니셔티브 차 회의에서 민관이 합심해 안정적 인력 수급 방안을 공동으로 추진할 것이라고 발표했다 또 대중소 원하청 노사 간 상생 협력을 해줄 것을 업계에 주문하고  참으로 시의적절한 정책이다산업 대전환을 맞은 우리 조선 업계는 원 팀으로서 민관 협력을 통해 중국과의 경쟁에서 승리하고 미래 조선 기술을 선점 제품을 잘 만드는 것에서 탈피해 미래 글로벌 시장을 선도해나갈 것이다'
강동구와 손잡고 탄소중립 실천 나서|'강동농협 넷제로 에너지카페 선정



서울 강동구가 강동 넷제로 에너지카페로 선정한 강동농협 파믹스센터 팜카페에 차를 마시러 온 고객들로 붐비고  서울 강동농협조합장 박성직이 강동구구청장 이수희와 손잡고 탄소중립 실천에 나선다두 기관은 일 지속가능한 지역에너지 전환 구민 참여형 탄소중립 도시 조성을 목표로 강동 넷제로 에너지카페 추진을 위한 협약서에 서명했다협약 이후 두 기관은 기후위기 인식 전환 프로그램 기획 기후위기 완화를 위한 정책 추진과 행정 지원 지역경제 활성화와 일자리 창출에 도움이 될 탄소중립 지역에너지 전환사업 운영에 함께 노력한다앞서 강동농협이 고덕동에서 운영하는 파믹스센터 팜카페가 최근 강동구가 추진한 강동형 기후위기대응 플랫폼 강동 넷제로 에너지카페 공모에 최종 선정됐다공모 과정에서 강동농협은 유기농아카데미는 물론 친환경농업체험실습장치유농업센터 등을 다년간 운영해온 점이 좋은 평가를 받았다 농협의 다양한 친환경시설과 넷제로 에너지카페가 상승효과를 낼 수  기대가 나오는 이유다박성직 조합장은 파믹스센터 안에 탄소중립교육장과 홍보전시관체험활동장을 조성해 지역사회 탄소 줄이기 운동과 발맞춰 나갈 것이라면서 농협 내부 농민 생산조직 부녀회 등 인력을 적극적으로 활용해 팜카페를 알리겠다고 강조했다이수희 구청장은 이번에 새로 선정된 강동농협 팜카페가 주민에게 기후위기에너지전환 정책 정보를 제공하고 저탄소 녹색생활 실천을 확산하는 공간으로 자리매김하길 바란다고 말했다'
머니투데이 오프라인 헤드라인일|종합무탄소에너지 없이는뭘해도 열 받는다한국식으로 다 바꾼다 셀러 모시는 알리 역발상민관정 콕 찍은 탄소중립에너지 균형공급 동력군사력 막강해도 정보력 뒤지면 치명적 안전지대 아니다전공의 이탈 한 달째출구없는 대치 대형병원 하루 수십억 적자 늪 시스템공천 뒤늦은 재부팅흔들린 중도층 표심 잡을까오피니언민간주도 벤처투자시장 해외투자 활성화 방안신통한 사람들국제옷 대신 금의 투자 빠진  세대기획서울 출퇴근 경기도민에 진심대중교통 통합권 확대할 것산업 보조금 인상에도 인상 못 펴는 삼성말은 안통해도 은 통했다 금융몸값 오른 보험사들 붐 온다바이오세계 첫  신약 제약 은메달 각축유니콘 팩토리통원 재활 못해도실버 돌보는 홈트 앱과학수십년 검증 시큐리티 이젠 해외로건설 부동산멈추면 손해 서울 정비사업 다시 기지개정책사회문화매력 풍성 숨은 지역 찾아 월엔 여기로사회먹이 찾기 고달픈 멧돼지 동네 산책 불안한 시민들증권주주환원수장교체 새바람 타고명가 명성 이어간다바로 속도조절변수는  금리정책
단독 댐의 물로 데이터센터 냉각 원전 기급 에너지 아낀다|'물 온도 이용한 수열 사업							댐의 차가운 물을 이용해 열이 많이 발생하는 데이터센터를 식히는 등 물 온도로 전기를 절약하는 수열 사업을 년까지 전국 개 댐에서 진행한다고 환경부가 일 밝혔다 최대 원전 기가 생산하는 기가와트 용량의 에너지를 아낄 수  것으로 분석된다이날 환경부와 수자원공사에 따르면 소양강댐은 수열 사업에 착수했고 전국 개 다목적댐 중 충주댐 남강댐 대청댐 주암조절지댐 용담댐 안동댐 임하댐 등 곳을 적합지로 선정했다 이중 충주댐대청댐은 기본 구상까지 마친 것으로 알려졌다 앞서 일 윤석열 대통령은 소양강댐을 방문해 강원도 수열 클러스터를 착공하고 데이터센터 중심 산업단지를 조성하기로 했다



