title|content
일현지시간 정의선왼쪽 현대자동차그룹 회장이 브라질 브라질리아 내 대통령 집무실에서 룰라 대통령과 신규 투자와 포괄적 협력 방안에 대해 논의하고  현대차그룹 제공현대자동차그룹은 브라질에서 자동차 판매뿐만 아니라 브라질과 함께 동반 성장을 해 나가고자 합니다정의선 현대자동차그룹 회장이 중남미 최대 경제국인 브라질을 방문해 루이스 이나시우 룰라 다 시우바룰라 브라질 대통령과 면담하고 억 달러약 조억원에 달하는 신규 투자 계획과 미래 신사업사회공헌 등 전방위 협력 방안에 대해 논의했다 관련기사 면일현지시간 브라질의 수도 브라질리아 내 대통령 집무실에서 진행된 정 회장과 룰라 대통령의 면담에는 제랄도 알크민 브라질 부통령 겸 산업통상자원부 장관 호세 무뇨스 현대차 사장 등이 동석했다브라질에는 현대차그룹의 유일한 중남미 생산거점이며 중남미 시장 공략의 첨병인 현대차 브라질 법인과 중남미 권역본부가 위치해  남미에서 가장 큰 시장인 브라질을 교두보로 삼아 본격적인 글로벌 신흥 시장 공략에 가속도를 내는 것으로 풀이된다룰라 대통령은 년 브라질 금속노조 위원장에 선출되며 본격적인 사회활동을 시작했고 지난 년 대선에서 승리해 브라질 역사상 최초의 선 대통령으로 취임했다정 회장은 현대차 브라질 공장에 대한 브라질 정부의 지속적인 관심과 지원에 감사를 표한다면서 현대차 브라질 법인과 현지 파트너사들이 수소 등 친환경 분야 미래기술 등에 년까지 억 달러를 투자할 계획이라고 밝혔다브라질은 지난해 월 브라질 탈탄소 부문에 투자하는 자동차 제조업체들에 총 억 헤알약 조억원 규모의 감세 및 보조금 혜택을 부여하는 등 그린 모빌리티 혁신 프로그램 계획을 발표한 바 룰라 대통령은 이날 정 회장에게 브라질 정부의 세제개혁과 투자환경 개선 등을 설명하며 친환경 수소분야와 기술 등에 투자할 현대차는 브라질에서 성장하고  중요한 이라고 강조했다 브라질 정부는 년까지 온실가스 배출량을 년 대비  감축하고 년까지 탄소중립을 달성한다는 목표 아래 다각적인 친환경 정책을 펼치고 정 회장도 현대차그룹은 탄소배출 제로 달성을 위해 전기차수소차를 아우르는 빠른 전동화 전략을 추진 중이며 수소 에너지는 기후변화 대응의 핵심 수단이자 전동화를 보완하는 중요한 자원이라고 언급했다 아울러 그는 현대차그룹이 미래 모빌리티 리더십 확보를 위해 추진중인 미래 항공 모빌리티과 소형모듈원전 등에 대해 설명하면서 이 브라질 교통환경에도 적합한 미래의 교통수단이라고 확신하고  분야에서도 협력방안을 모색할 수  희망한다고 밝혔다브라질 정부의 탈탄소 정책과 관련해서도 정 회장은 친환경 에너지원을 연구하고 발전 적용시키기 위한 브라질 정부의 노력을 잘 알고 면서 수소 및 친환경 모빌리티 분야에서 현대차그룹이 기여할 부분이  적극 참여하겠다고 말했다한편 정 회장은 현대차그룹이 브라질 직원과 지역사회를 위한 진행해 온 다양한 노력을 소개했다 그는 현대차그룹은 무료 치과치료 재식림 프로그램 등 브라질 지역사회를 위한 다양한 사회공헌 활동을 수행하고 면서 근로자들의 행복을 최우선하는 현대차 브라질 공장은 안전한 작업 환경을 조성했고 노사합동 세미나 및 간담회 등을 정기적으로 시행하며 년 연속 임금협상 무분규 타결을 이끌어 냈다고 밝혔다현대차 브라질 공장은 상파울루주 고용노동관계국에서 수여하는 양질의 일자리 우수  인증을 받은 바 정 회장은 이날 룰라 대통령 면담에 이어 카를로스 길베르토 칼리로티 주니어 상파울루대학 총장을 포함한 대학 관계자들을 만나 친환경 분야 인재육성 및 산학협력 방안에 대해서 의견을 나눴다 년 설립된 상파울루대학은 개교 이래 명의 대통령을 배출하는 등 브라질 사회에 크게 기여한 것으로 평가받고 정 회장은 해외 방문 시 시간을 할애해 현지 주요 대학 총장들과 직접 만나 심도 깊은 대화를 나눠 왔다 지난해에도 미국 조지아공대 총장 베트남 하노이국립대 총장 등과 면담을 갖고 미래기술 확보 해외 우수인재 육성 및 발굴 신사업 분야 산학협력을 논의했다양대근서재근 '
현대차그룹 브라질에 년까지 조억원 투자정의선 회장 룰라 대통령 면담|'정의선왼쪽 현대차그룹 회장이 일현지시간 루이스 이나시우 룰라 다 시우바 브라질 대통령과의 면담에서 친환경 미래기술 분야에 대한 현대차그룹의 투자계획 등을 설명하자 룰라 대통령이 이를  경청하고  현대차그룹 제공현대자동차 그룹이 남미 최대 경제 대국인 브라질 시장 공략 강화를 위해 친환경 미래기술 분야 등에 년까지 억달러약 조억원를 투자하겠다고 밝혔다현대차그룹은 일 브라질을 방문하고  정의선 회장이 일현지시간 루이스 이나시우 룰라 다 시우바 브라질 대통령과의 면담에서 이같이 말했다고 밝혔다정 회장은 브라질이 최근 추구하고  탈 탄소 정책과 관련 친환경 에너지원을 연구하고 발전 적용시키기 위한 브라질 정부의 노력을 잘 알고 며 수소 및 친환경 모빌리티 분야에서 현대차그룹이 기여할 부분이  적극 참여하겠다고 말했다브라질은 지난해 월 브라질 탈탄소 부문에 투자하는 자동차 제조업체에 총 억헤알약 조억원 규모의 감세 및 보조금 혜택을 부여하는 그린 모빌리티 혁신 프로그램을 발표했다 이에 따라 글로벌 완성차 업체의 브라질 투자계획이 잇따르고 



루이스 이나시우 룰라 다 시우바가운데 브라질 대통령이 일현지시간 정의선 현대차그룹 회장과 면담한 뒤   비전 고성능 수소 하이브리드 롤링랩 모형을 들고 오른쪽 엄지손가락을 치켜들고  왼쪽은 제랄도 알크민 브라질 부통령  브라질 정부 제공정 회장은 그러면서 현대차그룹은 탄소배출 제로 달성을 위해 전기차 수소차를 아우르는 빠른 전동화 전략을 추진 중이며 수소 에너지는 기후변화 대응의 핵심 수단이자 전동화를 보완하는 중요한 자원이라고 강조했다정 회장은 이와 함께 현대차그룹이 미래 모빌리티 선도를 위해 추진 중인 미래항공 모빌리티와 안정적인 발전원으로 개발 중인 소형모듈원전을 소개하면서 이 브라질 교통환경에도 적합한 미래 교통수단이라고 확신하며  분야에서도 협력방안을 모색할 수  희망한다고 말했다룰라 대통령은 브라질 정부의 세제 개혁과 투자환경 개선 등을 소개하면서 친환경 수소분야와 기술 등에 투자할 현대차는 브라질에서 성장하고  중요한 이라고 말했다브라질은 년까지 온실가스 배출량을 년 대비  감축하고 년까지 탄소 중립을 달성한다는 목표 아래 다각적인 친환경 정책을 펼치고 



현대차 브라질 판매 현황 브라질자동차산업협회 제공현대차그룹은 브라질의 친환경 기조에 발맞춰 브라질 자동차 시장의 전동화를 선도하고 수소 기술을 활용한 사업 기회를 모색하는 등 현지 성장 동력을 마련한다는 구상이다 이와 맞물려 현대차 아이오닉 코나 일렉트릭 등 세계 시장에서 호평받은 전동화 차량을 투입하고 기아 전용 전기차 를 출시해 브라질 전동화 라인업을 지속 확대할 계획이다또 그린 모빌리티 혁신 프로그램을 위해 브라질에 최적화된 하이브리드 혼합연료차량 전용 파워트레인도 개발할 예정이다현대차그룹은 또 브라질을 중심으로 글로벌 수소 네트워크를 중남미까지 확장할 계획이다 수소 상용차 신시장 개척 및 수소연료전지 시스템 공급 등 신사업을 발굴하고 수소 생태계 조성을 위한 그룹사 간 협력 네트워크를 강화해 브라질을 비롯한 중남미 지역에서 수소를 활용한 새로운 사업을 적극 창출한다는 방침이다 이를 위해 지난해 말 브라질 현지에 중남미지역 수소사업 전담 조직을 신설하고 수소 시장을 적극 발굴하고 현대차그룹은 또 브라질 지역사회를 위한 사회공헌 활동도 지속해 나가겠다는 점을 강조했다 현대차그룹은 만명 이상의 피라시카바시 지역 아동과 치안 공무원을 대상으로 무료 치과 서비스를 제공하는 소리소 시다다오 프로그램을 년간 운영 중이며 피라시카바시 공립학교 학생들에게 과학 기술 및 코딩 수업을 제공하고 현대차는 지난 년 월 상파울루주 피라시카바시의  규모 부지에 자동차 제조공장을 준공했다 부품 창고와 연구개발센터를 포함한 완성차 생산기지로 연간 만대 이상 생산 능력을 갖췄으며  길이의 시험 주행 트랙도 마련돼 또 현대차는 열대우림을 복원하기 위한 아이오닉 포레스트 캠페인 상파울루대학을 비롯한 현지 기관과의 공동 연구 등도 진행 중이다정 회장은 현대차그룹은 단순히 자동차 판매뿐만 아니라 브라질과 함께 동반 성장해 나가고자 한다며 무료 치과치료 재식림 프로그램 등 브라질 지역사회를 위한 다양한 사회공헌 활동을 수행하고 고 소개했다정 회장은 룰라 대통령과의 면담에 이어 카를로스 길베르토 칼리로티 주니어 상파울루대학 총장을 만나 친환경 분야 인재 육성에 대해 논의했다 정 회장은 친환경 분야에서 높은 수준의 경쟁력을 보유한 상파울루대학과의 긴밀한 협력을 통해 브라질의 청정에너지 시장을 선도하기를 기대한다고 했다현대차는 지난 년 브라질에서 만여대의 차량을 판매해 에 육박하는 시장 점유율위을 기록하는 등 견실한 성장을 이어가고  특히 현지 맞춤형 소형차 모델인 과 스포츠유틸리티차 크레타 등이 인기를 얻고 정 회장은 브라질 방문 기간 타르치시오 드 프레이타스 상파울루주 주지사를 면담하고 현대차 공장을 찾아 사업 현황과 중장기 친환경 모빌리티 전략 등을 점검할 예정이다'
충남도 자동차 주행거리 감축하면 최대 만원 인센티브|'탄소중립 홍소영 제작 일러스트홍성연합뉴스 김소연   충남도는 자동차 주행거리 감축 실적에 따라 최대 만원 인센티브를 지급하는 자동차 탄소중립 포인트제 참여자를 오는 일부터 모집한다    일 도에 따르면 참여 대상은 도에 인승 이하 비사업용 승용승합차를 등록하고  소유주로 인당 대만 신청할 수     사업용 차량과 친환경 차량전기하이브리드수소 등은 대상에서 제외된다    자동차 탄소중립 포인트 누리집에서 회원가입을 한 뒤 문자로 전송된 링크를 통해 차량 전면번호판 포함 사진과 누적 주행거리가 표시된 계기판 사진을 제출하면 된다    다음 달 일까지 시군별로 선착순 모집하고 마감되지 않은 시군은 월 일부터 잔여 차량만큼 추가 신청을 받는다



자동차 탄소중립포인트제 포스터충남도 제공 재판매 및  금지    '
