title|content
새만금개발청과 인근의 새만금산업단지 항공 사진 연합뉴스잼버리 대회 파행을 둘러싼 책임론은 감사원 감사를 통해 밝혀질 전망이다 감사원은 새만금 세계스카우트잼버리 대회 추진실태에 대한 감사를 작년 월일 착수해 같은 해 월일 마무리했다 감사원은 당시 여러 문제가 제기된 상황이어서 전북도청 외에 여성가족부와 잼버리대회 조직위 새만금개발청 등 개 기관을 대상으로 실지감사 공문을 보냈다 실지감사는 감사기관이 대상기관과 현장을 방문해 감사를 실시하는 감사 착수의 첫 번째 단계를 말한다 감사원은 감사원 사회복지감사국 과 인력을 투입해 잼버리 감사단을 구성했고 감사팀이 전북도청 층의 감사장에 상주하며 전북도 잼버리 추진단을 비롯한 각 부서 직원들을 대상으로 고강도 감사를 벌였다 지금은 실지감사 종료 이후 서면 등으로 대상 기관의 의견을 수렴하는 의견수렴 단계에  것으로 확인됐다 감사원은 의견수렴이 마무리되면 감사보고서 작성단계 감사보고서 검토 및 심의단계 감사보고서 시행 및 공개 준비단계 과정을 거쳐 감사보고서를 공개단계하게 된다 전북에서는 여러 절차를 감안할 때 올 월 제대 총선이 끝난 이후에나 감사결과가 발표될 것으로 내다보고  감사원의 한 관계자는 잼버리 대회 감사와 관련해서는 아직 마무리가 덜 된 상태라며 감사 착수와 처리 단계상 의견 수렴 중이라는 것 외에 확인해 줄 수  것은 없다고 말했다 감사원 감사를 통해 새만금잼버리 파행에 대한 오해와 불신을 걷어낸다 해도 급제동이 걸린 새만금사업의 향방은 아직 미지수라는 게 전북지역 정치권과 시민사회단체의 공통된 시각이다 현재 새만금사업은 정부의 내부개발 재수립 방침에 따라 속칭 빅픽처 를 그리기 위해 각 분야의 다양한 전문가 의견 수렴 중에  



새만금 사업 내부에  새만금간척박물관 모습 새만금개발청년 월에 첫 삽을 뜬 단군 이래 최대 규모의 국책사업이 여년 동안 방조제를 축조하는 일 외에 내부개발을 어떻게 해야 할지 그림만 그리다 다시 스케치북을 꺼내든 모습이다 내부 개발의 밑그림 작업을 진행할 새만금개발청은 올 연말까지 초안을 잡은 뒤 내년에 마무리한다는 방침이다 민간투자 가속화에 따른 여건 변화를 반영하여  중심의 기본계획을 년까지 재수립한다는 방침이다 새만금개발청은 이 같은 내용을 골자로 하는 년 주요정책 추진계획 주요내용을 일 발표했다 여기에는  친화적 투자환경 조성을 위해 새만금 산업단지 기반시설 건설과 근로여건 개선 등 맞춤형 지원을 강화하여 새만금을 첨단전략산업의 중심지로 구축한다는 내용도 포함돼  되돌아 보면 새만금사업은 내부개발을 위한 밑그림을 너무 많이 그려서 탈이라는 지적이 많았다 전북 서해안의 부안군과 군산시를 잇는 에 달하는 세계 최장의 방조제를 축조해 내부 토지 만와 담수호 만 등 총 만의 땅을 새롭게 조성하는 새만금사업은 서울의 분의  파리의 배에 해당하는 국토를 넓히는 국책사업이다 만명의 국민 모두에게 나눠준다 해도 인당 약  평씩 할애할 수  크기이다 이러다 보니 정부는 단계로 나눠 오는 년에 용지개발을 완료하는 등 장기사업 중 최장사업으로 축 늘어져  불명예를 벗지 못하고  



새만금 내부 토지를 지나는 남북도로 항공사진 새만금개발청공간구상 계획은 수도 없이 변했다  농업생산기지 조성년에서 시작해 복합개발년 월다기능 융복합기지 조성년 월명품복합도시 개발년 월 등으로 변천했다 여기가 끝이 아니다 창조적 녹색수변도시 구현년 월글로벌 경제협력 거점 육성을 위한 경제협력특구 도입년 월탄소중립 사회를 선도하는 글로벌 녹색성장 중심지 구현년 월 등 굵직한 공간 구성계획 변경만 기록한다 해도 두꺼운 책 한 권이 나올 정도이다 사회단체의 한 관계자는 큰 그림만 여러 번 바뀌었지 작은 그림을 그렸다가 지우고 다시 색칠한 사례까지 감안하면 새만금 밑그림은 사실상 누더기를 방불케 할 것이라며 지금은 그림을 그리는 것이 중요한 것이 아니라 색칠을 하고 하나씩 하나씩 실행에 옮기는 강한 실천력이 중요한 때라고 강변했다 전문가들은 누구도 바꿀 수 없는 지속가능한 새만금 내부 개발계획을 확정하고 국가 차원의 혁신적인 투자에 나서야 할 것이라는 주장이다 년 넘는 세월 속에 정책 일관성이 배제된 새만금이 양치기 소년으로 전락한 만큼 이를 극복하고 대규모 투자와 강력한 실행력을 발휘해야 한다는 주장이다 정치권의 한 관계자는 굵직한 선거 때마다 여야 후보들이 표심 사냥용으로 새만금 개발을 써먹는 일회용으로 전락하다보니 그림만 그리다 판이 끝날 지경이라며 윤석열 정부가 억원의 용역비까지 마련해 지속가능한 빅픽처를 그리겠다고 하니 목적을 분명히 하고 다시는 정략적으로 새만금이 활용되지 않도록 해야 할 것이라고 주장했다 이양승 군산대 교수무역학과의 제안은 이런 측면에서 귀담아들을 만하다 이 교수는 새만금이 다시는 정략적으로 활용되는 일이 없도록 스스로 묶는 전략이 필요하다며 새만금은 항해 중인 배와 같다 가장 큰 난관은 세이렌의 유혹이다고 주장했다 



새만금개발청은 작년 월 이후 새만금 입주 간담회 를 추진하며 들의 애로 해소에 나서고  새만금개발청그리스 신화에 나오는 영웅이자 이타카의 왕인 오디세우스는 세이렌의 유혹에 넘어가지 않기 위해 자신을 기둥에 묶어 목숨을 구할 수  뜻을 이뤘다 이양승 교수는 새만금도 목적을 분명히 정하고 다시는 목적변경이 불가능하도록 스스로 묶을 필요가 며 그렇지 않으면 새만금사업은 계속 표류할 수밖에 없다 오디세우스처럼 스스로 묶어 유리함을 구하는 지혜가 필요하다고 강조했다 아무도 흔들 수 없는 새만금을 조성하기 위해 명확한 목적으로 묶어 목적지에 도달하는 오디세우스의 전략을 활용해야 한다는 주장이다'
국내 최대 해상풍력단지 조성 속도낸다인천시오스테드 협약|'지난해  발전사업 허가년까지 옹진군 해역에 조성인천시가 글로벌 해상풍력 위 인 오스테드와 함께 국내 최대 규모의 해상풍력발전단지 조성 사업에 속도를 낸다인천시는 일현지시간 덴마크 코펜하겐에서 현지 국영인 오스테드와 해상풍력발전 사업을 위한 업무협약을 맺었다 이번 협약은 유럽 출장 중인 유정복 인천시장이 토마스 투너 앤더슨 오스테드 이사회 의장과 만나 체결했다 협약식에는 라스 아가드 덴마크 기후에너지유틸리티부 장관과 스벤올링 주한 덴마크 대사 등도 참석했다인천시는 오스테드가 인천 해상에서 추진중인 해상풍력 사업과 관련해 지역 수용성 제고와 기반시설 구축 등을 행정적으로 지원할 방침이다 오스테드는 지역주민과 상생하는 모범적인 모델을 만들고 해상풍력 공급망 산업을 국내에서 적극적으로 육성하기로 했다현재 오스테드는 인천 해상에서 국내 최대 규모의 해상풍력발전단지 사업을 추진하고  지난해 월에는 산업통상자원부로부터  발전 사업 허가권도 받았다 오스테드는 사업비 조가량을 들여 년까지 옹진군 해역과 배타적경제수역 인근에 해상풍력단지를 조성할 계획이다



일현지시간 덴마크 코펜하겐에서 유정복 인천시장과 토마스 투너 앤더슨 오스테드 이사회 의장이 인천시오스테드 해상풍력 및 지역산업 육성 협력 업무협약을 체결한 뒤 기념촬영을 하고   사진 제공인천시토마스 의장은 오스테드는 새로운 에너지 산업 전환을 추진하고  공급망 부문에서 한국은 놀라운 기술연구와 제조생산력을 갖고  협력이 꼭 필요하다며 이번 인천시와 업무협약으로 관련 산업이 더욱 발전할 것이라고 강조했다라스 아가드 장관은 기후변화는 전 인류의 문제로 한국과 덴마크는 년부터 녹색성장동맹으로 함께 대응하고 며 인천과 오스테드의 프로젝트가 성공적으로 달성돼 기후환경 미래에 기여하길 바란다고 말했다인천시는 년까지 용량  규모의 해상풍력발전단지를 조성할 계획이다 여기에는 오스테드를 포함한 민간사업과 공공주도사업 등 총 조원의 사업비가 투입된다 현재 민간주도로 남동발전과 오스테드가 각각 지난해 월과 월에 발전사업 허가를 받았고  레저는 발전사업 허가 후 환경영향평가 초안을 제출한 상태다 시는 인천 해역과 인근 배타적경제수역 해상풍력 적합 입지 발굴과 주민 수용성 확보에 집중하고 유 시장은 인천시는 국가 탄소중립 목표보다 년 앞당긴  탄소중립 비전을 선언하고 석탄 화력 폐지와 신재생에너지 확대를 최우선 전략과제로 추진 중이라며 이번 업무협약을 통해 지역과 상생하는 해상풍력사업이 확대되고 관련 지역산업도 한층 더 성장하는 계기가 될 것으로 기대한다고 말했다덴마크는 풍력발전을 핵심으로 전체 전력의 약 를 신재생에너지로 전환한 신재생에너지 강국이다 유 시장은 협약식이 끝난 뒤에는 코펜하겐에  아베되르 연안 풍력발전소 아마게르 바케 폐기물 소각장 호퍼블록 열병합 발전소를 잇달아 방문했다'
정의선 현대자동차그룹 회장 브라질 룰라 대통령 면담|'정의선 현대자동차그룹 회장과 루이스 이나시우 룰라 다 시우바 브라질 대통령이 포괄적 협력 방안에 대한 논의를 마쳤다 특히 정 회장은 직원과 지역사회를 위한 현대자동차 브라질 공장의 다양한 노력 소개하고 자동차 판매뿐 아니라 브라질과 함께 동반 성장하겠다는 진정성을 강조했다 브라질에는 현대차그룹의 유일한 중남미 생산거점이자 중남미 시장 공략의 첨병인 현대차 브라질 법인과 중남미 권역본부가  현지시간 일 브라질의 브라질리아 대통령 집무실에서 진행된 룰라 대통령과 정의선 회장의 면담에는 제랄도 알크민 브라질 부통령 겸 산업통상자원부 장관 현대차 호세 무뇨스 사장 등이 동석했다룰라 대통령은 년 브라질 금속노조 위원장에 선출되며 사회활동가로 부상했고 년 대선에서 승리해 브라질 역사상 최초의 선 대통령으로 취임했다정의선 회장은 우선 현대차 브라질 공장에 대한 브라질 정부의 지속적인 관심과 지원에 감사를 표하며 직원과 지역사회를 위한 현대차 브라질 공장의 다양한 노력을 소개했다정의선 회장은 현대차그룹은 단순히 자동차 판매뿐만 아니라 브라질과 함께 동반 성장해 나가고자 한다며 무료 치과치료 재식림 프로그램 등 브라질 지역사회를 위한 다양한 사회공헌 활동을 수행하고 고 말했다 이어 근로자들의 행복을 최우선하는 현대차 브라질 공장은 안전한 작업 환경을 조성했고 노사합동 세미나 및 간담회 등을 정기적으로 시행하며 년 연속 임금협상 무분규 타결을 이끌어 냈다고 밝혔다직원 친화적인 제도가 자리잡으며 현대차 브라질 공장은 상파울루주 고용노동관계국에서 수여하는 양질의 일자리 우수  인증을 받았다정의선 회장은 브라질 정부의 탈탄소 정책에 대해 친환경 에너지원을 연구하고 발전 적용시키기 위한 브라질 정부의 노력을 잘 알고 며 브라질 정부의 다양한 친환경 정책에 깊은 공감을 나타내고 수소 및 친환경 모빌리티 분야에서 현대차그룹이 기여할 부분이  적극 참여하겠다고 말했다정의선 회장은 현대차 브라질 법인과 현지 파트너사들이 수소 등 친환경 분야 미래기술 등에 년까지 억 달러를 투자할 계획이라고 밝혔다 브라질은 지난해 월 브라질 탈탄소 부문에 투자하는 자동차 제조업체들에 총 억 헤알약 조억 원 규모의 감세 및 보조금 혜택을 부여하는 그린 모빌리티 혁신 프로그램을 발표했고 글로벌 완성차 업체들의 브라질 투자계획이 잇따르고 



일현지시간 정의선 회장사진 오른쪽이 룰라 대통령사진 가운데 제랄도 알크민 브라질 부통령사진 왼쪽을 만나  비전 고성능 수소 하이브리드 롤링랩 모형을 들고 기념 촬영을 하고 정의선 회장은 현대차그룹은 탄소배출 제로 달성을 위해 전기차 수소차를 아우르는 빠른 전동화 전략을 추진중이며 수소 에너지는 기후변화 대응의 핵심 수단이자 전동화를 보완하는 중요한 자원이라고 언급했다정의선 회장은 이와 함께 현대차그룹이 미래 모빌리티 리더십 확보의 일환으로 시장 확대 및 기술 경쟁력 우위 확보를 추진중인 미래 항공 모빌리티과 안정적인 발전원으로 현대차그룹이 개발에 박차를 가하고  소형모듈원전에 대해 설명했다정의선 회장은 이 브라질 교통환경에도 적합한 미래의 교통수단이라고 확신한다며  분야에서도 협력방안을 모색할 수  희망한다고 말했다정의선 회장은 이날 오후 예정된 상파울루대학 카를로스 길베르토 칼리로티 주니어 총장 면담과 관련해 브라질 대학들과의 공동 연구 및 인재 육성을 위해서도 협력해 나갈 것이라고 했다룰라 대통령은 브라질 정부의 세제 개혁과 투자환경 개선 등을 강조하면서 친환경 수소분야와 기술 등에 투자할 현대차는 브라질에서 성장하고  중요한 이라고 말했다 브라질 정부는 년까지 온실가스 배출량을 년 대비  감축하고 년까지 탄소중립을 달성한다는 목표 아래 다각적인 친환경 정책을 펼치고 현대차그룹은 친환경 모빌리티 경쟁이 격화될 브라질 시장에서 전동화 선도 브랜드로 자리매김하는 동시에 현대차그룹의 앞선 수소 기술을 활용한 사업기회를 모색하는 등 브라질 시장에서 새로운 도약을 위한 성장 방안을 적극 추진한다현대차그룹은 구체적으로 년 세계 올해의 차에서 개 부문을 석권한 현대차 아이오닉 와 코나 일렉트릭 등 글로벌 시장에서 호평받고  그룹의 전동화 차량을 투입해 브라질 시장에서 전동화 리더십 강화에 나선다올해 양산 예정인 기아 전용전기차 도 출시하며 브라질 전동화 라인업을 지속 확대한다또한 그린 모빌리티 혁신 프로그램에 대한 대응의 일환으로 브라질 현지에 최적화된 하이브리드 혼합연료차량 전용 파워트레인도 개발 예정이다 하이브리드 는 에탄올 또는 메탄올과 휘발유를 혼합한 연료를 사용하는 에 하이브리드 시스템을 탑재한 친환경 차량이다 현대차그룹은 이와 함께 중남미 지역 재생에너지 시장을 이끌고  브라질을 중심으로 글로벌 수소 네트워크를 중남미까지 확장한다



현대차그룹은 수소 상용차 신시장 개척 및 수소연료전지 시스템 공급 등 신사업을 발굴하고 수소 생태계 조성을 위한 그룹사간 협력 네트워크를 강화해 브라질을 비롯한 중남미 지역에서 수소를 활용한 새로운 사업을 적극 창출한다는 방침이다이를 위해 지난해 말 브라질 현지에 중남미지역 수소사업 전담 조직을 신설하고 수소 시장을 적극 발굴하고 현대차그룹은 수소 밸류체인 전 단계에 걸쳐 다양한 기술 개발 및 지속적인 투자를 이어가며 글로벌 수소 모빌리티 생태계 확산에 앞장서고  지난달 개최된  에서 수소와 소프트웨어로의 대전환를 주제로 수소 사회로의 전환을 앞당길 종합 솔루션을 발표했다현대차그룹은 브라질 지역 사회를 위해 현지에서 진정성  사회공헌 활동을 전개하고 현대차그룹은 만명 이상의 피라시카바시 지역 아동과 치안 공무원을 대상으로 무료 치과 서비스를 제공하는 소리소 시다다오 프로그램을 년간 운영 중이며 피라시카바시 공립학교 학생들에게 과학 기술 및 코딩 수업을 제공하고  또한 열대 우림을 복원하기 위해 아이오닉 포레스트 캠페인 상파울루대학을 비롯한 현지 기관과 공동 연구 등도 진행하고 



정의선 회장이 상파울루대학 온실가스 혁신센터에서 관계자들을 만나 친환경 연구 및 관련 프로젝트에 대한 설명을 듣고 정의선 회장은 이날 룰라 대통령 면담에 이어 카를로스 길베르토 칼리로티 주니어 상파울루대학 총장을 포함한 대학 관계자들을 만나 친환경 분야 인재육성 및 산학협력 방안에 대해서 의견을 나눴다 년 설립된 상파울루대학은 개교 이래 명의 대통령을 배출하는 등 브라질 사회에 크게 기여한 것으로 평가받고 한편 정의선 회장은 일현지시간 타르치시오 드 프레이타스 상파울루주 주지사를 면담한 후 현대차 브라질 공장을 찾아 생산 현장을 둘러보고 중남미 사업 현황과 중장기 친환경 모빌리티 전략 등을 점검할 예정이다'
자동차 주행거리 감축하면 최대 만원 혜택|' 충남도 일부터 자동차 탄소중립포인트제 참여자 선착순 모집



자동차 탄소중립포인트제 포스터헤럴드경제홍성 이권형 충남도는 오는 일부터 자동차 주행거리 감축 실적에 따라 최대 만원의 인센티브를 지급하는 자동차 탄소중립포인트제 참여자 명을 선착순으로 모집한다고 일 밝혔다 대상은 도에 인승 이하 비사업용 승용승합차량을 등록하고  소유주이며 소유주 기준으로 인당 대만 신청할 수  사업용 차량과 친환경차량전기하이브리드수소 등은 신청 대상에서 제외된다 신청은 자동차 탄소중립포인트 누리집에서 회원가입 후 문자로 전송된 링크를 통해 차량전면사진번호판 포함 누적 주행거리가 표시된 계기판 사진을 제출하면 된다다음달 일까지 시군별 선착순으로 접수받으며 마감되지 않은 시군에서는 월 일부터 잔여 차량만큼 추가 신청이 가능하다 충남도 구상 기후환경국장은 차량이 배출하는 온실가스를 줄여 탄소중립을 실현하고 인센티브도 받을 수  자동차 탄소중립포인트제에 도민들의 적극적인 참여를 부탁드린다고 말했다'
정의선 현대차그룹 회장 브라질 룰라 대통령 면담|'일 룰라 대통령과 브라질현대차그룹 포괄적 협력 방안 논의직원과 지역사회를 위한 현대차 브라질 공장의 다양한 노력 소개룰라 대통령 현대차는 브라질에서 성장하고  중요한 일 상파울루 주지사 면담 브라질 공장 방문 중남미 전략 점검 



