title|content
해남군 공모사업으로 년간 억원 확보민선 기 배 성장|'지방재정 확충 및 현안사업 추진 탄력해남군이 최근 년간 공모사업으로만 건 억원을 확보한 것으로 나타났다 특히 민선기가 시작되기 전인 년 건 억원에 불과하던 공모사업은 지난해 건 억원까지 증가하면서 배 이상 늘어났다 일 군에 따르면 지난해 수산양식지자재 클러스터 조성사업억원 어촌신활력증진사업억원 역사문화권 역사문화환경 정비육성 선도사업억원 등 대규모 사업에 잇따라 선정됐다 



해남군청사 또한 올해도 태양광 패널의 재처리 기술 연구개발과 판로개척 등 전주기 지원시설인 탄소중립 클러스터 조성사업억원 친환경 교육체험소비 등 종합 서비스를 제공하는 유기농산업복합서비스 지원단지 조성사업억원 공룡박물관 내에  골격전시물을 활용하여 디지털 영상을 제작하는 문화산업육성지원사업억만원 김치 버무림시설 절임염수 재활용설비 등을 지원하는 김치 생산비 절감 설비 지원시설억만원 등 건 억원을 확보하여 순항을 이어가고  해남군의 이같은 성과는 공모사업을 통해 지방재정의 한계를 벗어나기 위한 세일즈 행정의 결실로 군은 연초 공모사업 대응 역량 강화 워크숍을 시작으로 체계적인 공모사업 대응체계를 구축해 오고  때문인 것으로 풀이되고  군은 년 정부예산안 분석 및 정부의 공모사업 정책방향 교육을 비롯해 공모사업 계획서 작성 등 담당자들의 실무 능력 향상을 위한 프로그램을 진행해 연중 공모사업 추진에 속도를 높이고  명현관 해남군수는 열악한 지방재정 현실속에서 대규모 공모사업의 선정으로 세수확보는 물론 지역 현안 사업의 해결에도 큰 성과를 보이고 며 세수감소에 따라 중앙정부의 예산을 더 확보하는 것이 중요한 과제로 떠오르고  상황에서 민선 기부터 선제적 대응체계를 구축해온 해남군의 모범사례가 좋은 성과로 이어지고 고 말했다'
대창솔루션 계열사 크리오스 억 밸류 기관 펀딩|액화수소 수송탱크 사진대창솔루션  파이낸셜뉴스 코스닥 주강  대창솔루션은 계열사인 액화수소 탱크 전문 크리오스가 억원 밸류로 기관투자자 자금 조달에 성공했다고 일 밝혔다 다수 기관투자자들의 적극적인 참여로 펀딩 규모는 당초 예상보다 큰 억원으로 확대됐다   김대성 크리오스 대표는 케이앤티교보 신기술투자조합을 통해 조달한 억원의 펀딩 자금은 수소경제의 한 축인 운송 및 저장탱크의 수요 확대에 대응하기 위해 액화수소 탱크 전용 신규 공장 건설 등에 적극 활용할 것이라고 밝혔다   크리오스가 국산화에 성공한 액화수소 탱크는 현재 주력 기술인 압축수소에 비해 배 이상의 운송 효율이 예상된다 또 초저온 냉각기술을 앞세워 향후 전개될 수소경제의 핵심적인 운송수단으로 자리매김할 것으로 기대되고    세계 여러 국가들은 온실가스 감축과 탄소중립을 위한 방안 중에서 수소가 큰 축을 담당할 것으로 예상하고 수소 산업이 차세대 경제 패러다임 자리잡을 것이란 확신 하에 투자에 나서고  글로벌 컨설팅기관 딜로이트는 년 글로벌 수소시장 규모를 조달러 규모로 전망하기도 했다   대창솔루션이 년 인수한 크리오스는 국내 액화전연가스 저장탱크 시장 점유율 위를 차지하고  초저온 분야 저장탱크 및 수송탱크 선도이다  및 반도체 차전지 분야의 특수가스 탱크 등을 주력 사업으로 영위하고    회사는 오랜 기간  및 암모니아 등 특수가스 분야에서 쌓은 초저온 기술과 최적의 열전달 차폐 기술을 기반으로 액화수소 탱크의 국산화에 성공하며 본격적인 확대를 앞두고  특히 올해 월 일 하이창원이 국내 첫 번째로 액화수소생산 시설을 준공함에 따라 액화수소를 실어 나르기 위한 액화수소 탱크 트레일러 호기를 하이창원에 납품하기도 했다   회사 관계자는 년 하반기에 증권을 주관사로 선정하는 등 상장 준비에 박차를 가하고  이번 기관 투자자금 유치를 통해 국가전략기술수소운송분야과 벤처금융 억원 이상 투자유치 조건을 모두 충족하게 돼 년 변경된 기술특례 상장요건의 수혜단수평가를 적용 받을 수  것이라고 말했다   한편 지배회사인 대창솔루션은 주강 기술력을 기반으로 주력인 초대형 선박 부품에서 원자력폐기물 컨테이너 해상풍력발전기 고정부품 등으로 사업 다각화 성공했다
경기 광주시 올해 통합바이오가스화시설 설치사업 공모 최종 선정|경기 광주시청 광주시 제공경기 광주시가 환경부의  년 통합바이오가스화시설 설치사업 공모에 최종 선정됐다광주시는 통합바이오가스화시설 사업비 억원 중 국도비 억원국비 억원 도비 억원을 확보했다고 일 밝혔다 이는 광주시에서 추진한 공모사업 중 역대 최대 규모다통합바이오가스화시설은 광주시 곤지암읍 수양리  일대에 추진 중이다 종합 폐기물처 리시설 설치 사업에 포함된 시설로 현재 소각시설 및 생활자원 회수 시설에 대해서는 국비를 확보해 사업 추진 중에 이번 공모에 통합바이오가스화시설 국비를 추가 확보함에 따라 종합 폐기물처리시설의 통합 추진이 가능해졌다 광주시는 통합바이오가스화시설을 통해 유기성 폐자원 일을 처리해 바이오가스를 하루 만 노멀큐빅미터를 생산할 수  됐다 생산된 바이오가스는 화석연료를 대체하고 도시가스 및 전기로 전환할 수  재생에너지 생산을 통한 탄소중립과 순환경제 실현이라는 성과를 가져올 것으로 광주시는 기대하고 지난해 환경부는 유기성 폐자원을 활용한 바이오가스의 생산 및 이용촉진 법이하 바이오가스법을 통해 공공 및 민간에 바이오가스 생산 목표를 부여했다 생산 목표를 달성하지 못할 경우 과징금이 부과된다 이에 전국 지자체가 바이오가스 생산 목표를 달성하기 위한 기반 마련이 시급한 상황이다 광주시는 이번 통합바이오가스화시설 공모에 선정되면서 바이오가스 생산 목표를 달성할 수  됐다방세환 광주시장은 이번 공모 선정으로 유기성 폐자원을 활용한 재생 에너지 생산을 통해 순환 경제 및 탄소중립을 실현할 기반을 마련했다면서 종합폐기물처리시설 설치 사업을 통합 추진해 더욱 속도감  사업을 추진해 나가겠다고 말했다
성남시 자동차 탄소중립 포인트제연간 최대 만원 지급|'월일까지 선착순 모집총 대



성남뉴시스 성남시 자동차 탄소중립 포인트제 참여자 모집 안내문 사진성남시 제공  재판매 및  금지성남뉴시스 신정훈   경기 성남시가  오는 일부터 일까지 자동차 탄소중립 포인트제 참여자를 선착순 모집한다이 제도는 온실가스 감축과 미세먼지 저감을 유도하기 위해 차량의 주행거리 감축 실적에 따라 연간 만원에서 최대 만원의 인센티브를 지급한다대상 차량은 인승 이하 비사업용 승용승합차이며 선착순 총 대다 단 전기 하이브리드 수소차 등 친환경 차량은 제외다참여 차량은 제도 가입일 기준 누적된 하루 평균 주행거리와 참여 기간의 하루 평균 주행거리를 비교 산정한 주행거리 감축률에 따라 연말에 포인트를 차등 지급받는다희망자는 자동차 탄소중립 포인트 홈페이지에서 회원가입을 해야 한다이후 일 이내에 휴대전화로 전송되는 한국환경공단의 문자메시지 링크를 통해 차종과 번호판이 보이는 차량 전면 사진 누적 주행거리가 표시된 계기판 사진을 등록하면 된다등록 사진은 모집 기간에 촬영한 사진이어야 한다한편 성남시는 년부터 이 제도를 운용해 자동차 주행거리를 감축한 명에게 억만원의 인센티브를 지급했다'
광명시 탄소중립형 도시재생에 사회적경제 접목지속가능성|'소하동 더드림 도시재생사업 제로웨이스트 사랑방 운영탄소중립 주민교육 제로웨이스트 물품 제작 등 월부터 시작



광명시청 전경사진제공광명시경기 광명시가 탄소중립형 도시재생이 진행되는 소하동 구도심의 지속가능성을 높이기 위해 사회적경제 분야를 접목한 제로웨이스트 사랑방 사업을 추진한다고 일 밝혔다제로웨이스트 사랑방은 소하동 더드림 도시재생현장지원센터에 마련된 공간이다 지역주민을 대상으로 탄소중립생활 실천을 위한 생태 도예 목공예 체험 업사이클 교육 목공 교육 기후화랑단과 함께하는 탄소중립 실습 제작 교육 등을 올해 말까지 진행한다이를 위해 시는 개 사회적경제과 협력관계를 구축하고 프로그램에 참여할 시민을 월 중 모집할 예정이다 더드림 도시재생사업은 소하동 충현박물관 일대 만에 억만원을 투입해 제로에너지타운 등을 조성하는 사업이다 청소년 기후화랑단 탄소중립 시니어 봉사단 마을정원사 육성 등 탄소중립을 주제로 주민 주도형으로 진행되는 것이 특징이다시는 재활용과 재사용을 통해 폐기물을 없애고 낭비 없는 사회를 목표로 하는 제로웨이스트  가치를 추구하는 사회적경제의 참여를 통해 탄소중립형 도시재생이 한층 탄력을 받을 것으로 기대하고 박승원 광명시장은 사회적 가치 실현을 위해 노력하는 사회적경제과 함께 지속가능한 도시재생사업을 추진하고 모범적인 사례를 발굴해 탄소중립 지역사회로 도약할 수  역량을 집중하겠다고 밝혔다'
남녘 매화 활짝봄 맞이 나선 서울 자치구들|'은평구 노원구 봄 맞이 거리 청소동대문구 도봉구 강북구 등 통학로 및 공사장 안전 점검남녘에는 매화가 한창이다추운 바람도 계절을 이기지 못한다서울 자치구들도 대청소와 통학로 안전 점검에 나서는 등  봄맞이에 한창이다



은평구 일 전역서 봄맞이 대청소김미경 은평구청장 친환경 전기 청소기로 거리 청소 나서 은평구구청장 김미경는 새봄을 맞아 겨우내 쌓인 묵은 때를 청소하기 위해 공무원 공공기관 및 기타 유관기관 등이 함께 새봄맞이 은평구 합동 환경정비 대청소 실시한다새봄맞이 은평구 합동 환경정비 대청소는 일 오전 시부터 은평구 전역에서 진행한다 은평구 공무원들이 솔선수범해 지역 내 유동 인구가 많은 간선도로 전철역 주변 공원 하천 등 공공시설을 청소한다개 동별 청소 구간을 자체 선정해 주택가 취약지역에 쌓인 쓰레기를 수거하고 개학을 맞이한 초중고 통학로 주변 지역을 중점적으로 정비할 예정이다특히 불광천 환경정비를 위해 구청장을 비롯한 치수 공원 청소 환경과 관련된 부서 등 여 명이 연대해 불광천 하상 청소와 주변 쓰레기 수거 도로시설물을 정비한다아울러 생활폐기물 감량 운동인 일 세대  줄이기와 일회용품 줄이기 등 자원순환 탄소중립 환경 캠페인도 동시에 시행해 주민들의 참여와 환경에 대한 인식 전환을 독려할 예정이다



노원구 여명 주민 참석 대청소노원구구청장 오승록가 깨끗한 우리동네 노원의 얼굴입니다라는 슬로건과 함께 여 명이 참여하는 새봄맞이 대청소의 날을 운영한다고 밝혔다구는 기후변화로 이른 봄꽃 소식이 전해지면서 월 시작과 함께 구민과 함께하는 새봄맞이 대청소를 실시한다는 계획이다 지역 내 산과 힐링 명소들을 방문할 방문객들을 맞이하고 구민의 쾌적한 일상생활을 지원하기 위해서다우선 새봄맞이 대청소의 날로 지정된 월 일에는 주민 자율 청소문화 정착을 위한 쓰담운동이 함께 전개된다 플로깅으로 익숙한 쓰담운동은 건강과 환경을 함께 지키기 위해 참여자들이 조깅하며 쓰레기를 줍는 캠페인이다 구는 연중 상시로 쓰담운동을 전개해 청결도시 노원을 위한 문화구민으로서의 공감대 형성을 위해 주민들이 자율적으로 참여할 수  지속해서 독려한다는 방침이다사전 신청한 가족단위 동호회 등이 참여할 수  활동에 필요한 청소도구 및 쓰레기봉투는 주민센터에서 지원한다 참여를 원하는 주민은 거주지 동 주민센터 또는 자원순환과로 방문하거나 유선으로 신청할 수 



동대문구 안전한 통학로 조성 위해 공사장 등 안전 점검 동대문구구청장 이필형는 봄철 개학기를 맞아 안전한 통학로 환경 조성을 위해 학교 주변 건축공사장에 대해 집중 안전점검을 실시한다이번 점검은 통학로를 이용하는 학생들의 안전사고를 예방하기 위한 것으로 오는 일까지 지역 내 학교주변 민간 건축 공사장 개소를 대상으로 실시한다주요 점검내용은 안전가시설가설울타리 등 관리 여부 통학로 주변보도 및 부대시설 관리 안전관리요원 배치 등이며 특히 통학생들의 안전을 위해 공사장 주변 정리정돈 및 주변 보행 위험요소 등을 집중적으로 점검한다구는 점검을 통해 지적된 불편사항을 즉시 시정 학생들이 안전하게 통행할 수  공사장 안전관리에 완벽히 할 예정이다이필형 동대문구청장은 새로운 학기가 시작되는 설렘 가득한 봄이 찾아왔다 학생들과 구민들이 안심하고 거리를 다닐 수  학교 주변을 비롯한 공사장 안전관리에 최선을 다하겠다고 전했다



오언석 도봉구청장 해빙기 안전 점검 나서 안전한 도봉구를 만들기 위해 구청장이 직접 발로 뛰어다니겠습니다지난달 일 오언석 도봉구청장은 해빙기를 맞아 안전사고 발생 위험이 높은 안전취약시설 산사태 우려 지역 등을 찾았다 관련 부서 직원 자율방재단과 함께 나선 이번 점검은 지역 내 공사 현장 등을 확인하고 만일의 안전사고를 예방하기 위해 추진됐다이날 오언석 도봉구청장은 도봉 재개발구역 아파트 공사 현장과 산지방재사업 대상 지역도봉동 을 찾아 안전관리계획 수립 및 시행 여부 공사장 주변 지반 침하 균열 및 인접 건축물 영향 여부 등을 직접 확인했다오 구청장은 공사장 흙막이 변형 토사유출 예방과 비탈다듬기위험수목정비 등 산사태취약지역의 지속적인 점검을 통해 재해로부터 구민의 생명과 재산을 지킬 수  최선을 다해 주시길 바라며 해빙기 이후에도 지속적인 모니터링으로 추가 위험요소를 관리해달라고 직원들에게 당부했다현재 도봉구는 해빙기를 맞아 지역 내 건축공사장 및 재난취약시설 개소에 대한 일제 점검을 실시 중이며 산사태 방지를 위해 우기 전 모든 공사를 끝낸다는 목표로 산사태 예방 공사를 진행하고 



성동구 해빙기 안전 점검 성동구구청장 정원오는 해빙기를 맞아 월 일부터 오는 월 일까지 건설 현장 급경사지 옹벽석축 노후 건축물 등 시설물 개소에 대한 안전 점검을 실시한다해빙기월에는 날씨가 따뜻해지면서 얼어있던 지반이 녹아 시설물 붕괴나 전도 낙석 등 안전사고가 발생할 우려가 큰 시기이다 특히 월 들어 기온이 큰 폭으로 오를 것으로 예상되는 만큼 급격한 온도변화에 따른 사고 예방이 필요하다이에 성동구는 해빙기 안전사고를 막고 위험 요소가 해소될 수  철저한 점검 및 관리에 나선다주요 점검 사항은 굴토 공사장의 지반침하 및 균열 발생 여부 축대옹벽 등의 구조적 변형 사항 급경사지의 절성토부 구간 붕괴 여부 등이다특히 이번 점검에서는 대상을 확대해 공동주택의 석축 공원의 비탈면 등 해빙기 취약 시설에 대해서도 안전 점검을 실시한다 점검 결과 즉시 시정이 가능한 사항은 현장에서 조치하고 그 외 위험 요인에 대해서는 신속하게 보수 및 보강할 예정이다정원오 성동구청장은 최근 들어 해빙기에 폭우가 동반 등 새로운 재난 발생 위험이 커지고  해빙기 취약 시설에 대한 안전 점검을 철저히 하여 구민의 안전을 빈틈없이 지켜나갈 것이라고 말했다



강북구 해빙기 종합안전대책 추진 강북구구청장 이순희가 봄철 해빙기를 맞아 공공시설물 주택건축 가스수방시설 등 대 분야에 대해 오는 월 말까지 년 해빙기 종합대책을 추진하고 구민 안전에 총력을 기울인다구는 도로시설물 파손 가스누출 사고 옹벽 붕괴로 인한 낙석사고 등 봄철 기온 상승에 따라 발생할 수  안전사고를 예방하기 위해 년 해빙기 종합대책울 추진한다이번 종합대책은 시설물 주택건축 가스 수방시설 및 풍수해 취약시설 청소 산불예방 등 대 분야에서 종합적으로 진행된다먼저 구청사 개 동주민센터 및 자치회관 종합사회복지관 공원녹지시설 도로시설물 등 공공시설물에 대해 점검을 실시한다 주요 점검사항은 건물의 구조부 등 손상균열 여부 가스 및 보일러 안전성 여부 각종 시설물 파손 여부 등이다공공 및 동네 체육시설 전통시장 골목형 상점가 어린이집 장애인복지시설 경로당 등 많은 사람이 이용하는 다중이용시설도 점검대상이다 차로 시설물 관리자가 안전점검표에 의한 자체 점검 후 차 담당 공무원이 현장 점검하거나 시설물 관리자와 담당 공무원이 합동 점검하는 등 시설물 상황에 맞춰 점검할 예정이다또 세대 이상 공동주택 개 단지 급경사지도 점검한다 안전진단 등급이하 연립주택과 급경사지는 전문 건축사와 담당 공무원이 합동으로 안전점검을 시행한다 점검결과는 제종 종 시설물은 시설물통합정보관리시스템에 급경사지는 재난관리업무포털에 입력한다이 밖에도 지반침하 붕괴 등 사고 발생위험이 높은 민간건축공사장에 대한 특별점검을 실시한다 서울시 건축안전자문단에 속해있는 외부 전문가와 담당 공무원이 합동해 공사장 해빙기 대비를 위해 요인을 점검하고 점검 결과를 시공사에 통보해 보수보강이 이루어질 수  하고 결함의 정도에 따라 응급조치가 필요한 경우 공사 중지 및 시설물 이용 제한 금지 등 행정 조치가 이루어진다도시가스 공급시설 수방시설 풍수해 취약시설도 해빙기 일제점검을 통해 사고 예방에 총력을 기울인다 특히 하천 빗물펌프장 하수관로 빗물받이 하수맨홀 개 풍수해 취약시설 등은 우기 전까지 정비가 완료될 수  조치한다구는 이번 해빙기 안전점검 기간에 겨울철 장기간 적치된 쓰레기 수거 및 안전사고 발생을 막기 위한 청소시설물차량 점검도 실시한다이순희 강북구청장은 봄철 해빙기에 벌어질 수  각종 사고를 미연에 방지하기 위해 총력을 다하겠다며 구민의 안전을 최우선으로 생각해 각종 정책을 펼치고  구민 여러분께서도 위험 상황을 발견하면 적극적으로 신고해달라고 말했다'
주한영국대사관 이번주 그린위크한영 넷제로 협력 강화|'일까지해상풍력부터 팝까지 여개 행사이 기사는 국내 최대 해외 투자정보 플랫폼 한경 글로벌마켓에 게재된 기사입니다



주한영국대사관이 오는 일까지 그린위크  행사를 연다그린위크는 를 지키자는 목표로 한 여 개 행사로 구성된다 넷제로탄소중립 달성 노력을 가속화해 지구 온도 상승 폭을 섭씨 도로 제한하자는 파리협약의 약속을 실현하자는 취지다올해 그린위크는 재생에너지 원자력 전기차 지속가능 경영 생물다양성 보존 등 여러 이슈에 초점을 두고 진행된다 넷제로 전환에 관련된 한영  간 협력을 촉진하기 위한 제회 한영 해상 풍력 산업 포럼 인터배터리  전시회 영국관 등이 마련돼 정부 간 협력을 촉진하기 위해 영국 정부 고위 인사들도 방한한다 영국 에너지안보탄소중립부의 최고위급 관리인 제레미 포클링턴 차관이 영국 측 수석대표로 참석해 와 한국 산업통상자원부 간 청정에너지 파트너십 이행 관련 고위급 회의를 주재한다 포클링턴 차관은 해양수산부 고위급 인사들과 한국전력 한국수력원자력 현대 오션플랜트 등 한국의 주요  관계자들과도 면담할 예정이다 또 영국 주요 개발금융 기관인 영국국제투자청의 스리니 나가라잔 아시아 담당 상무이사가 기획재정부 녹색기후기금 글로벌녹색성장연구소 등 기관 관계자들과 만나 개발도상국의 기후 회복력을 지원하기 위한 양국 간 협력 방안을 논의할 계획이다대중 행사도 열린다 엔터테인먼트와 함께 주최하는 지속가능한 팝 아이디어톤은 대학생 명을 한데 모아 지속가능한 팝을 만드는 방안에 관한 아이디어를 도출하는 행사다 최재천 교수 제임스 후퍼 박사 등이 출연하는 기후 위기 관련  강연도 유튜브를 통해 생중계할 예정이다그린위크는 기후위기 대응을 위한 한영 협력을 강화하기 위한 노력이라는 설명이다 지난해 월 윤석열 대통령이 영국을 국빈 방문했을 당시 양국은 지속가능하고 안전하며 회복력  미래를 위해 협력하겠다는 내용의 다우닝가 합의를 채택한 바  에는 에너지 전환 협력을 강화하기 위한 청정에너지 파트너십 이행이 포함된다 한국과 영국은 모두 년 탄소 순배출량 제로를 목표로 삼고  콜린 크룩스 주한영국대사는 영국은 지난 년간 주요 개국 중 가장 빠르게 경제를 탈탄소화해 탄소 배출량을  이상 줄였고 주요 경제국 중 최초로 탄소 순배출 제로 목표를 제도화했다며 영국과 한국은 해상 풍력 원자력 자동차 등 분야에서 협력 여지가 크다 그린위크 행사가 양국 간 기후 협력에 탄력을 불어넣는 연료 역할을 할 수  바란다고 말했다'
산청소식군 탄소중립포인트제 자동차 분야 참여자 모집 등|'산청뉴시스 산청군청 재판매 및  금지 재판매 및  금지산청뉴시스 서희원   경남 산청군은 년 탄소중립포인트제 자동차 분야 참여자를 모집한다고 일 밝혔다 수송 부문 온실가스 감축을 위해 마련된 이번 사업은 자동차 주행거리 감축 실적에 따라 최대 만원의 인센티브가 지급된다대상은 인승 이하 비사업용 승용승합자동차로 친환경 차량전기 하이브리드 등 및 법인단체 차량이며 서울시 등록 차량은 제외되며 모집기간은 오는 일까지로 선착순명이다참여 희망자는 탄소중립포인트제 자동차 분야 홈페이지에서 차종 및 번호판 확인이 가능한 전면사진 누적 주행거리 계기판 사진을 등록하면 된다인센티브는 사업 참여 전 하루 평균 주행거리와 참여기간 하루 평균 주행거리를 비교해 주행거리 감축 실적에 따라 오는 월 최대 만원이 지급된다민세식 민종합기술단 대표 산청군고향사랑기부제 만원 기탁



산청뉴시스 산청군청 재판매 및  금지 재판매 및  금지경남 산청군은 민세식 민종합기술단 대표가 고향사랑기부금으로 만원개인 연간 최고 기부액을 기탁했다고 일 밝혔다산청군 금서면 특리 출신인 민세식 대표는 이번 기부금 전달을 비롯해 년 양산시립지역아동센터 어린이 통학 차량 기증 지난해 사천시고향사랑기부금 전달 등 꾸준한 사회 공헌 활동을 펼치고 또 양산에서 민종합기술단을 운영하며 건물 및 토목 엔지니어링 서비스를 제공하고 특히 이번 기부금 기탁을 통해 받은 고향사랑기부금 답례품을 저소득층 사회적 취약계층 지원을 위해 다시 기부하며 선행을 이어갔다한편 고향사랑기부제는 개인이 주소지 외의 지방자치단체에 연간 만원 이하의 금액을 기부하면 세액공제와 함께 최대 의 답례품지역특산물 산청사랑상품권 등을 받는 제도다산청군 세계비만예방의 날 캠페인경남 산청군은 지난 일 세계비만예방의 날 캠페인을 전개했다고 일 밝혔다



