title|content
속초시  대한민국 녹색기후상 우수상 수상|'탄소중립 정책 관광산업 분야 탄소배출 저감 노력 공로 인정



사진속초시청스포츠서울김기원 속초시는 일 국회기후변화포럼 주최 년 대한민국 녹색기후상 시상식에서지방자치단체 부문 우수상을 수상했다고 알렸다올해 회째를 맞이하는 대한민국 녹색기후상은 범국민적 기후변화 대응과 지속가능한 탄소중립 사회 추진에 공로가 큰 단체를 격려하고 모범 사례를 확산하기 위해 년 제정된 국내 최초의 기후변화 종합시상으로 자치외교언론 등 개 분야에서 공로가 큰 단체와 개인의 활동을 시상한다



사진속초시청속초시는 이번 공모에서 과 업무협약을 통한 민관 탄소중립 사업 추진을 비롯하여 국내외 전문가 간담회 시민과 함께하는 탄소중립 정책 관광산업 분야 탄소배출 저감 노력과 소액 탄소배출권 자발적 거래 활성화 노력 등 다양하고 창의적인 사업을 추진한 점을 우수하게 평가받았다한편 속초시는 지난해 다양한 사업을 통한 온실가스 저감 노력의 공로를 인정받아 환경부로부터 탄소중립포인트제 활성화 최우수 지차체로 선정되어 현판과 표창을 수여받은 바 



사진속초시청이병선 속초시장은 시상식에서 속초시의 녹색기후상 수상은 지속가능한 미래도시 년을 준비하기 위해 모든 시민이 열심히 힘을 합친 결과라며 앞으로도 시민과 함께하는 지속가능한 녹색도시 탄소중립 선도 도시로 거듭나도록 최선을 다하겠다고 말했다'
광명시광명시민전력협동조합 재생에너지 보급과 기금 조성 업무협약 체결|'시민이 생산한 태양광 에너지 수익금 기후대응기금으로 적립박승원 시장 탄소중립 선순환 구조 모범 사례 적극 지원할 것



광명시와 광명시민전력협동조합은 일 시청에서 재생에너지 보급과 기금 조성을 위한 업무협약을 체결했다광명시 제공데일리안  김명승  광명시민의 투자로 생산된 태양광 전력 판매 수익금 일부가 광명시 기후대응기금으로 조성된다광명시는 일 시청 영상회의실에서 광명시민전력협동조합이사장 전형근과 재생에너지 보급과 기금 조성을 위한 업무협약을 체결했다이번 협약에 따라 시는 공공시설물 옥상 및 유휴부지를 임대하고 기후에너지센터를 통해 시민 참여형 재생에너지 보급확대를 위한 행정적인 지원을 강화한다조합은 태양광발전소 건립 후 운영과 유지관리를 위해 노력하고 발전사업에 따른 수익 일부를 오는 년까지 광명시 기후대응기금에 기부한다광명시민전력협동조합은 공유플랫폼 기반 시민주도형 그린뉴딜 사업 추진을 목적으로 지난 년 광명시에서 두 번째로 설립된 에너지 분야 시민참여형 협동조합이다시민들은 출자를 통해 조합원으로 참여하고 조합은 유휴 옥상 등에 구축한 여러 개의 태양광발전소를 플랫폼 형태로 연결하여 하나의 발전소처럼 운영한다조합은 현재 이 사업을 통해 재활용품선별장호기 국민체육센터호기 보건소호기 시립노인요양센터호기에 태양광발전소를 구축하여 운영하고  기의 태양광발전소에서 연간 만  전기를 생산하고 광명시 기후대응기금은 기후위기 대응 사업 재원과 체계적인 지원 제도를 마련하고 안정적 탄소중립 정책 추진을 위한 것으로 지난 년 월 경기도 지자체 최초로 관련 조례를 별도 제정했다박승원 광명시장은 광명시민이 참여해서 만드는 태양광발전소는 민관 협력 탄소중립 정책의 대표 사례로 이번 협약을 통해 재생에너지 시설이 확대되길 기대한다며 발전 수익이 탄소중립 정책에 재투자되어 탄소중립 선순환 구조를 구축하는 모범 사례가 될 것이라고 밝혔다전형근 이사장은 공유플랫폼 기반 시민주도형 그린뉴딜 사업을 통해 구축된 발전소가 안정적으로 잘 운영되고 며 추가 발전소 건립 부지 발굴에 시의 지속적인 협조와 협력을 기대한다고 말했다한편 조합은 태양광발전소 추가 구축을 목표로 광명시 기후에너지센터와 협력하여 부지를 발굴 중이며 조합원과 함께 할 수  기후위기 대응 활동을 확대하고 에너지 취약계층에 대한 사회공헌사업을 계획하고 '
동서발전 김해형 태양광 프로젝트 추진업무협약 체결|'김해시교보리얼코경남에너지 등과 김해시 에너지 자립률 높일 것으로 기대



세종뉴시스이승주   한국동서발전이 태양광 사업부지를 산업단지에서 전체 유휴부지로 확장해 김해시 에너지 자립률을 높이는 김해형 태양광 프로젝트를 추진한다고 일 밝혔다동서발전은 전날 경남 김해시청에서 김해시와 교보리얼코 경남에너지 그랜드썬과 업무협약을 체결했다 김해형 태양광 프로젝트는 임대형과 공익형 투자수익창출형 자가소비형 등 참여기관들의 주력사업을 활용해 다양한 태양광 설치부지 소유주의 수요를 고려한 태양광 보급 사업이다 앞서 동서발전과 김해시는 지난 년 월 산업단지 탄소중립 달성과 태양광 보급확대를 위한 업무협약을 체결했으며 이후 김해 산업단지 내 지붕태양광 사업을 추진해왔다 이영찬 동서발전 사업본부장은 김해시는 산단 등 태양광 설치가 가능한 부지가 풍부하고 주변 지역으로 전력공급을 위한 계통용량에 여유가  태양광 사업 추진의 잠재력이 높은 도시라며 김해형 태양광 프로젝트로 김해시의 친환경에너지 생산과 지역경제 활성화에 기여하겠다고 말했다'
