title|content
현대차그룹 정의선 회장이 일현지시간 브라질 브라질리아 대통령 집무실에서 루이스 이나시우 룰라 다 시우바     브라질 대통령을 만나 브라질과 현대차그룹 간 포괄적 협력 방안에 대해 논의했다 정의선 회장 오른쪽이 룰라 대통령가운데 제랄도 알크민 브라질 부통령왼쪽을 만나  비전 고성능 수소 하이브리드 롤링랩 모형을 들고 기념 촬영을 하고  사진  브라질 정부 제공현대자동차그룹 정의선 회장이 중남미 최대 경제국인 브라질을 방문해 루이스 이나시우 룰라 다 시우바     브라질 대통령과 면담했다   브라질에는 현대차그룹의 유일한 중남미 생산거점이며 중남미 시장 공략의 첨병인 현대차 브라질 법인과 중남미 권역본부가 위치해    일현지시간 브라질 브라질리아 대통령 집무실에서 진행된 룰라 대통령과 정의선 회장의 면담에는 제랄도 알크민  브라질 부통령 겸 산업통상자원부 장관 현대차 호세 무뇨스 사장 등이 동석했다   룰라 대통령은 년 브라질 금속노조 위원장에 선출되며 본격적인 사회활동을 시작했고 지난 년 대선에서 승리해 브라질 역사상 최초의 선 대통령으로 취임했다   정의선 회장은 현대차 브라질 공장에 대한 브라질 정부의 지속적인 관심과 지원에 감사를 표하며 직원과 지역사회를 위한 현대차 브라질 공장의 다양한 노력을 소개했다   정 회장은 현대차그룹은 단순히 자동차 판매뿐만 아니라 브라질과 함께 동반 성장해 나가고자 한다며 무료 치과치료 재식림 프로그램 등 브라질 지역사회를 위한 다양한 사회공헌 활동을 수행하고 고 말했다 이어 근로자들의 행복을 최우선하는 현대차 브라질 공장은 안전한 작업 환경을 조성했고 노사합동 세미나 및 간담회 등을 정기적으로 시행하며 년 연속 임금협상 무분규 타결을 이끌어 냈다고 밝혔다   직원 친화적인 제도가 자리잡으며 현대차 브라질 공장은 상파울루주 고용노동관계국에서 수여하는 양질의 일자리 우수  인증을 받았다   정의선 회장은 브라질 정부의 탈탄소 정책에 대해 친환경 에너지원을 연구하고 발전 적용시키기 위한 브라질 정부의 노력을 잘 알고 며 브라질 정부의 다양한 친환경 정책에 깊은 공감을 나타내고 수소 및 친환경 모빌리티 분야에서 현대차그룹이 기여할 부분이  적극 참여하겠다고 말했다 또한 현대차 브라질 법인과 현지 파트너사들이 수소 등 친환경 분야 미래기술 등에 년까지 억달러를 투자할 계획이라고 밝혔다   브라질은 지난해 월 브라질 탈탄소 부문에 투자하는 자동차 제조업체들에게 총 억헤알약 조억원 규모의 감세 및 보조금 혜택을 부여하는 그린 모빌리티 혁신 프로그램을 발표했고 글로벌 완성차 업체들의 브라질 투자계획이 잇따르고    정 회장은 현대차그룹이 미래 모빌리티 리더십 확보의 일환으로 시장 확대 및 기술 경쟁력 우위 확보를 추진중인    미래 항공 모빌리티과 안정적인 발전원으로 현대차그룹이 개발에 박차를 가하고     소형모듈원전에 대해서도 설명했다   이날 오후 예정된 상파울루대학 카를로스 길베르토 칼리로티 주니어    총장 면담과 관련해 브라질 대학들과의 공동 연구 및 인재 육성을 위해서도 협력해 나갈 것이라고 밝혔다   룰라 대통령은 브라질 정부의 세제 개혁과 투자환경 개선 등을 강조하면서 친환경 수소분야와 기술 등에 투자할 현대차는 브라질에서 성장하고  중요한 이라고 말했다 브라질 정부는 년까지 온실가스 배출량을 년 대비  감축하고 년까지 탄소중립을 달성한다는 목표 아래 다각적인 친환경 정책을 펼치고    현대차그룹은 올해 양산 예정인 기아 전용전기차 도 출시하며 브라질 전동화 라인업을 지속 확대한다 또한 그린 모빌리티 혁신 프로그램에 대한 대응의 일환으로 브라질 현지에 최적화된 하이브리드 혼합연료차량 전용 파워트레인도 개발 예정이다   이와 함께 중남미 지역 재생에너지 시장을 이끌고  브라질을 중심으로 글로벌 수소 네트워크를 중남미까지 확장한다 수소 상용차 신시장 개척 및 수소연료전지 시스템 공급 등 신사업을 발굴하고 수소 생태계 조성을 위한 그룹사간 협력 네트워크를 강화해 브라질을 비롯한 중남미 지역에서 수소를 활용한 새로운 사업을 적극 창출한다는 방침이다   이를 위해 지난해 말 브라질 현지에 중남미지역 수소사업 전담 조직을 신설하고 수소 시장을 적극 발굴하고    현대차그룹은 수소 밸류체인 전 단계에 걸쳐 다양한 기술 개발 및 지속적인 투자를 이어가며 글로벌 수소 모빌리티 생태계 확산에 앞장서고  지난달 개최된  에서 수소와 소프트웨어로의 대전환    를 주제로 수소 사회로의 전환을 앞당길 종합 솔루션을 발표했다   이와 함께 현대차그룹은 미래 모빌리티 리더십 확보를 위해  기술 내재화 및 시장 생태계 구축에 속도를 내고  미국에  독립법인 슈퍼널을 설립해 운영 중이며  에서는 년 상용화를 목표로 개발 중인 차세대  기체 의 실물 모형을 선보였다   차세대 미래 에너지로 주목받고   분야에서도 독자 기술력 확보와 사업화에 나서고  특히 미국의 원전 전문인 홀텍 인터내셔널과 손잡고 미국의 첫 상용화  설계에 참여 중이다   현대차그룹은 브라질 지역 사회를 위해 현지에서 진정성  사회공헌 활동을 전개하고  만명 이상의 피라시카바시 지역 아동과 치안 공무원을 대상으로 무료 치과 서비스를 제공하는 소리소 시다다오  프로그램을 년간 운영 중이며 피라시카바시 공립학교 학생들에게 과학 기술 및 코딩 수업을 제공하고  또한 열대 우림을 복원하기 위해 아이오닉 포레스트 캠페인 상파울루대학을 비롯한 현지 기관과 공동 연구 등도 진행하고    정 회장은 이날 룰라 대통령 면담에 이어 카를로스 길베르토 칼리로티 주니어 상파울루대학 총장을 포함한 대학 관계자들을 만나 친환경 분야 인재육성 및 산학협력 방안에 대해서 의견을 나눴다 년 설립된 상파울루대학은 개교 이래 명의 대통령을 배출하는 등 브라질 사회에 크게 기여한 것으로 평가받고    정 회장은 일현지시간에는 타르치시오 드 프레이타스   상파울루주 주지사를 면담한 후 현대차 브라질 공장을 찾아 생산 현장을 둘러보고 중남미 사업 현황과 중장기 친환경 모빌리티 전략 등을 점검할 예정이다'
정의선 현대자동차그룹 회장 중남미 경제국 브라질  시장 투자한다|'현대차그룹이 맞춤형 친환경차 개발 추진 및 중남미 수소사업 조직 신설 시장 발굴에 나선다



일현지시간 정의선 회장사진 오른쪽이 룰라 대통령사진 가운데 제랄도 알크민 브라질 부통령사진 왼쪽을 만나 비전고성능 수소 하이브리드 롤링랩 모형을 들고 기념 촬영을 하고 현대자동차그룹 정의선 회장이 중남미 최대 경제국인 브라질을 방문해 루이스 이나시우 룰라 다 시우바 브라질 대통령과 면담했다브라질에는 현대차그룹의 유일한 중남미 생산거점이며 중남미 시장 공략의 첨병인 현대차 브라질 법인과 중남미 권역본부가 위치해 지난 일현지시간 브라질 브라질리아 대통령 집무실에서 진행된 룰라 대통령과 정의선 회장의 면담에는 제랄도 알크민 브라질 부통령 겸 산업통상자원부 장관 현대차 호세 무뇨스 사장 등이 동석했다룰라 대통령은 년 브라질 금속노조 위원장에 선출되며 본격적인 사회활동을 시작했고 지난 년 대선에서 승리해 브라질 역사상 최초의 선 대통령으로 취임했다정의선 회장은 우선 현대차 브라질 공장에 대한 브라질 정부의 지속적인 관심과 지원에 감사를 표하며 직원과 지역사회를 위한 현대차 브라질 공장의 다양한 노력을 소개했다



정의선 회장은 현대차그룹은 단순히 자동차 판매뿐만 아니라 브라질과 함께 동반 성장해 나가고자 한다며 무료 치과치료 재식림 프로그램 등 브라질 지역사회를 위한 다양한 사회공헌 활동을 수행하고 고 말했다이어 정 회장은 근로자들의 행복을 최우선하는 현대차 브라질 공장은 안전한 작업 환경을 조성했고 노사합동 세미나 및 간담회 등을 정기적으로 시행하며 년 연속 임금협상 무분규 타결을 이끌어 냈다고 밝혔다직원 친화적인 제도가 자리잡으며 현대차 브라질 공장은 상파울루주 고용노동관계국에서 수여하는 양질의 일자리 우수  인증을 받았다



정의선 회장은 브라질 정부의 탈탄소 정책에 대해 친환경 에너지원을 연구하고 발전 적용시키기 위한 브라질 정부의 노력을 잘 알고 며 브라질 정부의 다양한 친환경 정책에 깊은 공감을 나타내고 수소 및 친환경 모빌리티 분야에서 현대차그룹이 기여할 부분이  적극 참여하겠다고 말했다정의선 회장은 현대차 브라질 법인과 현지 파트너사들이 수소 등 친환경 분야 미래기술 등에 년까지 억달러를 투자할 계획이라고 밝혔다브라질은 지난해 월 브라질 탈탄소 부문에 투자하는 자동차 제조업체들에게 총 억헤알약 조억원 규모의 감세 및 보조금 혜택을 부여하는 그린 모빌리티 혁신 프로그램을 발표했고 글로벌 완성차 업체들의 브라질 투자계획이 잇따르고 정 회장은 현대차그룹은 탄소배출 제로 달성을 위해 전기차 수소차를 아우르는 빠른 전동화 전략을 추진중이며 수소 에너지는 기후변화 대응의 핵심 수단이자 전동화를 보완하는 중요한 자원이라고 언급했다이와 함께 현대차그룹이 미래 모빌리티 리더십 확보의 일환으로 시장 확대 및 기술 경쟁력 우위 확보를 추진중인    미래 항공 모빌리티과 안정적인 발전원으로 현대차그룹이 개발에 박차를 가하고     소형모듈원전에 대해 설명했다정 회장은 이 브라질 교통환경에도 적합한 미래의 교통수단이라고 확신하며  분야에서도 협력방안을 모색할 수  희망한다고 말했다정 회장은 이날 오후 예정된 상파울루대학 카를로스 길베르토 칼리로티 주니어 총장 면담과 관련해 브라질 대학들과의 공동 연구 및 인재 육성을 위해서도 협력해 나갈 것이라고 밝혔다룰라 대통령은 브라질 정부의 세제 개혁과 투자환경 개선 등을 강조하면서 친환경 수소분야와 기술 등에 투자할 현대차는 브라질에서 성장하고  중요한 이라고 말했다브라질 정부는 년까지 온실가스 배출량을 년 대비  감축하고 년까지 탄소중립을 달성한다는 목표 아래 다각적인 친환경 정책을 펼치고 현대차그룹은 친환경 모빌리티 경쟁이 격화될 브라질 시장에서 전동화 선도 브랜드로 자리매김하는 동시에 현대차그룹의 앞선 수소 기술을 활용한 사업기회를 모색하는 등 브라질 시장에서 새로운 도약을 위한 성장 방안을 적극 추진한다현대차그룹은 구체적으로 년 세계 올해의 차에서 개 부문을 석권한 현대차 아이오닉 와 코나 일렉트릭 등 글로벌 시장에서 호평받고  그룹의 전동화 차량을 투입해 브라질 시장에서 전동화 리더십 강화에 나선다올해 양산 예정인 기아 전용전기차 도 출시하며 브라질 전동화 라인업을 지속 확대한다또한 그린 모빌리티 혁신 프로그램에 대한 대응의 일환으로 브라질 현지에 최적화된 하이브리드 혼합연료차량 전용 파워트레인도 개발 예정이다현대차그룹은 이와 함께 중남미 지역 재생에너지 시장을 이끌고  브라질을 중심으로 글로벌 수소 네트워크를 중남미까지 확장한다현대차그룹은 수소 상용차 신시장 개척 및 수소연료전지 시스템 공급 등 신사업을 발굴하고 수소 생태계 조성을 위한 그룹사간 협력 네트워크를 강화해 브라질을 비롯한 중남미 지역에서 수소를 활용한 새로운 사업을 적극 창출한다는 방침이다이를 위해 지난해 말 브라질 현지에 중남미지역 수소사업 전담 조직을 신설하고 수소 시장을 적극 발굴하고 현대차그룹은 수소 밸류체인 전 단계에 걸쳐 다양한 기술 개발 및 지속적인 투자를 이어가며 글로벌 수소 모빌리티 생태계 확산에 앞장서고  지난달 개최된  에서 수소와 소프트웨어로의 대전환    를 주제로 수소 사회로의 전환을 앞당길 종합 솔루션을 발표했다이와 함께 현대차그룹은 미래 모빌리티 리더십 확보를 위해  기술 내재화 및 시장 생태계 구축에 속도를 내고  미국에  독립법인 슈퍼널을 설립해 운영 중이며  에서는 년 상용화를 목표로 개발 중인 차세대  기체 의 실물 모형을 선보였다차세대 미래 에너지로 주목받고   분야에서도 독자 기술력 확보와 사업화에 나서고  특히 미국의 원전 전문인 홀텍 인터내셔널과 손잡고 미국의 첫 상용화  설계에 참여 중이다현대차그룹은 브라질 지역 사회를 위해 현지에서 진정성  사회공헌 활동을 전개하고 현대차그룹은 만명 이상의 피라시카바시 지역 아동과 치안 공무원을 대상으로 무료 치과 서비스를 제공하는 소리소 시다다오  프로그램을 년간 운영 중이며 피라시카바시 공립학교 학생들에게 과학 기술 및 코딩 수업을 제공하고 또한 열대 우림을 복원하기 위해 아이오닉 포레스트 캠페인 상파울루대학을 비롯한 현지 기관과 공동 연구 등도 진행하고 정의선 회장은 이날 룰라 대통령 면담에 이어 카를로스 길베르토 칼리로티 주니어 상파울루대학 총장을 포함한 대학 관계자들을 만나 친환경 분야 인재육성 및 산학협력 방안에 대해서 의견을 나눴다정의선 회장은 현대차그룹은 수소 에너지를 통해 에너지 불평등을 해소하고 수소 사회로의 전환을 앞당기고자 한다면서 다양한 친환경 분야에서 높은 수준의 경쟁력을 보유한 상파울루대학과의 긴밀한 협력을 통해 브라질의 청정 에너지 시장을 선도하기를 기대한다고 강조했다년 설립된 상파울루대학은 개교 이래 명의 대통령을 배출하는 등 브라질 사회에 크게 기여한 것으로 평가받고 특히 년 온실가스 혁신센터를 설립해 세대 에탄올을 활용한 수소 생산을 비롯해 온실 가스 감축 바이오 에너지 활용 탄소 포집저장 기술을 망라하는 다양한 친환경 관련 연구와 프로젝트를 진행하고  지난해엔 미국 조지아공대 총장 베트남 하노이국립대 총장 등과 면담을 갖고 미래기술 확보 해외 우수인재 육성 및 발굴 신사업 분야 산학협력을 논의했다손재철  '
삼성물산 자체 보유 콘크리트 기술로 탄소감축 방법론 공식인증 획득|삼성물산 건설부문이 저탄소 콘크리트 제조와 현장 적용 과정에서 탄소감축 효과를 객관적으로 측정하는 방법 등에 대한 기준과 절차가 담긴 방법론탄소저감 콘크리트 방법론을 개발해 탄소감축인증센터로부터 공식 인증 받았다삼성물산데일리안  배수람  삼성물산 건설부문이 저탄소 콘크리트 제조와 현장 적용 과정에서 탄소감축 효과를 객관적으로 측정하는 방법 등에 대한 기준과 절차가 담긴 방법론탄소저감 콘크리트 방법론을 개발해 탄소감축인증센터로부터 공식 인증 받았다탄소저감 콘크리트 방법론은 콘크리트 제조과정에서 탄소를 줄일 수  원리를 비롯해 감축량을 산정하는 방식 현장 적용 시 모니터링 절차 등 탄소감축과 관련된 일련의 검증 절차를 규정한 것이다삼성물산은 자발적 탄소시장을 운영 중인 대한상공회의소 탄소감축인증센터로부터 국내 건설업계 최초로 인증 받으며 친환경 경영 선도임을 객관적으로 증명했다 설명이다시멘트가 주원료인 콘크리트는 건설의 핵심 자재이지만 제조과정에서 많은 양의 이산화탄소를 배출하는 온실가스의 주요 원인으로 인식되고  건설업계에서는 탄소배출을 대폭 줄인 다양한 저탄소 콘크리트 개발에 나서고 삼성물산은 일반 콘크리트 대비 탄소배출량을 약  낮춘 저탄소  를 개발해 래미안 현장반포주공단지 주구에 도입 중에  최근에는 시멘트를 전혀 사용하지 않아 탄소배출량이 약  낮아지는 제로 시멘트 보도블록을 개발하는 등 다양한 탄소저감 건설 신기술 개발과 현장 적용을 선도하고 해당 기술 적용을 통해 일반 콘크리트 대비 당 톤의 추가적 탄소감축 효과가 발생할 것으로 전망되며 탄소중립을 실현하기 위한 탄소배출권을 확보할 수  기반을 마련했다는데 큰 의의가 이러한 측면에서 삼성물산이 해당 기술로 승인받은 탄소감축 방법론은 공신력  탄소감축 효과로 최근 이슈되고  그린워싱에 대한 우려를 불식시킬 뿐만 아니라 건설업 전반의 탄소저감 재료 사용과 국가 온실가스 감축에 큰 역할을 할 것으로 보인다태성호 한양대 탄소중립스마트건축센터장 교수는 시멘트 대체재료의 정책적 유인 동기가 부족한 상황에서 삼성물산의 탄소감축 방법론 승인은 건축 재료의 탈탄소화 측면에서 의미가 크다고 말했다정호진 삼성물산 품질실장부사장은 이번 승인을 통해 일회성이 아닌 지속 가능한 탄소감축 방법론에 대해 공식 인증받았다는 데 큰 의미가  이를 통해 당사 기술에 대한 신뢰도 향상은 물론 향후 국내외 다양한 친환경 사업에 긍정적인 효과로 이어지길 기대한다고 밝혔다이 밖에도 삼성물산은 탄소저감 콘크리트 기술 개발과 적용을 비롯해  탄소중립 달성을 위한 재생에너지 사용 비율 확대 탄소 저감 기술  투자 확대 등 친환경 경영에 앞장서고 
정의선 브라질 룰라 만나 세일즈조천억원 투자|'룰라 대통령 만나 직접 세일즈친환경미래기술 억달러 투자 그린 모빌리티 혁신 참여 의지



일현지시간 정의선 회장사진 오른쪽이 룰라 대통령사진 가운데 제랄도 알크민 브라질 부통령사진 왼쪽을 만나  비전 고성능 수소 하이브리드 롤링랩 모형을 들고 기념 촬영을 하고 브라질 정부 제공정의선 현대차그룹 회장이 룰라 브라질 대통령을 만나 수소 등 친환경 모빌리티와 미래기술 등에 억달러조억원 투자하겠다고 전했다 그린 모빌리티 혁신을 추진하고  브라질 정부를 상대로 정 회장이 직접 적극적인 세일즈에 나선 것이다정 회장은 현지시간으로 일 브라질 브라질리아의 대통령 집무실에서 루이스 이나시우 룰라 다 시우바     브라질 대통령과 면담했다중남미 최대 경제국인 브라질에는 현대차 브라질 법인과 중남미 권역본부가  현대차그룹의 유일한 중남미 생산거점이기도 하다브라질 정부는 년까지 온실가스 배출량을 년 대비  감축하고 년까지 탄소중립을 달성한다는 목표를 세웠다 지난해 억헤알약 조억원 규모의 감세 및 보조금 혜택을 부여하는 그린 모빌리티 혁신 프로그램을 발표하기도 했다정 회장은 친환경 에너지원을 연구하고 발전 적용시키기 위한 브라질 정부의 노력을 잘 알고 며 수소 및 친환경 모빌리티 분야에서 현대차그룹이 기여할 부분이  적극 참여하겠다고 말했다그러면서 현대차 브라질 법인과 현지 파트너사들이 수소 등 친환경 분야 미래기술 등에 년까지 억달러를 투자할 계획이라고 밝혔다정 회장은 현대차그룹은 탄소배출 제로 달성을 위해 전기차 수소차를 아우르는 빠른 전동화 전략을 추진중이며 수소 에너지는 기후변화 대응의 핵심 수단이자 전동화를 보완하는 중요한 자원이라고 전하기도 했다룰라 대통령도 브라질 정부의 세제 개혁과 투자환경 개선 등을 강조하면서 친환경 수소분야와 기술 등에 투자할 현대차는 브라질에서 성장하고  중요한 이라고 화답했다



룰라 대통령사진 오른쪽이 정의선 회장사진 왼쪽의 발언을 경청하고 현대차 제공현대차그룹은 아이오닉와 코나 일렉트릭 등 전기차를 브라질 시장에 투입하고 올해 양산 예정인 기아 도 출시해 브라질 전동화 라인업을 확대할 계획이다 또 브라질 현지에 최적화된 하이브리드 혼합연료차량 전용 파워트레인도 개발 예정이다또 글로벌 수소 네트워크를 브라질을 중심으로 중남미까지 확장할 계획이다 지난해 말 브라질에 중남미지역 수소사업 전담 조직을 신설했다정 회장은 미래 항공 모빌리티   과 소형모듈원전   에 대해서도 설명했다 이 브라질 교통환경에도 적합한 미래의 교통수단이라고 확신하며  분야에서도 협력방안을 모색할 수  희망한다고 전했다



정의선 회장사진 왼쪽에서 두 번째이 룰라 대통령 사진 왼쪽에서 세 번째 제랄도 알크민 부통령사진 왼쪽에서 네 번째 등 브라질 정부 관계자들과 면담하고 현대차그룹 제공정 회장은 룰라 대통령 면담에 이어 카를로스 길베르토 칼리로티 주니어 상파울루대학 총장을 포함한 대학 관계자들을 만나 친환경 분야 인재육성 및 산학협력 방안에 대해서 의견을 나눴다정 회장은 현대차그룹은 수소 에너지를 통해 에너지 불평등을 해소하고 수소 사회로의 전환을 앞당기고자 한다면서 다양한 친환경 분야에서 높은 수준의 경쟁력을 보유한 상파울루대학과의 긴밀한 협력을 통해 브라질의 청정 에너지 시장을 선도하기를 기대한다고 강조했다년 설립된 상파울루대학은 개교 이래 명의 대통령을 배출하는 등 브라질 사회에 크게 기여한 것으로 평가받고  특히 년 온실가스 혁신센터를 설립해 세대 에탄올을 활용한 수소 생산을 비롯해 온실 가스 감축 바이오 에너지 활용 탄소 포집저장 기술을 망라하는 다양한 친환경 관련 연구와 프로젝트를 진행하고 정 회장은 일현지시간 타르치시오 드 프레이타스   상파울루주 주지사를 면담한 뒤 현대차 브라질 공장을 찾아 생산 현장을 둘러보고 중남미 사업 현황과 중장기 친환경 모빌리티 전략 등을 점검할 예정이다'
현대차그룹 브라질에 조 투자|'넘어 친환경모빌리티 동반성장정의선 회장 룰라 대통령과 면담브라질현대차 포괄적 협력 논의



