title|content
글로벌  특위 출범글로벌  전략지도 등 심의|과기정통부 로고글로벌 연구개발의 체계적 추진 관리를 위한 국가과학기술자문회의 산하 글로벌  특별위원회가 출범했다 특위는 첫 회의에서 이차전지 등 기술 분야에 대한 글로벌  전략지도 심의를 시작으로 글로벌  전략 고도화에 본격 착수한다과학기술정보통신부는 일 국가과학기술자문회의 산하 글로벌  특별위원회 제회 회의를 개최했다특위는 글로벌  정책사업의 종합조정 글로벌  전략 고도화 체계적인 사업 운영관리 등에 대한 범부처 컨트롤타워 역할을 한다과학기술혁신본부장이 위원장을 맡으며 국제 공동연구 활성화 및 전략적 투자협력을 위해 과기정통부 기재부 외교부 산업부 복지부 등 관련 주요 부처 실장급 공무원 명이 정부위원으로 참여한다또 국제협력 경험과 우수한 연구실적을 보유한 국내외 석학을 비롯해 지식재산권 기술이전 국제협력 정책 등 다양한 분야별 전문성을 갖춘 산학연 전문가 명이 민간위원으로 참여해 총 인으로 구성됐다특위는 이날 첫 회의에서 글로벌  추진전략 및 이행계획과 국가  사업 국제 공동연구 매뉴얼에 대한 보고를 받고 글로벌  전략지도를 심의했다특위는 대 국가전략기술 중 이차전지 대 탄소중립기술 중 수소공급 무탄소신전원 이산화탄소 포집활용저장 등 총 개 기술 분야에 대한 글로벌  전략지도를 심의했다글로벌  전략지도는 글로벌 기술 수준 지도와 기술 유형별 협력전략 지도 두 가지 단계로 나눠진다이차전지 분야는 리튬이온전지 및 핵심 소재 차세대 이차전지 소재셀 이차전지 모듈시스템 이차전지 재사용재활용 가지 세부 기술을 기준으로 수립했다 기술 유형별 협력전략 지도에서는 리튬이온전지 및 핵심 소재와 이차전지 모듈시스템은 시장 주도형 협력 유형으로 차세대 이차전지 소재셀 이차전지 재사용재활용은 신기술 확산형 협력 유형으로 분류했다수소공급은 수소 생산수전해 시스템과 해외수소 저장운송 분야는 시장 추격형 협력 유형 수소 저장운송은 시장 주도형 협력 유형 수소 생산 중 차세대 수소 생산은 신기술 확보형 협력 유형 수소 생산 중 차세대 수소 생산은 신기술 확산형 협력 유형으로 분류했다 협력 대상 후보국은 독일영국네덜란드미국 등이다무탄소 신전원 분야의 기술 유형별 협력전략 지도에서는 발전용 수소 연료전지 중 열병합 시스템과 수소 혼소전소를 시장 주도형 협력 유형으로 발전용 수소 연료전지 중 복합발전은 신기술 확보형 협력 유형 암모니아 혼소는 신기술 확산형 협력 유형으로 분류했다 일본영국미국 등 국가를 대상으로 대형 실증 사업 공동 추진 연구시설 공동 활용 등 협력 전략이 제시됐다글로벌  전략지도는 대 국가전략기술과 대 탄소중립기술을 대상으로 지속 수립할 예정으로 글로벌  사업 기획추진을 위한 범부처 가이드로 활용할 계획이다류광준 과기혁신본부장은 신설된 글로벌  특위를 통해 효율적으로 전략을 수립하는 한편 우수 해외 연구기관과 교류 활성화를 통해 우리 연구자 역량을 더욱 극대화해 나갈 것이라고 말했다
글로벌 강화 본격화범부처 컨트롤타워 출범|'일 첫 회의 글로벌  전략지도 심의



글로벌  체계 개편 방향 과학기술정보통신부 제공   과학기술정보통신부가 범부처 컨트롤타워를 구축하고 글로벌 연구개발 사업을 본격화한다   과기정통부는 일 국가과학기술자문회의 산하 글로벌  특별위원회 제회 회의를 개최했다고 밝혔다    이날 회의에서는 글로벌 의 본격적인 출발을 위한 정책으로 글로벌 특별위원회 운영방안 및 운영세칙 글로벌  추진전략 및 이행계획 국가연구개발사업 국제공동연구 매뉴얼 글로벌  전략지도이차전지 수소공급 무탄소신전원  분야 등 총 건의 안건을 상정해 심의 및 보고했다  특별위원회는 글로벌  주요 정책과 사업 등을 종합조정 및 관리한다 국제공동연구 인력교류 거점센터 구축활용 등에 관한 범부처 컨트롤타워 역할을 수행한다   과학기술혁신본부장이 위원장을 맡아 총괄한다 국제공동연구 활성화 및 전략적인 투자협력을 위해 과기정통부 기재부 외교부 산업부 복지부 등 관련 주요부처의 실장급 공무원 명이 정부위원으로 참여하게 된다 또한 풍부한 국제협력 경험과 우수한 연구실적을 보유한 국내외 석학을 비롯해 지식재산권 기술이전 국제협력 정책 등 다양한 분야별 전문성을 갖춘 산학연 전문가 명이 민간위원으로 참여해 총 인으로 구성됐다   특히 민간위원은 국내외의 최고의 전문가들이 참여했다 학계에서 참여하는 민간위원 중 주경선 미 코네티컷주립대 교수는 미 에너지부 및 국립과학재단  등을 경험한 고에너지 핵물리학 분야의 세계적인 석학이다 조규진 서울대 교수는 미국 국방성 및 공군연구소 연구과제에 참여한 로봇공학 분야 전문가다 이종일 한국뉴욕주립대 교수는 한국산업기술진흥원 국제기술협력단장 등을 지낸 글로벌 혁신전략 및 국제협력 정책 분야 전문가이다   엄지용  교수는 미국국립연구소 및 호라이즌유럽과 같은 해외 연구 기관과 공동과제의 참여 경험을 갖춘 탄소중립 분야 전문가다 전석우 고려대 교수는 나노소재응용 분야에서 국제공동연구 경험과 원천특허를 보유한 전문가로 국가연구개발 행정제도개선위원회 위원으로도 활동한 바  남좌민 서울대 교수는 과학기술한림원 정회원이자 나노과학기술 분야 세계적 연구자로 세계적 저널인 나노 레터스의 부편집장이다    민상기 미국 위스콘신대 교수는 미 대통령과학기술자문위원회에 참여해 정책을 수립하는 등 국제협력 경험이 풍부한 전문가다 차미영  교수는 기초과학연구원 데이터 사이언스 그룹장으로 빅데이터 계산 분석 및  관련 연구를 진행하며 한국인 최초로 독일 막스플랑크 연구소 단장에 선임된 세계적인 연구자이다  산업계에서 참여하는 민간위원 중 최치호 한국과학기술지주 대표이사는 지식재산전문위원회 위원으로 활동하며 지식재산권 기술사업화 등에서 풍부한 전문성을 갖췄다 이홍락  연구원 최고과학자는 구글 연구조직 구글 브레인 출신으로 세계 대  석학으로 꼽히는 우수 연구자로 꼽힌다 황윤일 제일제당  아메리카 대표 및  대외협력 총괄은 전 최고기술책임자로서  전략 수립 기술협력 등을 총괄한 경험을 갖춘 전문가다   글로벌 특위는 미국 독일 일본 등 세계 각지에서 활발히 연구를 수행하는 위원들도 다수 참여하는 만큼 영상회의를 병행하는 등 분기별로 개최될 예정이다 아울러 글로벌 의 주요 안건에 대한 의견을 폭넓게 수렴하기 위해 자문단을 구성운영하고 신속한 현황 파악 및 실무의견 수렴을 위해 전문기관 협의체도 운영할 계획이다   특위는 또한 지난 월 발표한 글로벌  추진전략의 후속조치로 데이터 기반의 글로벌  전략지도안을 수립했다 구체적으로 글로벌 기술수준 지도에선 논문피인용 상위  논문 수 특허삼극특허 출원 수를 바탕으로 기술 수준 상위 여 개 국가를 선정했으며 기술 유형별 협력전략 지도에서는 한국의 기술 경쟁력 및 기술 발전 주기를 기준으로 가지 협력 유형을 구분해 협력 대상 후보국에 대한 유형별 기술협력 전략을 제시했다   이번 특위에서는 대 국가전략기술 중 이차전지 대 탄소중립기술 중 수소공급 무탄소신전원  총 개 기술 분야에 대한 글로벌  전략지도를 심의했다   류광준 과학기술혁신본부장은 최근 국가간 기술협력이 중요해지고 이에 따라 정부 예산도 대폭 확대한 만큼 글로벌 의 활성화와 체계적인 전략 수립이 필요한 중요한 시기라며 신설된 글로벌  특별위원회를 통해 효율적으로 전략을 수립하고 체계적으로 관리하는 한편 우수한 해외 연구기관과의 교류 활성화를 통해 우리 연구자의 역량을 더욱 극대화하여 세계를 선도하는 과학기술 강국으로 도약할 수  추진해 나가겠다고 밝혔다'
범부처 국제협력  총괄 글로벌  특별위원회 출범|'과기정통부 글로벌 연구개발 특위 차 회의 개최정부 명민간 명이차전지수소공급무탄소 신전원탄소 포집 등  전략지도 수립



과학기술정보통신부과학기술정보통신부 제공서울연합뉴스 조승한   정부의 글로벌 연구개발 정책과 사업을 조정하는 범부처 컨트롤타워인 글로벌  특별위원회가 출범했다    과학기술정보통신부는 일 국가과학기술자문회의 산하 글로벌 특위 제회 회의를 열었다고 밝혔다    글로벌 특위는 지난해 월 정부가 발표한 글로벌  추진전략을 통해 신설됐으며 과학기술혁신본부장이 위원장을 맡아 총괄하고 과기정통부 기재부 외교부 산업부 복지부 등 부처 실장급 공무원 명이 정부 위원으로 참여한다    민간위원으로는 국내외 석학과 분야별 전문성을 갖춘 산학연 전문가 등 명이 참여한다    학계에서는  주경선 미국 코네티컷주립대 교수  조규진 서울대 교수  이종일 한국뉴욕주립대 교수  엄지용 한국과학기술원 교수  전석우 고려대 교수  남좌민 서울대 교수  민상기 미국 위스콘신대 교수  차미영  교수 등이 선임됐다    국내외 연구소 소속 연구자들 가운데는  유정하 독일 막스플랑크연구소 책임연구원  김유수 일본 이화학연구소 주임연구원  손지원 한국과학기술연구원 기술정책연구소장  이승구 한국생명공학연구원 합성생물학연구소장  박호식 한국화학연구원 연구전략본부장이 이름을 올렸다    산업계에서는  최지호 한국과학기술지주 대표이사  이홍락  인공지능연구원 최고과학자  황윤일 제일제당 아메리카 대표 및  대외협력 총괄이 참여한다    이날 글로벌 특위는 데이터를 토대로 기술협력 방향을 설정하는 글로벌  전략지도안을 수립했다    전략지도는 논문과 특허를 바탕으로 기술 수준 상위 여 개 국가를 선정한 글로벌 기술수준 지도와 한국 기술 경쟁력과 기술 발전 주기를 기준으로 협력 유형을 구분해 국가별 기술협력 전략을 제시한 기술 유형별 협력전략 지도로 구성됐다    이번 특위에서는 대 국가전략기술 중 이차전지와 대 탄소중립기술 중 수소 공급 무탄소 신전원 탄소 포집저장활용 등 개 기술 분야에 대한 글로벌  전략지도를 심의했다



이차전지 분야 글로벌  전략지도과학기술정보통신부 제공 재판매 및  금지예를 들어 이차전지 전략지도에는 우리나라의 기술 수준을  리튬이온전지 및 핵심 소재위  차세대 이차전지 소재셀위  이차전지 모듈시스템위  이차전지 재사용재활용위 등으로 분석한 내용이 담겼다    또 리튬이온전지와 소재 모듈시스템은 시장 주도형 차세대 이차전지 소재 재사용재활용은 신기술 확산형 협력 유형으로 분류하고 미국 일본 캐나다 영국 중국 등 국가 등과의 협력 전략도 제시됐다    정부는 글로벌  전략지도를 지속 수립해 범부처 가이드로 활용한다는 계획이다    이외에도 이날 글로벌 특위는 매 분기 개최 자문단 구성 및 전문기관 협의체 운영 등 특위의 운영방안 및 운영세칙안을 심의했다    류광준 과기혁신본부장은 최근 국가 간 기술협력이 중요해지고 이에 따라 정부 예산도 대폭 확대한 만큼 글로벌 의 활성화와 체계적인 전략 수립이 필요한 중요한 시기라며 신설된 글로벌  특별위원회를 통해 효율적으로 전략을 수립하고 체계적으로 관리하는 한편 우수한 해외 연구기관과의 교류 활성화를 통해 우리 연구자의 역량을 더욱 극대화하겠다고 말했다'
이차전지 수소 에너지  글로벌  전략지도 나왔다|'국가과학기술자문회의에 글로벌  특별위원회 설치



이차전지 글로벌  전략지도 중 리튬이온 전지 및 소재 지도 과학기술정보통신부 제공  뉴스서울뉴스 김승준   과학기술정보통신부가 글로벌 연구개발 특별위원회를 출범하고 이차전지 수소 에너지 탄소 포집 및 활용저장 기술 분야 글로벌 현황을 담은 전략지도를 만들었다과기정통부는 국가과학기술자문회의 산하 글로벌  특별위원회 제회 회의를 개최했다고 일 밝혔다글로벌  특위는 과학기술혁신본부장이 위원장을 맡아 총괄하며 국제공동연구 활성화 및 과기정통부 기재부 외교부 산업부 복지부 등 관련 주요 부처의 실장급 공무원 명이 정부위원으로 참여한다아울러 민간 위원으로는 주경선 미국 코네티컷주립대 교수 조규진 서울대 교수 이종일 한국뉴욕주립대 교수 등 국제협력 경험과 연구 실적을 갖춘 국내외 산학연 전문가 명이 참여한다이날 특위는 이차전지 수소공급 무탄소 신전원  분야 글로벌  전략지도안을 심의했다전략지도는 국가별 기술 수준을 분석한 글로벌 기술 수준 지도에서 협력 대상 후보국을 대상으로 한 기술 유형별 협력 전략 지도로 구성됐다이차전지 분야에서 한국은 리튬이온전지 및 핵심 소재 위 차세대 이차전지 소재셀 위 이차전지 모듈시스템 위 이차전지 재사용재활용 위 정도의 수준인 것으로 파악됐다 미국일본캐나다영국중국 등의 국가를 대상으로 초격차 기술 개발 공급망 안정성 확보 등의 협력 전략이 제시됐다수소 분야에서는 수소 생산 위 수소 저장운송 위 해외 수소 저장운송 위 정도도 분석됐다무탄소 신전원 분야에서는 발전용 수소 연료전지 위 수소 혼소전소 위 암모니아 혼소 위 수준으로 나타나 일본영국미국 등의 국가를 대상으로 한 대형 실증 사업 공동 추진 연구시설 공동 활용 등이 제안됐다 분야는 탄소 포집 위 탄소 저장 위 탄소 활용 위 정도의 수준으로 분석됐다앞으로 글로벌  전략지도는 대 국가전략기술과 대 탄소중립기술을 대상으로 지속 수립되며 글로벌  사업 기획추진을 위한 범부처 가이드로 활용된다한편 이번 제회 특위에서는 글로벌 특별위원회 운영방안 및 운영세칙 글로벌  추진 전략 및 이행계획 국가연구개발사업 국제공동연구 매뉴얼안 등이 심의보고됐다'
광명시민 생산 태양광에너지 수익 기후대응기금 적립|'광명시광명시민전력협동조합 일 업무협약 체결시민참여형 재생에너지 보급 활성화 공동 협력



광명시광명시민전력협동조합의 재생에너지 보급과 기금 조성을 위한 업무협약 체결 모습사진 왼쪽 세 번째 전형근 이사장 네 번째 정순욱 광명부시장광명시경기 광명시민의 투자로 생산된 태양광 전력 판매 수익금 일부가 광명시 기후대응기금으로 조성된다광명시는 일 시청에서 광명시민전력협동조합과 재생에너지 보급과 기금 조성을 위한 업무협약을 체결했다 이번 협약에 따라 시는 공공시설물 옥상 및 유휴부지를 임대하고 기후에너지센터를 통해 시민 참여형 재생에너지 보급확대를 위한 행정적인 지원을 강화한다조합은 태양광발전소 건립 후 운영과 유지관리를 위해 노력하고 발전사업에 따른 수익 일부를 오는 년까지 광명시 기후대응기금에 기부한다광명시민전력협동조합은 공유플랫폼 기반 시민주도형 그린뉴딜 사업 추진을 목적으로 지난 년 광명시에서 두 번째로 설립된 에너지 분야 시민참여형 협동조합이다 시민들은 출자를 통해 조합원으로 참여하고 조합은 유휴 옥상 등에 구축한 여러 개의 태양광발전소를 플랫폼 형태로 연결하여 하나의 발전소처럼 운영한다조합은 현재 이 사업을 통해 재활용품선별장호기 국민체육센터호기 보건소호기 시립노인요양센터호기에 태양광발전소를 구축하여 운영하고  기의 태양광발전소에서 연간 만  전기를 생산하고 광명시 기후대응기금은 기후위기 대응 사업 재원과 체계적인 지원 제도를 마련하고 안정적 탄소중립 정책 추진을 위한 것으로 지난 년 월 경기도 지자체 최초로 관련 조례를 별도 제정했다박승원 광명시장은 광명시민이 참여해서 만드는 태양광발전소는 민관 협력 탄소중립 정책의 대표 사례로 이번 협약을 통해 재생에너지 시설이 확대되길 기대한다며 발전 수익이 탄소중립 정책에 재투자되어 탄소중립 선순환 구조를 구축하는 모범 사례가 될 것이라고 밝혔다전형근 광명시민전력협동조합 이사장은 공유플랫폼 기반 시민주도형 그린뉴딜 사업을 통해 구축된 발전소가 안정적으로 잘 운영되고 며 추가 발전소 건립 부지 발굴에 시의 지속적인 협조와 협력을 기대한다고 전했다한편 조합은 태양광발전소 추가 구축을 목표로 광명시 기후에너지센터와 협력하여 부지를 발굴 중이며 조합원과 함께 할 수  기후위기 대응 활동을 확대하고 에너지 취약계층에 대한 사회공헌사업을 계획하고  조합 가입에 관심  광명시민은 기후에너지센터로 문의하면 안내받을 수 발로 뛰는 더팩트는 시간 여러분의 제보를 기다립니다카카오톡 더팩트제보 검색이메일 뉴스 홈페이지 '
차 적게 타면 현금 준대 칠곡군 자동차 탄소중립포인트제 운영|경북 칠곡군청 전경 매일신문 경북 칠곡군은 운전자가 주행거리를 감축했을 경우 현금을 주는 자동차 탄소중립포인트제 참여자를 모집한다일 군에 따르면 자동차 탄소중립포인트제는 운전자가 주행거리를 감축했을 경우 감축 실적에 따라 최대 만원의 인센티브를 지급하는 온실가스 감축 실천 제도이다다음 달 일부터 일까지 명을 선착순 모집한다 대상 차량은 인승 이하 비사업용 승용 승합자동차이다 친환경차량전기수소하이브리드 등 및 법인 단체 차량은 제외된다참여방법은 탄소중립포인트제자동차 홈페이지 및 코드로 회원가입 후 전송되는 문자 로 차량 전면번호판 사진 및 주행거리 계기판 사진 등 증빙자료를 제출하면 된다
전자  최대 주방 전시회서 하이엔드 빌트인 존재감 과시종합|'시그니처 키친 스위트 신제품 공개북미  시장 집중 공략와 전략적 파트너십 체결스마트홈  에이전트 진화 도모



라스베이거스연합뉴스 이지헌 특파원  전자가 일현지시간부터 열리는 북미 최대 규모의 주방욕실 전시회에서 신규 제품군을 선보이며 하이엔드 빌트인 가전시장에 대한 적극적인 공략에 나선다    전자는 미국 라스베이거스에서 열리는 주방욕실 전시회  에 참여해 주택과 일상생활의 패러다임을 바꾸는 혁신적인 제품과 솔루션을 선보인다고 일 밝혔다    는 북미 지역에서 가장 규모가 큰 주방욕실 분야 전시회로 주방욕실 관련 최신 트렌드를 살펴볼 수  인테리어 전문가와 주방 디자이너 건축가들의 관심도가 높은 행사다    전자는 이번 전시에서 북미 지역의 고급 빌트인 가전 시장을 공략하는 데 공을 들였다    북미 지역의 고급 빌트인 가전 시장은 서브제로 울프 서마도 바이킹 등 북미 또는 독일 브랜드들이 석권하고  영역이다 최고급 제품군으로 냉장고 오븐 레인지 식기세척기 와인셀러 등을 한꺼번에 짜맞추면 가격대가 총 억억원을 호가한다    전자는 초 프리미엄 빌트인 가전 라인업의 브랜드인 시그니처 키친 스위트를 통해 점유율 위권 수준에 오르며 고급 빌트인 가전 시장에서 빠르게 영향력을 확대하고     전자는 이번 전시에서 빌더건설업자 시장에서 고려하는 고객 프로필 기반의 패키지와 시그니처 키친 스위트 등 다양한 빌트인 제품군을 선보이며 주거 통합 솔루션을 제공하겠다는 의지를 담았다라고 설명했다



    시그니처 키친 스위트 전시공간에선 무광 스테인리스 재질의 신규 제품군을 대거 선보인다    고메 인공지능 기술이 적용된 오븐도 시장의 기대를 모으고  오븐 내부의 카메라가 식재료를 파악해 다양한 맞춤형 레시피를 추천한다    전자는 이번 전시회에서 넷제로탄소중립 및 전기화에 대응하는 고효율 에너지 기술의 소개도 전면에 내세웠다    인버터 히트펌프를 적용해 에너지 효율을 높인 올인원 세탁건조기 워시콤보가 대표적이다    올해 초 북미에 출시된 워시콤보는 한 달 새 기존 드럼세탁기 대비  이상의 초기 판매량을 거둘 정도로 인기몰이를 하고  전자는 소개했다    지난달  에서 첫선을 보인 스마트홈  에이전트가 이번 전시회에서도 소개된다    스마트홈  에이전트는 일종의 움직이는 스마트홈 허브로 두 바퀴로 고객에게 다가가 세탁 종료를 알려주기도 하는 등 가사도우미 역할을 수행한다    이번 전시회에선  에이전트 이 등장해 고객과 눈을 맞추면서 교감하며 가사를 보조하는 역할을 시연할 예정이다



스마트홈  에이전트 시연라스베이거스연합뉴스 전자는 일현지시간 미국 라스베이거스에서 열리는 주방욕실 전시회  에 참여해 주택과 일상생활의 패러다임을 바꾸는 혁신적인 제품과 솔루션을 선보인다고 일 밝혔다 지난달  에서 첫선을 보인 스마트홈  에이전트가 시연 중인 모습      한편 전자는 마이크로소프트와 전략적 파트너십을 맺고 스마트홈  에이전트가 고객과 더욱 원활하게 소통하도록 진화시킬 예정이라고 밝혔다    우선 이번 전시에서는 애저  스피치 서비스 애저 오픈 등의 기술이 적용된 스마트홈  에이전트의 시연이 이뤄진다     의  기술 적용을 통해 시끄러운 전시장 환경에서도 고객의 음성을 정확히 구분하고 다양한 억양 발음 표현을 파악하도록 지원한다는 계획이다    이번 전시에 참석한 전자 사업본부장 류재철 사장은 지속적인 투자와 연구개발을 통해 혁신적인 제품과 서비스를 선보이며 궁극적으로 가사 해방을 통한 삶의 가치 제고     를 실현할 것이라고 말했다



전자의 시그니처 키친 스위트전자 제공 재판매 및  금지    '
