title|content
한국남동발전포스코홀딩스삼성물산 브랜드 공동개발|'탄소 에너지 비즈니스 모델 개발글로벌 등 수소 강국 선도한국남동발전은 서울 포스코센터에서 포스코홀딩스 삼성물산 건설부문과 무탄소 전원개발 비즈니스 모델 및 브랜드 공동개발에 나서기로 했다고 일 밝혔다 



한국남동발전포스코홀딩스삼성물산 업무협약 체결한국남동발전 제공한국남동발전은 지난 일 서울 포스코센터에서 한국남동발전 이상규 부사장 포스코홀딩스 김준형 친환경미래소재총괄 삼성물산 건설부문 이병수 부사장 등이 참석한 가운데 무탄소 전원개발 사업 협력 강화를 위한 업무협약을 체결했다이번 협약을 통해 사는 해외 청정연료그린수소 등 생산 및 국내 공급 수요처 전력망 구축 및 무탄소 전력 판매 사업 무탄소 전력공급 브랜드 론칭 무탄소 전원 개발사업 및 정책 제언 분야에서 협력을 강화해 나갈 계획이다남동발전은 이번 업무협약을 통해 사별로 보유하고  특화된 사업 능력을 활용해 사업 시너지를 극대화할 것으로 기대하고 이에 포스코홀딩스와 삼성물산 건설부문은 해외 청정연료 개발생산 및 국내 공급을 담당한다또 남동발전과 삼성물산 건설부문은 청정연료를 활용한 무탄소 전력 생산을 위한 협업으로 과 무탄소 에너지를 필요로 하는 수요처를 개발해 판로를 확보하는 사업모델을 만들어갈 예정이다이날 협약을 시작으로 사는 에너지 생태계 전주기를 다루는 본사업을 반복적으로 선순환시켜 무탄소전원을 지속 확충한다이어 생산된 대규모 무탄소 전력을 국내 에 공급함은 물론 글로벌  유치를 통해 확대 공급해 나간다는 계획이다이를 통해 탄소국경조정제도 대상 제품을 생산하는 국내에 무탄소 전력을 공급함으로써 탄소국경조정제도에 대한 선제적 대응과 국가 탄소중립 달성에 크게 기여할 것으로 기대한다남동발전 이상규 안전기술 부사장은 이번 업무협약은 무탄소 전원 개발을 위한 공과 민간의 모범적 사례가 될 것이라며 한강의 기적을 이끌었던 전기 철강 건설 분야 대표주자 인방이 청정기술을 활용해 탄소중립의 기적을 만들어 가길 기원한다고 말했다'
 가축분뇨처리 리바이칸 기술 소개 세미나|'주는 지난 일 대전  호텔 그랜드볼륨에서 주의 리바이칸 기술소개 및 세미나를 가졌다 이번 행사에는 윤춘식  중국 지사장 중국 정부 판사 변호사 겸임과 최홍림  연구소장서울대학교 농생명공학부 명예교수 등 회사 관계자 외 약 여 명이 참석했다는 가축분뇨 에너지화 및 자원화 사업에 신기술을 가지고  으로 지난해 정부가 탄소중립 정책의 일환으로 발표한 축산환경개선대책의 핵심사항인 기존의 퇴액비 중심의 가축분뇨 처리에서 정화방류 확대 및 비농업계 이용 확대 등의 제도개선에 부응하고 



의 리바이칸 기술소개 및 세미나 모습  제공에 따르면 자원순화센터는 미생물 다공성 오니를 이용한 악취 분자의 흡착 기술리바이칸을 통해 악취를 저감하고 생물학적 처리 시간을 대폭 단축하고 특히 지자체와의 협력을 통해 가축분뇨 처리 사업을 확장하고 운영 관리비를 감소시키는 방향으로 나아가고  또한 추가적인 자원순환센터 확충을 위해 지원금을 활용하고 탄소 배출권을 통한 수익 창출과 환경 보호 등의 방안도 제시했다윤춘식  중국 지사장은 자국 축산업 보호를 위해 퇴비를 수출하는 해외사례를 들며 국내 실정에 부합하는 가축분뇨 자원화 및 연료화 방식 등에 다각화를 이루기 위해 최선을 다하겠다고 말했다최홍림  연구소장은 축산 분뇨를 자원화시키고 자원화된 에너지를 순환시켜 다시 농업 축산업 임업 분야에 이용하는 다양한 스마트 농법이 개발되어 성공한 사례가 많다며 이런 경축순환자원화가 미래 농업의 목표이며 더욱 발전시켜야 할 당면과제라고 강조했다'
국민의힘 탄소중립포인트 연간 만만 원 확대 추진| 지난 일 기후 미래 택배 현장 공약 발표하는 한동훈 비대위원장국민의힘이 탄소중립 행동 실천 실적에 따라 지급하는 탄소중립포인트를 연간 최대 만 원으로 확대하겠다고 밝혔습니다당 공약개발본부는 오늘일 국회에서 기후 미래 공약을 발표했습니다탄소중립포인트는 환경부가 텀블러다회용 컵 사용 전자영수증 발급 등 생활 속 탄소중립을 실천하는 국민에게 현금성 포인트를 제공하는 제도로 이 제도에 가입한 국민은 올해 월 기준 만 명입니다당은 현재 연간 최대 만 원인 탄소중립포인트 상한액을 만 원으로 올릴 계획입니다항목별 포인트 금액을 조정하고 자전거 이용 음식물폐기물 감량 등의 항목을 추가해 혜택을 늘리는 방안도 추진합니다현금성 포인트 외 적립되는 포인트를 기후 취약계층에 기부할 수  방안도 마련할 예정입니다아울러 국민의힘은 년까지 무공해차 만 대를 보급하고 관련 보조금을 추가 지원하는 방안도 추진합니다경제적 취약계층이 무공해차를 구입할 때 기본 보조금의  택배업 종사자는 기본 보조금의 를 추가 지원하고 택시업 종사자에게는 만 원을 추가로 지급합니다회 충전 시 주행거리가 길고 충전 속도가 빠른 고성능 전기차 보급을 촉진하기 위해 저성능 전기차 보조금은 대폭 삭감할 예정입니다또 주거지나 직장 등 생활거점에는 완속 충전기를 휴게소 등 이동 거점에는 급속 충전기를 집중 설치할 계획입니다노후 아파트 등 충전기 설치가 어려운 장소에는 신유형 충전기를 운영하고 노후 변압기 교체를 우선 지원합니다장시간 충전으로 화재 위험이  완속 충전기는 모두 화재 예방형 충전기로 바꿔 설치하고 전기차 충전사업자의 무과실 배상책임 보험 가입도 의무화할 방침입니다이와 함께 플라스틱 제품 경량화를 의무화해 년까지 플라스틱 사용을  줄이는 한편 음식점 카페 등 만 곳에 다회용기를 보급하고 전문 선별시설 설치를 확대해 재활용 가능 자원을 적극 회수할 예정입니다사진연합뉴스
산에 갈 때도 전기차워터 북한산에 급속 충전소 오픈|'북한산국립공원 제주차장사기막 야영장에 급속충전 기 설치전기차 급속 충전 네트워크 워터가 연간 만명 이상이 찾는 북한산국립공원에 전기차 충전소를 열었다 워터는 경기도 고양시 덕양구에 위치한 사기막 야영장에 워터 북한산 사기막야영장을 오픈했다고 일 밝혔다



전기차 급속 충전 네트워크 워터가 일 신규 충전소 워터 북한산 사기막야영장을 오픈했다 사진브라이트에너지파트너스이곳에는 초고속 충전기 기 양팔형 대와 완속 충전기 기 등이 설치됐다 총 대의 전기차가 동시에 충전할 수  시설이다 사기막 야영장은 탄소중립형 야영장으로 대기오염 물질 배출이 없는 차량만 출입할 수  전기차라면 야영장을 이용하지 않더라도 충전을 위해 입구에 위치한 워터 충전소에 진입할 수 워터는 앞서 이달 일에도 워터 북한산 제주차장에 급 초고속 충전기 기를 설치한 바  완속 충전기 기도 운영한다워터 전기차 충전 사업을 총괄하고  유대원 브라이트에너지파트너스 최고투자책임자는 도심 속 휴식처를 찾는 북한산 탐방객들이 워터의 급속 충전을 이용하면서 탄소 배출도 줄이고 북한산 생태도 온전히 보호할 수  한다며 무공해 전기차들이 충전 걱정 없이 국립공원을 찾을 수  북한산국립공원에서 급속 충전 시설을 꾸준히 운영해 나가겠다고 말했다'
워터 북한산 야영장에 급속 충전소 연다|'북한산국립공원 제주차장 사기막 야영장에 급속충전 기 설치전기차 급속 충전 네트워크 워터가 연간 만명 이상이 찾는 북한산국립공원 내 사기막 야영장에 전기차 충전소가 마련된다워터는 경기도 고양시 덕양구에 위치한 수도권 최초 국립공원 야영장인 사기막 야영장에 워터 북한산 사기막야영장을 오픈했다고 일 밝혔다워터 북한산 사기막야영장에는 초고속 충전기 기 양팔형 대와 완속 충전기 기 등 총 대의 전기차가 동시에 충전할 수  급속완속 충전시설이 구비된다



워터 북한산 충전소경기 고양시에 위치한 북한산국립공원 사기막 야영장은 서울 근교에 조성된 첫 탄소중립형 야영장이다 사기막 야영장은 무공해차수소전기차와 같이 대기오염물질 배출이 없는 차량만 출입할 수  전기차라면 야영장을 이용하지 않더라도 충전을 위해 입구에 위치한 워터 충전소에 진입할 수 국립공원공단은 북한산국립공원 생태보호를 위해 탄소 발생을 최소화하기로 하고 이같은 방침을 세웠다 북한산국립공원은 한 해 탐방객이 만만명에 이르는 수도권의 유일한 국립공원이다워터는 앞서 이달 일에도 워터 북한산 제주차장에 급 초고속 충전기 기 양팔형 대 총 대 동시충전 가능를 설치한 바 북한산성 입구에 자리한 워터 북한산 제주차장은 인근에 스타벅스 더북한산점이 자리해 급속 충전을 이용하는 분간 편의시설 이용이 가능하다 북한산을 등산하는 동안 충전을 원하는 이용자를 위해 완속 충전기 기도 운영한다



워터안산선부워터 전기차 충전 사업을 총괄하고  유대원 브라이트에너지파트너스 최고투자책임자는 도심 속 휴식처를 찾는 북한산 탐방객들이 워터의 급속 충전을 이용하면서 탄소 배출도 줄이고 북한산 생태도 온전히 보호할 수  한다며 무공해 전기차들이 충전 걱정 없이 국립공원을 찾을 수  북한산국립공원에 급속 충전 시설을 꾸준히 운영해 나가겠다고 말했다이 외에도 워터는 이날 경기 안산시 단원구 소재 쇼핑몰 한양프라자 지상주차장에도 신규 충전소 워터 안산 선부를 열었다워터 안산 선부에는 초고속 충전기 기 양팔형 대와 완속 충전기 기 등 총 대의 전기차가 동시에 충전할 수  급속완속 충전시설이 구비된다전기차 충전소가 입점한 한양프라자는 한양아파트 인근 대형상가 건물로 총 천대가 주차할 수  인근  이내에 홈플러스 이마트트레이더스 롯데백화점 백화점 이마트 롯데마트 등 지역친화형 쇼핑몰이 모두 자리하고  안산의 중심 상권을 형성한다'
